1088610;"CRAYON BOX PRESCHOOL";"44-10 192 STREET";"FLUSHING";"NY";11358;"QUEENS";"718-888-9341";"http://www.crayonboxpreschool.com/";"crayonbox333@aol.com";"The Crayon Box Preschool believes in giving children a foundation of education they can take with them throughout their student years. Preschool is the first place these young students are exposed to a school setting. We have a program that is both welcoming and fun, while stressing the fundamentals of preschool learners.

Our preschool is set up in centers with specific functions in each. These centers enrich children’s senses and allow for many mediums for learning. The children can explore these areas on their own during free time and also have teacher guided times in each.

The daily routine is set up to make children feel secure in knowing what will happen next. When children feel safe and secure in their surroundings, they are free to accept new ideas and concepts.

With all of these factors at work, the students of The Crayon Box Preschool will receive a well rounded education by a professional and dedicated staff.

The school offers a flexible schedule to fit YOUR needs and is payable in monthly installments for your convenience. We look forward to meeting you and if you have any questions, please feel free to contact me at 718-888-9341.";"http://www.crayonboxpreschool.com/";"https://www.facebook.com/CrayonBoxPreschool?ref=ts&fref=ts";;;"http://www.crayonboxpreschool.com/register/index.html";;"n";"n";"y";"y";"n";"n";"http://www.crayonboxpreschool.com/images/CBLogo.gif";"http://www.crayonboxpreschool.com/images/ClassRoom1.jpg";"http://www.crayonboxpreschool.com/images/Gym1.jpg";"http://www.crayonboxpreschool.com/images/Outside1.jpg";"http://www.crayonboxpreschool.com/images/classroom2013a.jpg";;
1088611;"CREATIVE DISCOVERY PRE-SCHOOL";"64-01 102 STREET";"REGO PARK";"NY";11374;"QUEENS";"718-897-5148";;;;;;;;;;;;;;;;;;;;;"Y";
1088612;"CREATIVE YEARS DAY CARE CENTER";"138-72 FRANCIS LEWIS BOULEVARD";"ROSEDALE";"NY";11422;"QUEENS";"718-341-6288";;;;;;;;;;;;;;;;;;;;;"Y";
1088613;"CROSS ISLAND YMCA";"238-10 HILLSIDE AVENUE";"QUEENS VILLAGE";"NY";11427;"QUEENS";"718-551-9313";;;;;;;;;;;;;;;;;;;;;"Y";
1088614;"D'LITTLE STAR EDUCATION & ACTIVITY CENTER";"111-08 SUTPHIN BLVD.";"JAMAICA";"NY";11435;"QUEENS";"718-297-9779";;;;;;;;;;;;;;;;;;;;;"Y";
1088615;"DAYTON TOWERS WEST PLAYGROUP";"105-00 SHORE FRONT PARKWAY";"ROCKAWAY PARK";"NY";11694;"QUEENS";"718-474-8274";;;;;;;;;;;;;;;;;;;;;"Y";
1088616;"DCAIB CENTER";"140-17 243 STREET";"ROSEDALE";"NY";11422;"QUEENS";"718-528-3000";"https://www.facebook.com/pages/DCAIB/182578105265889?sk=info";;"Day Care At Its Best!!! Serving the Rosedale Community for over 9 years... 4 programs... 3 locations!!! (Nursery* Preschool* Afterschool* Summer Program)";"https://www.facebook.com/pages/DCAIB/182578105265889?sk=info";"https://www.facebook.com/pages/DCAIB/182578105265889?sk=info";;;;;"not mentioned in the website";"not mentioned in the website";"not mentioned in the website";"not mentioned in the website";"not mentioned in the website";"not mentioned in the website";"https://scontent-a-lax.xx.fbcdn.net/hphotos-frc3/t1.0-9/945423_182579645265735_1360979144_n.jpg";"https://fbcdn-sphotos-f-a.akamaihd.net/hphotos-ak-xpf1/t1.0-9/1977256_227497620773937_409844255_n.jpg";"https://fbcdn-sphotos-e-a.akamaihd.net/hphotos-ak-xfa1/t1.0-9/10153112_227497804107252_441351249_n.jpg";"https://scontent-b-lax.xx.fbcdn.net/hphotos-xfp1/t1.0-9/10007445_227497244107308_1004167243_n.jpg";"https://fbcdn-sphotos-e-a.akamaihd.net/hphotos-ak-xfp1/v/t1.0-9/10006187_227496977440668_1104917270_n.jpg?oh=43fc3739ad23a12f235726c0878054be&oe=54521D94&__gda__=1413109198_0cb0241e2c94b65833b2ed9b4e3859b7";;
1088617;"DIKI DAY CARE";"30-81 STEINWAY STREET";"ASTORIA";"NY";11103;"QUEENS";"718-278-1570";"http://www.dikidaycare.com/";"dikidaycare@yahoo.com";"Our goal is to provide the safest and happiest environment that will give our children every opportunity to develop to their greatest potential under the caring eyes of our experienced teachers. Our little students will build skills and confidence through games, songs, movement and art. Our teachers provide an outlet for creative expression by encouraging children to play in our child-directed centers to ensure that a child develops at his or her own pace. Sharing, cooperating and taking turns teaches a child the importance of being a team player.";"http://www.dikidaycare.com/";;;;;;"n";"y";"y";"y";"n";"n";"http://www.dikidaycare.com/wp-content/uploads/2014/06/Diki-Daycare-LogoFINAL.png";"http://www.dikidaycare.com/wp-content/uploads/2011/07/Screen-Shot-2014-06-03-at-7.43.22-AM.png";"http://www.dikidaycare.com/wp-content/uploads/2011/07/Screen-Shot-2014-06-03-at-7.43.18-AM.png";"http://www.dikidaycare.com/wp-content/uploads/2011/07/Screen-Shot-2014-06-03-at-7.43.15-AM.png";"http://www.dikidaycare.com/wp-content/uploads/2011/07/Screen-Shot-2014-06-03-at-7.43.25-AM.png";;
1088618;"DIKI DISCOVERY CENTER";"30-16 37TH STREET";"ASTORIA";"NY";11103;"QUEENS";"718-000-0000";"http://www.dikidiscovery.com/learn-more.html";"dikidaycare@yahoo.com";"We are delighted that your child will be attending the Diki Discovery Center. We are very proud of our program and look forward to having your family become part of our pre-school family.
The Diki Discovery Center is a place where Toddlers and preschoolers engage in discovery of the properties of materials and items in their environment. No one can paint a picture of a house before discovering that paint is wet, that it drips, and that it can be spread with fingers and other tools. They need repeated experiences before they are able to use materials symbolically. For example, one cannot build a train with blocks without an understanding that blocks are hard, solid, can be stacked or might fall over if they are not held steady, At Diki Discovery Center; children have many opportunities to pursue in‐depth investigations of materials around them. Our values reflect our belief that children learn best in a rich environment that focuses on the interweaving of cognitive and creative ways of thinking and learning. Our staff is truly committed to working in partnership with you and your child to provide for the highest quality early childhood experience.
I look forward to getting to know both you and your child and sharing a rewarding preschool experience.";"http://www.dikidiscovery.com/learn-more.html";;;;"http://www.dikidaycare.com/upload/pages/Application_Form.pdf";;"n";"y";"n";"n";"n";"n";"http://nebula.wsimg.com/1b8f2e8e5e5985e6f37a2ad4c4bcd224?AccessKeyId=38E6C667171412C38C62&disposition=0&alloworigin=1";"http://nebula.wsimg.com/41e38b59fd3ea70bd2c24a299548a342?AccessKeyId=38E6C667171412C38C62&disposition=0&alloworigin=1";"http://nebula.wsimg.com/23d252999820205b676a01f18f1d7c50?AccessKeyId=38E6C667171412C38C62&disposition=0&alloworigin=1";"http://nebula.wsimg.com/50818f337d589983e0cf1d9c1caac16a?AccessKeyId=38E6C667171412C38C62&disposition=0&alloworigin=1";"http://nebula.wsimg.com/afada38b00fe126346e15dd11b6e8b51?AccessKeyId=38E6C667171412C38C62&disposition=0&alloworigin=1";;
1088619;"DOLLY & FRANK RUSSO SR. FIRST STEP EARLY CHILDHOOD CENTER";"118-03 101 AVENUE";"SOUTH RICHMOND HILL";"NY";11419;"QUEENS";"718-805-7117";;;;;;;;;;;;;;;;;;;;;"Y";
1088620;"DOLLY/FRANK RUSSO/FIRST STEP";"118-01 101 AVENUE";"SOUTH RICHMOND HILL";"NY";11419;"QUEENS";"718-805-7117";;;;;;;;;;;;;;;;;;;;;"Y";
1088621;"EARLY SUNRISE PRESCHOOL AND KINDERGARTEN";"187-08 HILLSIDE AVENUE";"JAMAICA";"NY";11432;"QUEENS";"718-736-9064";;;;;;;;;;;;;;;;;;;;;"Y";
1088622;"EARLY SUNRISE PRESCHOOL&KINDERGARTEN,INC.";"187-10 HILLSIDE AVENUE";"JAMAICA";"NY";11432;"QUEENS";"718-736-9064";;;;;;;;;;;;;;;;;;;;;"Y";
1088623;"ELISHAMA CHILDREN'S PREP SCHOOL";"206-18 HOLLIS AVENUE";"QUEENS VILLAGE";"NY";11429;"QUEENS";"718-468-8744";;;;;;;;;;;;;;;;;;;;;"Y";
1088624;"EMILIA'S KIDS";"84-03 57TH AVENUE";"ELMHURST";"NY";11373;"QUEENS";"718-899-9060";"http://emiliaskids.com/";"tmsanchez@emiliaskids.com";"Emilia’s Kids is a comprehensive Early Childhood Development Center centrally located in Middle Village/Elmhurst, Queens.  EMILIA’S KIDS BELIEVES IN SOCIAL AND EMOTIONAL LEARNING.  We offer DAYCARE SERVICES, FREE UPK, FREE EARLY INTERVENTION SERVICES, and FREE DOE approved speech therapy, physical therapy and occupational therapy to the 0-21 population.

The core of our philosophy has always been “It Takes A Village.”   We have been working with children at this center for over 17 years, providing them with individualized therapy programs in a triad framework of therapist, family and child. We believe in supporting families throughout their various transitions through their child’s educational journey. Our staff of speech therapists, occupational therapists and physical therapists readily interface with social workers, psychologists, service coordinators, special educators, and many other professions in the best interests of each family and the child’s development.

OUR CENTER IS ENGAGING SOCIAL AND EMOTIONAL LEARNING IN OUR CLASSROOMS.";"http://emiliaskids.com/";"https://www.facebook.com/EMILIASKIDS/info";"9am-3pm";"http://emiliaskids.com/?page_id=73";;;"n";"n";"y";"y";"n";"n";"http://emiliaskids.com/wp-content/uploads/2013/09/lo.jpg";"http://emiliaskids.com/wp-content/uploads/2013/08/7.jpg";"http://emiliaskids.com/wp-content/uploads/2013/08/5.jpg";"http://emiliaskids.com/wp-content/uploads/2013/08/6.jpg";"http://emiliaskids.com/wp-content/uploads/2013/08/12.jpg";;
1088625;"FIRST PRESBYTERIAN CHURCH";"41-54 MURRAY STREET";"FLUSHING";"NY";11355;"QUEENS";"718-359-3993";;;;;;;;;;;;;;;;;;;;;"Y";
1088626;"FIRST STAR DAY CARE LEARNING CENTER - INFANT/TODDLER";"145-88 GUY R BREWER BOULEVARD";"JAMAICA";"NY";11434;"QUEENS";"718-528-3363";;;;;;;;;;;;;;;;;;;;;"Y";
1088627;"FLUSHING YMCA EARLY CHILDHOOD PROGRAM";"138-46 NORTHERN BOULEVARD";"FLUSHING";"NY";11354;"QUEENS";"718-551-9356";;;;;;;;;;;;;;;;;;;;;"Y";
1088628;"FOREST HILLS JEWISH CENTER NURSERY SCHOOL AND KINDERGARTEN";"106-06 QUEENS BOULEVARD";"FOREST HILLS";"NY";11375;"QUEENS";"718-263-7000";"http://www.fhjc.org/education/nursery-school-and-kindergarten/";"nursery@fhjc.org";"The Forest Hills Jewish Center provides a complete, well balanced, secular and Jewish education. Our educational methods encourage children to become confident, independent, responsible, and creative thinkers. We integrate our secular studies (language arts, science, music, math) and art activities around the Jewish calendar.

Active learning is the cornerstone to our educational approach. The children participate in exploratory activities that use all their senses; touching, smelling, tasting, seeing and hearing. Using their five senses, the children actively explore and experience their world in a fun and sometimes messy way.

Children are also exposed to pre-reading activities on a daily basis. The presence of visually supportive materials encourages early literacy.

Equally important as active learning is the development of interpersonal skills that will help ensure smooth and productive in the years of learning that lie ahead.";"http://www.fhjc.org/education/nursery-school-and-kindergarten/";"https://www.facebook.com/FHJCNursery";;;;;"y";"y";"y";"y";"n";"y";"http://www.fhjc.org/wordpress/wp-content/uploads/2012/04/fhjc-header-new.gif";;;;;;
1088629;"FOREST HILLS MONTESSORI";"67-04 AUSTIN STREET";"FOREST HILLS";"NY";11375;"QUEENS";"718-275-0173";"http://www.fhmontessorischool.com/contact.html";"fhmontessorischool@verizon.net";"The mission of Forest Hills Montessori School is to provide both creative and stimulating intellectual, artistic, and developmental experiences for children ages 3-12. We strive to cultivate each child's natural desire to learn and to foster his/her natural curiosity and love of knowledge. We are committed to providing a rigorous, classical education that focuses on scholastic achievement. Emphasis is placed on core skills in reading, writing, and mathematics, using a broad repertoire of teaching techniques and technologies. These skills are enhanced by their integration throughout the curriculum. Our faculty creates experiences that foster critical thinking, problem solving, and collaboration. Our educational philosophy is centered on intellectual, physical, and artistic development. Forest Hills Montessori School's size and low student-teacher ratio enable our exceptional faculty to maximize individual attention. Our nurturing, family-oriented environment brings out the joy of learning in each child.";"http://www.fhmontessorischool.com/contact.html";;;;"http://www.fhmontessorischool.com/admission.html";;"n";"n";"y";"y";"y";"n";"http://www.fhmontessorischool.com/images/FHMS-logo-web.png";"http://www.fhmontessorischool.com/images/programs-top-rt-image.jpg";"http://www.fhmontessorischool.com/images/i-bubbles.jpg";"http://www.fhmontessorischool.com/images/ne-top-rt-image.jpg";"http://www.fhmontessorischool.com/images/a-about.jpg";;
1088630;"FOREST HILLS NURSERY AND KINDERGARTEN";"108-56 69 AVENUE";"FOREST HILLS";"NY";11375;"QUEENS";"718-544-3692";"http://www.foresthillsandregoparkschool.com/#!contact/c24vq";;" The purpose of this establishment is to provide for the education of pre-school children. We accept children ages 2-5 years old.  We will seek the social, emotional, and intellectual development of the child.  Pre-school children are at a stage in their lives where a major growth of their intelligence occurs; therefore this is the TIME to give our children a positive foundation that they will have for their future benefit.";"http://www.foresthillsandregoparkschool.com/#!contact/c24vq";;"7:00am to 6:30pm, Monday to Friday";;"http://www.foresthillsandregoparkschool.com/#!application-form/c1ofa";;"n";"y";"y";"y";"n";"n";;"http://www.foresthillsandregoparkschool.com/#!gallery/c1b0d";;;;;
1088631;"FOREST HILLS WEST SCHOOL";"63-25 DRY HARBOR ROAD";"MIDDLE VILLAGE";"NY";11379;"QUEENS";"718-639-9750";"http://www.yai.org/agencies/nyl/nyl-schools/NYL-forest-hills-west-school.html";"rosanne.regan@yai.org";"Our school is located on a tree-lined street directly across from Juniper Valley Park, in the lovely residential neighborhood of Middle Village, Queens, where many teachers and students live. Classrooms are fully equipped and our state of the art outdoor play area is safe and age appropriate. Each child benefits from a program individually tailored to promote their physical, social, emotional and cognitive development.";"http://www.yai.org/agencies/nyl/nyl-schools/NYL-forest-hills-west-school.html";"https://www.facebook.com/yaihope?ref=hl";;"http://www.yai.org/careers/";;;"n";"n";"y";"y";"n";"n";;"https://fbcdn-sphotos-g-a.akamaihd.net/hphotos-ak-xpa1/t1.0-9/10514761_10152452794907517_8318698900405600601_n.jpg";"https://fbcdn-sphotos-a-a.akamaihd.net/hphotos-ak-xpa1/t1.0-9/p180x540/10553500_10152452471792517_7442604283274963304_n.jpg";"https://fbcdn-sphotos-c-a.akamaihd.net/hphotos-ak-xfa1/t1.0-9/10462558_10152400242152517_732358030783086784_n.jpg";"https://fbcdn-sphotos-g-a.akamaihd.net/hphotos-ak-xaf1/t1.0-9/10492575_10152398104677517_8487948271836870037_n.jpg";;
1088632;"FRANCIS CHILD CARE FACILITY";"38-03 FRANCIS LEWIS BLVD.";"FLUSHING";"NY";11358;"QUEENS";"718-229-5357";;;;;;;;;;;;;;;;;;;;;"Y";
1088633;"FRANCIS GRACE DAYCARE";"130-20 MERRICK BOULEVARD";"JAMAICA";"NY";11434;"QUEENS";"718-977-1853";;;;;;;;;;;;;;;;;;;;;"Y";
1088634;"FUTURE LEADERS CENTER INC";"133-13 ROCKAWAY BOULEVARD";"SOUTH OZONE PARK";"NY";11420;"QUEENS";"718-529-8127";;;;;;;;;;;;;;;;;;;;;"Y";
1088635;"GAN EDEN PRE-SCHOOL";"78-15 PARSONS BOULEVARD";"FRESH MEADOWS";"NY";11366;"QUEENS";"718-591-0783";;;;;;;;;;;;;;;;;;;;;"Y";
1088636;"GIL-BLU NURSERY AND KINDERGARTEN";"120-02 MERRICK BOULEVARD";"JAMAICA";"NY";11434;"QUEENS";"718-723-8454";;;;;;;;;;;;;;;;;;;;;"Y";
1088637;"GOOD FOUNDATION KINDERGARTEN";"196-02A LINDEN BOULEVARD";"SAINT ALBANS";"NY";11412;"QUEENS";"718-712-1500";;;;;;;;;;;;;;;;;;;;;"Y";
1088638;"GOOD FOUNDATION PRESCHOOL";"196-04 LINDEN BOULEVARD";"SAINT ALBANS";"NY";11412;"QUEENS";"718-712-1500";"http://goodfoundationacademy.wordpress.com/";"cjfound2@gmail.com";"The goal of Good Foundation Academy For The Gifted Child is to produce happy, intelligent, well-adjusted children. Here you will find a nurturing, educational environment for children of ages 6 weeks to 12 years. Classes include infant, toddler, preschool, kindergarten,and after-school programs.

We recognize that each child has unique talents, learning styles and personalities. Our highly qualified teachers and staff are committed to working within each child’s comfort zone to ensure optimal social, emotional and educational results. Classes are kept at a low student-teacher ratio and often fill up quickly.";"http://goodfoundationacademy.wordpress.com/";"https://www.facebook.com/GoodFoundationAcademy";"Mon-Fri 6:30 am- 6:30 pm";;;;"y";"y";"y";"y";"y";"n";"http://goodfoundationacademy.files.wordpress.com/2013/03/cropped-gfa_800_px1.gif";"http://goodfoundationacademy.files.wordpress.com/2013/03/images-12.jpg?w=223&h=149";"http://goodfoundationacademy.files.wordpress.com/2013/03/images-13.jpg";"http://goodfoundationacademy.files.wordpress.com/2013/03/kids-dreaming-blackwhite.jpg";;;
1088639;"GRACE CHURCH PLAYSCHOOL";"151-17 14 ROAD";"WHITESTONE";"NY";11357;"QUEENS";"718-767-2162";"http://www.gracechurchwhitestone.org/#!playschool/c8k2";;"Serving Whitestone for over 40 years, the Grace Church Playschool provides children ages 2 ½ through 4 years old with a safe learning environment where they develop primary skills such as working with numbers, colors, shapes, and the alphabet. Play is an essential component of the program including both indoor and outdoor games as well as music and movement activities. There is a 5:1 ratio of students to teachers and our educators are world class. Please call the director, Michele Anderson, at (718) 767-2162 for information or to register your child.";"http://www.gracechurchwhitestone.org/#!playschool/c8k2";"https://www.facebook.com/pages/Grace-Episcopal-Church-Whitestone-NY/131914623544663";;;;;"n";"n";"y";"y";"n";"n";;;;;;;
1088640;"GRACE DAY CARE CENTER";"89-00 23 AVENUE";"EAST ELMHURST";"NY";11369;"QUEENS";"718-803-0345";;;;;;;;;;;;;;;;;;;;;"Y";
1088641;"GRACE LUTHERAN CHURCH";"31-20 21 AVENUE";"ASTORIA";"NY";11105;"QUEENS";"718-545-1129";"http://www.gracearoundthecorner.org/";;;"http://www.gracearoundthecorner.org/";;;;;;"y";"y";"y";"y";"y";"n";;"http://www.gracearoundthecorner.org/files/church_flowers020202.jpg";;;;;
1088642;"GRYC LITTLE STARS PRE-K";"62-81 60TH PLACE";"RIDGEWOOD";"NY";11385;"QUEENS";"718-456-5437";;;;;;;;;;;;;;;;;;;;;"Y";
1088643;"GRYC LITTLE STARS PRE-SCHOOL";"59-03 SUMMERFIELD STREET";"RIDGEWOOD";"NY";11385;"QUEENS";"718-456-5437";"http://www.greaterridgewoodyouthcouncil.org/#!about1/c1z94";;"The mission of the Greater Ridgewood Youth Council (GRYC) Inc. is to improve the quality of life for youth and families throughout Western Queens.
As a not-for-profit 501(c)(3), non-sectarian organization that continues to serve youth since 1980, the GRYC is a leader and participant in ongoing efforts in educational, recreational, cultural and employment programs that help youth find new avenues of learning and positive life experiences.";"http://www.greaterridgewoodyouthcouncil.org/#!about1/c1z94";"https://www.facebook.com/thegryc";"Mon - Fri: 7:00 am - 6:00 pm";;;;"n";"n";"n";"n";"y";"y";"http://static.wixstatic.com/media/26f0ca_cac848fa995c4ca69a8c8fa2b5bb8a29.png_srz_p_205_170_75_22_0.50_1.20_0.00_png_srz";"https://scontent-b-lax.xx.fbcdn.net/hphotos-xpa1/t1.0-9/p180x540/1535538_575636695856260_1717323113_n.jpg";"https://fbcdn-sphotos-e-a.akamaihd.net/hphotos-ak-xaf1/t1.0-9/p180x540/1601053_575636459189617_551212702_n.jpg";"https://fbcdn-sphotos-c-a.akamaihd.net/hphotos-ak-xap1/t1.0-9/p180x540/1510413_575635945856335_246969213_n.jpg";"https://scontent-b-lax.xx.fbcdn.net/hphotos-xpa1/v/t1.0-9/p180x540/1513178_575634835856446_2108869773_n.jpg?oh=d73691a3b4bed19443be2ee9540394af&oe=54367D52";;
1088644;"GRYC LITTLE STARS UPK @PANCRAS";"68-20 MYRTLE AVENUE";"RIDGEWOOD";"NY";11385;"QUEENS";"718-456-5437";;;;;;;;;;;;;;;;;;;;;"Y";
1088645;"H.H DAY CARE ANNEX, INC.";"212-47 JAMAICA AVENUE";"QUEENS VILLAGE";"NY";11428;"QUEENS";"718-776-7690";;;;;;;;;;;;;;;;;;;;;"Y";
1088646;"H.H. DAYCARE ANNEX INC.";"188-32 JAMAICA AVENUE";"HOLLIS";"NY";11423;"QUEENS";"718-454-0452";;;;;;;;;;;;;;;;;;;;;"Y";
1088647;"HAMMEL CHILD CARE CENTER";"82-10 ROCKAWAY BEACH BOULEVARD";"FAR ROCKAWAY";"NY";11693;"QUEENS";"718-474-3162";;;;;;;;;;;;;;;;;;;;;"Y";
1088648;"HAN-I PRESCHOOL";"198-18 32ND ROAD";"FLUSHING";"NY";11358;"QUEENS";"718-358-3377";;;;;;;;;;;;;;;;;;;;;"Y";
1088649;"HAPPY BEES DAY CARE";"21-60 33 STREET";"ASTORIA";"NY";11105;"QUEENS";"917-291-9397";"http://www.happybeesdaycare.com/";;"We are one of the happiest, friendliest places in Astoria for families with children from three months to five years old.  At Happy Bees Day Care, we strive to make every day a learning day filled with new and wonderful experiences to help young leaners find what interest and inspires them.

It is our joy and pleasure to help families find just the right early education setting for their children and we’re sure it’s here with us, in a safe and comfortable place where learning is full of fun.";"http://www.happybeesdaycare.com/";"https://www.facebook.com/happybeesdaycareny";"Monday Through Friday 7:30 a.m. to 6:00 p.m.";;;;"y";"y";"y";"y";"n";"n";;"http://www.happybeesdaycare.com/wp-content/uploads/2013/07/Girl-and-Dog-resized.png";"http://www.happybeesdaycare.com/wp-content/uploads/2013/07/Girl-and-Boy.png";"http://www.happybeesdaycare.com/wp-content/uploads/2013/07/Girl-and-Dog-resized.png";"http://www.happybeesdaycare.com/wp-content/uploads/2013/07/Children-Collage.png";;
1088650;"HAPPY 1 DAYCARE";"48-06 212 STREET";"OAKLAND GARDENS";"NY";11364;"QUEENS";"718-229-1910";;;;;;;;;;;;;;;;;;;;;"Y";
1088651;"HAPPY DRAGON CHILDREN'S LEARNING CENTER";"98-25 HORACE HARDING EXPRESSWAY";"CORONA";"NY";11368;"QUEENS";"718-271-5637";"http://hdragon.net/";;;"http://hdragon.net/";;;;;;"y";"y";"y";"y";"y";"y";"http://hdragon.net/wp-content/uploads/2012/11/hdLogo1.png";;;;;;
1088652;"HAPPY DRAGON CHILDREN'S LEARNING CENTER #2";"143-30 CHERRY AVENUE";"FLUSHING";"NY";11355;"QUEENS";"718-445-8382";"http://hdragon.net/";;;"http://hdragon.net/";;;;;;"y";"y";"y";"y";"y";"y";"http://hdragon.net/wp-content/uploads/2012/11/hdLogo1.png";;;;;;
1088653;"HAPPY DRAGON DAYCARE CENTER";"86-02 57 AVENUE";"ELMHURST";"NY";11373;"QUEENS";"718-397-5733";"http://hdragon.net/";;;"http://hdragon.net/";;;;;;"y";"y";"y";"y";"y";"y";"http://hdragon.net/wp-content/uploads/2012/11/hdLogo1.png";;;;;;
1088654;"HAPPY DRAGON PRESCHOOL";"30-04 146 STREET";"FLUSHING";"NY";11354;"QUEENS";"718-446-9021";"http://hdragon.net/";;;"http://hdragon.net/";;;;;;"y";"y";"y";"y";"y";"y";"http://hdragon.net/wp-content/uploads/2012/11/hdLogo1.png";;;;;;
1088655;"HAPPY MARY ANN DAY SCHOOL";"132-18 41ST AVENUE";"FLUSHING";"NY";11355;"QUEENS";"718-886-8266";;;;;;;;;;;;;;;;;;;;;"Y";
1088656;"HEART SHARE HUMAN SERVICES OF NEW YORK PRE-SCHOOL 2";"82-12 151 AVENUE";"HOWARD BEACH";"NY";11414;"QUEENS";"718-848-0300";"http://www.heartshare.org/programs/early-childhood-services/faq.html";"info@heartshare.org";"HeartShare operates high-quality, innovative programs for children, from age 3 to 5, with developmental delays or disabilities. We also provide Universal Pre-K half-day classes for 4-year-old children.

HeartShare firmly believes that the family is the most important influence in a child's life. As a result, our programs emphasize parent education and family involvement. We maintain an open-door policy, and parents are always welcome to visit.";"http://www.heartshare.org/programs/early-childhood-services/faq.html";"https://www.facebook.com/heartshare";"8:30 am to 1:30 pm, Monday through Friday";;;;"n";"n";"y";"y";"n";"n";;"http://www.heartshare.org/media/photo-pro-ear2.jpg";"http://www.heartshare.org/media/gal-pro-ear-1lg.jpg";"http://www.heartshare.org/media/gal-pro-ear-3lg.jpg";"http://www.heartshare.org/media/gal-pro-ear-5lg.jpg";;
1088657;"HEART SHARE SERVICES OF NEW YORK PRESCHOOL 1";"115-15 101 AVENUE";"SOUTH RICHMOND HILL";"NY";11419;"QUEENS";"718-441-5333";"http://www.heartshare.org/programs/early-childhood-services/faq.html";"info@heartshare.org";"HeartShare operates high-quality, innovative programs for children, from age 3 to 5, with developmental delays or disabilities. We also provide Universal Pre-K half-day classes for 4-year-old children.

HeartShare firmly believes that the family is the most important influence in a child's life. As a result, our programs emphasize parent education and family involvement. We maintain an open-door policy, and parents are always welcome to visit.";"http://www.heartshare.org/programs/early-childhood-services/faq.html";"https://www.facebook.com/heartshare";"8:30 am to 1:30 pm, Monday through Friday";;;;"n";"n";"y";"y";"n";"n";;"http://www.heartshare.org/media/photo-pro-ear2.jpg";"http://www.heartshare.org/media/gal-pro-ear-1lg.jpg";"http://www.heartshare.org/media/gal-pro-ear-3lg.jpg";"http://www.heartshare.org/media/gal-pro-ear-5lg.jpg";;
1088658;"HELPING HANDS CHILDREN'S DAY CARE CENTER, INC.";"225-16 LINDEN BOULEVARD";"CAMBRIA HEIGHTS";"NY";11411;"QUEENS";"718-527-6258";;;;;;;;;;;;;;;;;;;;;"Y";
