1088149;"ALL SOULS SCHOOL";"1157 LEXINGTON AVENUE";"MANHATTAN";"NY";10075;"MANHATTAN";"212-861-5232";"https://www.allsoulsschoolnyc.org/";;"All Souls School, an early childhood day school founded in 1965, builds on each child’s strengths, interests and experiences in an intentional, trusting environment that fosters experimentation, learning, and respect.

Our highly experienced and credentialed faculty is committed to nurturing a sense of wonder and to discovering each child’s capabilities and ways of learning. This approach creates the foundation for provisioning the classroom and for curriculum planning. Play is understood as a child’s academic searching and an expression of intelligence and growth. Through the process of their engagement with play, and the project approach to learning - from inquiry, discussion, activity and reflection, to documentation - children can realize endless possibilities for discovering meaning and relationships. In order to achieve this, they are given time and space for exploration and further involvement. Each child is appreciated for his or her contributions to the process.

One-on-one, small group and whole class learning takes place within and beyond the walls of the school, incorporating the natural world and introducing children to broader social and environmental contexts. As they participate fully in their classroom community, children are encouraged to reflect on their work and to become thoughtful, active, and responsible learners. ";"https://www.allsoulsschoolnyc.org/";;;;"http://www.allsoulsschoolnyc.org/admissions/application-process/index.aspx";;"n";"n";"y";"y";"y";"n";;"http://www.allsoulsschoolnyc.org/data/files/gallery/ContentGallery/thumb/sm-img_0771.jpg";"http://www.allsoulsschoolnyc.org/data/files/gallery/ContentGallery/thumb/IMG_3534.jpg";"http://www.allsoulsschoolnyc.org/data/files/gallery/ContentGallery/thumb/img_0442.jpg";"http://www.allsoulsschoolnyc.org/data/files/gallery/ContentGallery/thumb/school.jpg";;
1088150;"AMAC";"25 WEST 17TH STREET";"NEW YORK";"NY";10011;"MANHATTAN";"212-645-5005";"http://www.amac.org/page11.php";"allison.epstein@amac.org";"AMAC is pleased to announce the opening of our center-based Early Intervention Program (EIP), a public program funded by New York State and New York City for children 2 to 3 years of age diagnosed with PDD/Autistic-Spectrum Disorder (ASD). This family-focused EI program is based on the concept that early intervention with parental involvement can make a long-lasting impact on a child's later development that is not possible if services are delayed. The EI classroom will use the Applied Behavior Analysis (ABA) methodology, providing a behavior management structure that will implement intensive and immediate positive reinforcement systems throughout the child’s daily routine.

The classroom will include one teacher, two teaching assistants, and three related service therapists that will provide one-to-one sessions for OT, PT and Speech as mandated on the child’s IFSP. Two separate 2.5-hour sessions are available. Eligibility is determined by state-approved evaluators under contract with NYC. If a child is found eligible, services are identified in collaboration with the parent and must be authorized by the municipality. If you suspect your child or a child you know has delays please refer them to NYC Early Intervention by calling 311 or (800) 577-2229.

Parents are encouraged to take an active role in the program and to participate in partnership with the interventionist team to enhance their child's development. Support groups and family training are offered as part of AMAC’s services in the Early Intervention program. ";"http://www.amac.org/page11.php";;;"http://www.amac.org/page3.php";;;"n";"n";"y";"y";"n";"n";;;;;;;
1088151;"ANTIOCH ACADEMY";"515 WEST 125 STREET";"NEW YORK";"NY";10027;"MANHATTAN";"212-222-2324";;;;;;;;;;;;;;;;;;;;;"Y";
1088152;"BANK STREET COLLEGE FAMILY CENTER";"610 WEST 112 STREET";"NEW YORK";"NY";10025;"MANHATTAN";"212-875-4414";;;;;;;;;;;;;;;;;;;;;"Y";
1088153;"BANK STREET HEAD START";"113 EAST 13 STREET";"NEW YORK";"NY";10003;"MANHATTAN";"212-353-2532";;;;;;;;;;;;;;;;;;;;;"Y";
1088154;"BARNARD COLLEGE CENTER FOR TODDLER DEVELOPMENT";"3009 BROADWAY";"NEW YORK";"NY";10027;"MANHATTAN";"212-854-8271";"http://toddlers.barnard.edu/";"toddlercenter@barnard.edu";"Our Mission

To provide a warm, positive first school experience for parents and children, and a forum for parents and caregivers to discuss and learn about the development of toddlers; to conduct research on early development and parenting; and to educate students about toddler development.

 ";"http://toddlers.barnard.edu/";"https://www.facebook.com/pages/Barnard-College-Center-for-Toddler-Development/443314039078652";;;"http://toddlers.barnard.edu/applying";;"n";"y";"n";"n";"n";"n";"http://toddlers.barnard.edu/sites/default/themes/toddler_sitetheme/logo.png";"http://toddlers.barnard.edu/sites/default/files/images/inline/trainbarnard.jpg";"http://toddlers.barnard.edu/sites/default/files/styles/inline_large/public/images/inline/dsc_0039.jpg";"http://toddlers.barnard.edu/sites/default/files/styles/inline_large/public/images/inline/dsc_0068.jpg";"http://toddlers.barnard.edu/sites/default/files/images/inline/smallertrainyellow.jpg";;
1088155;"BARROW STREET NURSERY SCHOOL AT THE GREENWICH HOUSE INC.";"27 BARROW STREET";"NEW YORK";"NY";10014;"MANHATTAN";"212-633-1203";"http://www.greenwichhouse.org/nursery_school/index";"admissions@greenwichhouse.org";"Barrow Street Nursery School believes the early years are the most productive of a child's life and we challenge our students to excel in ways that fit their own unique development. 

Creativity and artistic expression are developed through individual exploration and group collaboration and provides children with the building blocks of knowledge, thinking and reasoning. 

Barrow Street believes a solid educational foundation includes learning about character and the community. We reinforce the belief that education promotes responsibility and develops character. Beginning with our youngest students, we emphasize respect, responsibility, honesty, and kindness and actively engage our community in school-wide service learning projects that ensure harmonious continuity between children's home and school life.";"http://www.greenwichhouse.org/nursery_school/index";;;;"http://www.greenwichhouse.org/nursery_school/admissions";;"n";"y";"y";"y";"n";"n";"http://www.greenwichhouse.org/images/bsns_logo.gif";"http://www.greenwichhouse.org/nursery_school/IMG_5841.jpg";"http://www.greenwichhouse.org/nursery_school/IMG_4705_New.jpg";"http://www.greenwichhouse.org/nursery_school/MoMA%20Field%20Trip.jpg";"http://www.greenwichhouse.org/nursery_school/hands_admissions.jpg";;
1088156;"BASIC TRUST";"225 WEST 99 STREET";"NEW YORK";"NY";10025;"MANHATTAN";"212-222-6602";"http://www.basictrust.org/";"basictrust@verizon.net";"Basic Trust (BT) is a not-for-profit childcare center committed to providing a safe and loving environment for infants, toddlers and preschool children. Each child is nurtured and supported in a home-like setting with mixed age groupings. We let the children into our lives and together we explore the world as part of a rambunctious family.

Located on the Upper West Side of Manhattan on the garden level of St. Michael’s Church, we run a full day program serving children ages three months to 5 years, 8:00 am to 5:45 pm, Monday through Friday, 50 weeks a year.

There are three rooms at Basic Trust.  Our Baby Room has 9 infants daily, ages three months to 18 months, with three full time teachers. Our Toddler Room has 11 toddlers, ages 18 months to three years, with three full time teachers. Our Big Kids Room has 18-20 children ages 3-5 years with 4 full time teachers.";"http://www.basictrust.org/";;"8:00 am to 5:45 pm";;"http://www.basictrust.org/contact.html";;"y";"y";"y";"y";"n";"n";"http://www.basictrust.org/uploads/3/1/2/6/3126969/1396825567.png";"http://www.basictrust.org/uploads/3/1/2/6/3126969/9600078.jpg";"http://www.basictrust.org/uploads/3/1/2/6/3126969/5966923.jpg";"http://www.basictrust.org/uploads/3/1/2/6/3126969/2510690.jpg";"http://www.basictrust.org/uploads/3/1/2/6/3126969/4999442.jpg";;
1088157;"BATTERY PARK CITY DAY NURSERY";"215 SOUTH END AVENUE";"NEW YORK";"NY";10280;"MANHATTAN";"212-945-0088";"http://www.bpcdaynursery.com/";"info@bpcdaynursery.com";"Battery Park City Day Nursery accepts each child as an individual. Cultural differences and the uniqueness of each child are recognized and respected.

Creative expression is encouraged through play and classroom activities. With commitment and affection, we develop a love for learning and the desire to become life long achievers. Our school is a safe, nurturing, compassionate, learning environment.

Children, parents, and teachers are mutually respected and trusted. Our professional and dedicated teachers encourage each child to be confident of his or her abilities and sensitive to the needs of others. We provide a well-balanced and developmentally appropriate curriculum which encourages social growth. We value open communication with parents which helps reinforce what is learned at home and in school. ";"http://www.bpcdaynursery.com/";;"8am-6pm";;"http://www.bpcdaynursery.com/application.html";;"n";"y";"y";"y";"n";"y";"http://www.bpcdaynursery.com/images/heartRO.png";"http://www.bpcdaynursery.com/images/buildingfront.jpg";;;;;
1088158;"BATTERY PARK MONTESSORI";"21 SOUTH END AVENUE";"NEW YORK";"NY";10280;"MANHATTAN";"212-913-9704";"http://www.bpmpreschool.com/";"info@greenivy.com";"We embrace nature as a dominant theme and seek opportunities for our children to explore and learn about nature in one of Manhattan’s most beautiful landscapes.

At Battery Park Montessori, we promote a learning environment that is warm, joyful, nurturing and filled with opportunities for personal and collaborative creativity. ";"http://www.bpmpreschool.com/";"https://www.facebook.com/BPMPreschool";"9am-3pm";;"http://www.bpmpreschool.com/admissions.html";;"n";"y";"y";"y";"y";"n";"http://www.bpmpreschool.com/uploads/1/5/1/7/15172896/1398048185.png";"http://www.bpmpreschool.com/uploads/1/5/1/7/15172896/4099143.png?649";"http://www.bpmpreschool.com/uploads/1/5/1/7/15172896/2452946_orig.png";"http://www.bpmpreschool.com/uploads/1/5/1/7/15172896/3975615_orig.png";"http://www.bpmpreschool.com/uploads/1/5/1/7/15172896/9548516_orig.png";;
1088159;"BEGINNINGS NURSERY";"130 EAST 16TH STREET";"NEW YORK";"NY";10003;"MANHATTAN";"212-228-5679";"http://www.beginningsnursery.net/Home.aspx";"info@beginningsnursery.net";"Beginnings Nursery School is a community of children, families and teachers committed to learning and growing through a process of research and discovery. We aim to create a nurturing and stimulating environment in which children's curiosity is respected, creativity valued, and collaborations supported. We seek to strengthen our connection to resources in our world, including our community, neighborhood, city, and natural and found materials. Our hope is that during their time at Beginnings and beyond, children will deepen their love of learning, develop a thoughtful awareness of themselves and others, and have the confidence to pursue their passions.  ";"http://www.beginningsnursery.net/Home.aspx";;"8:30am-2pm";;"http://www.beginningsnursery.net/Admissions.aspx";;"n";"y";"y";"y";"n";"n";;"http://www.beginningsnursery.net/Slide.aspx";;;;;
1088160;"BEIS SHLOMO ZALMEN DAY CARE CENTER";"262 DELANCEY STREET";"NEW YORK";"NY";10002;"MANHATTAN";"212-475-1860";;;;;;;;;;;;;;;;;;;;;"Y";
1088161;"BELLEVUE EDUCARE CHILD CARE CENTER (I/T PROGRAM)";"462 FIRST AVENUE";"NEW YORK";"NY";10016;"MANHATTAN";"212-679-2393";"http://www.bellevue-educare.org/";"information@bellevue-educare.org";"Bellevue Day Care Center Inc., the sponsor of Bellevue-Educare Childcare Center, was founded in 1971 by the members of the Bellevue Hospital Auxiliaries to serve the child care needs at the hospital and in the surrounding community. The Board of Directors is a unique non-profit organization. A majority of its members are parents of children enrolled in the center. Others members of the board include representatives from Bellevue Hospital.

Auxiliaries and the community at large. The Board maintains an effective liaison with the Executive Director of the Centers and has active involvement in ongoing operations. Strong parental involement on the Board has led Bellevue-Educare Childcare Center to be recognized as one of the best programs in New York City. The programs sponsored by the Board are well known and often utilized by public services and educational media groups as an institution which represents optimal early childhood education. The growth of the organization has marked Bellevue Day Care Center, Inc. as a leader in the New York City community. The Vision of the Board extends into the future, including the possibility of expanding the programs to elder care.";"http://www.bellevue-educare.org/";"https://www.facebook.com/bellevue.educare?fref=ts";"Monday-Friday 7am-6pm";;"http://bellevue-educare.org/enrollment_tuition.html";;"y";"y";"y";"y";"n";"n";"http://www.bellevue-educare.org/logo/24hrlogo.png";;;;;;
1088162;"BELLEVUE SOUTH NURSERY SCHOOL";"10 WATERSIDE PLAZA";"NEW YORK";"NY";10010;"MANHATTAN";"212-684-0134";"http://www.bsnurseryschool.org/";" bsns10@aol.com";"Bellevue South Nursery School began in 1968 in the carriage room of the Nathan Strauss houses on East 28th Street. Named after a nearby park, the school relocated six years later to its present location in Waterside. Here, the nursery school has developed a fine reputation that reaches beyond the Waterside community into the New York educational community.

At Bellevue South Nursery School, we welcome parents into the community. In our experience, children become more eager learners when parents actively support the educational process. Bellevue South provides parents with the opportunity to meaningfully encourage the early education of their children.

Philosophically, we draw on multiple outlooks, believing that just as each child is different, so too our classroom should reflect different learning styles, rather than rigidly adhering to one pedagogical approach. We love Montessori manipulatives and independent learning, and we also believe in listening to each child and engaging them where they're at, as does the Reggio Emilia approach. We
believe strongly in the power of play, and in the individual relationships between students and teachers. Our wonderful teacher/student ration allows us to engage students on an individual basis. Our bright and sunny physical space creates a happy place for children to learn, explore, and develop.       ";"http://www.bsnurseryschool.org/";;"8:45am-3:45pm";;"http://www.bsnurseryschool.org/";;"y";"y";"y";"y";"n";"y";"http://www.bsnurseryschool.org/images/bs.jpg";"http://www.bsnurseryschool.org/images/home5.jpg";"http://www.bsnurseryschool.org/images/home2.jpg";"http://www.bsnurseryschool.org/images/home4.jpg";"http://www.bsnurseryschool.org/images/home1.jpg";;
1088163;"BIRCH FAMILY SERVICES - MANHATTAN EARLY CHILDHOOD CENTER";"554 FORT WASHINGTON AVENUE";"NEW YORK";"NY";10033;"MANHATTAN";"212-740-5157";"http://www.birchfamilyservices.org/education/manhattan.html";;"We are a vibrant, community program located in a beautiful neighborhood in Washington Heights. The majority of our staff reside in the larger neighborhood and are typically bilingual, speaking both Spanish and English. We have a large, diverse group of talented special educators and clinicians who provide a warm, nurturing environment for our young students to thrive in. Our classrooms are rich in technology, literacy based programs, visual supports, music therapy, gardening and nutritional instructional supports.";"http://www.birchfamilyservices.org/education/manhattan.html";;"8:15 A.M. to 1:45 P.M.";"http://www.birchfamilyservices.org/career/index.html";;;"n";"n";"n";"y";"y";"n";"http://www.birchfamilyservices.org/images/global/logo.gif";"http://www.birchfamilyservices.org/images/sidebars/education/manhattan.jpg";;;;;
1088164;"BLOOMINGDALE FAMILY PROGRAM HEAD START";"987 COLUMBUS AVENUE";"NEW YORK";"NY";10025;"MANHATTAN";"212-665-4631";"http://www.bloomingdalefamilyprogram.org/forfamilies.html";;"The Bloomingdale Family Program serves 180 three-year-old and four-year-old children at three sites: 125 West 109th Street, 171 West 107th Street, and 987 Columbus Avenue (between 108th and 109th Streets). There are no charges for the program.

We offer an enriched early childhood curriculum that addresses the abilities and needs of each child. Children who can benefit from individual help receive one-to-one speech, occupational, and play therapy as part of their school experience. To ensure that our children continue to succeed and thrive after Bloomingdale, we offer after-school tutoring and support through the elementary grades.

Our classrooms are bilingual in Spanish and English, and our families represent many different backgrounds and nationalities. Our Social Service staff focuses on the needs and aspirations of parents and helps parents take advantage of opportunities for education, training and employment. More than two-thirds of Bloomingdale's staff began as parents and earned their professional credentials with our help.
";"http://www.bloomingdalefamilyprogram.org/forfamilies.html";;;;"http://www.bloomingdalefamilyprogram.org/apply.html";;"n";"n";"y";"y";"n";"n";"http://www.bloomingdalefamilyprogram.org/images/logo.jpg";"http://www.bloomingdalefamilyprogram.org/images/4805_013.jpg";"http://www.bloomingdalefamilyprogram.org/images/6707_072.jpg";"http://www.bloomingdalefamilyprogram.org/images/2908_024.jpg";"http://www.bloomingdalefamilyprogram.org/images/0906_098.jpg";;
1088165;"BLOOMINGDALE FAMILY PROGRAM";"171 WEST 107 STREET";"NEW YORK";"NY";10025;"MANHATTAN";"212-663-4070";"http://www.bloomingdalefamilyprogram.org/forfamilies.html";;"The Bloomingdale Family Program serves 180 three-year-old and four-year-old children at three sites: 125 West 109th Street, 171 West 107th Street, and 987 Columbus Avenue (between 108th and 109th Streets). There are no charges for the program.

We offer an enriched early childhood curriculum that addresses the abilities and needs of each child. Children who can benefit from individual help receive one-to-one speech, occupational, and play therapy as part of their school experience. To ensure that our children continue to succeed and thrive after Bloomingdale, we offer after-school tutoring and support through the elementary grades.

Our classrooms are bilingual in Spanish and English, and our families represent many different backgrounds and nationalities. Our Social Service staff focuses on the needs and aspirations of parents and helps parents take advantage of opportunities for education, training and employment. More than two-thirds of Bloomingdale's staff began as parents and earned their professional credentials with our help.
";"http://www.bloomingdalefamilyprogram.org/forfamilies.html";;;;"http://www.bloomingdalefamilyprogram.org/apply.html";;"n";"n";"y";"y";"n";"n";"http://www.bloomingdalefamilyprogram.org/images/logo.jpg";"http://www.bloomingdalefamilyprogram.org/images/4805_013.jpg";"http://www.bloomingdalefamilyprogram.org/images/6707_072.jpg";"http://www.bloomingdalefamilyprogram.org/images/2908_024.jpg";"http://www.bloomingdalefamilyprogram.org/images/0906_098.jpg";;
1088166;"BMCC EARLY CHILDHOOD CENTER,INC.";"199 CHAMBERS STREET";"NEW YORK";"NY";10013;"MANHATTAN";"212-220-8250";;;;;;;;;;;;;;;;;;;;;"Y";
1088167;"BOYS & GIRLS HARBOR PRESCHOOL";"1 EAST 104 STREET";"NEW YORK";"NY";10029;"MANHATTAN";"212-427-2244";"https://www.theharbor.org/our-programs/education/preschool";"pterry@theharbor.org";"The Harbor’s long-term strategic vision is to expand the footprint of our educational programs in the Heckscher building, with a keen focus on early childhood education. A primary strategy is to provide a best-in-class Preschool to address the achievement gap for preschool-age children.";"https://www.theharbor.org/our-programs/education/preschool";"https://www.facebook.com/Boys.Girls.Harbor";" 8 a.m.–6 p.m., year-round, full day";"https://www.theharbor.org/make-contact/careers";;;"n";"y";"y";"y";"y";"n";"https://www.theharbor.org/images/logo.gif";"https://scontent-a-sjc.xx.fbcdn.net/hphotos-xpa1/t1.0-9/q77/s720x720/936071_670078616404825_7039764847079639898_n.jpg";"https://fbcdn-sphotos-b-a.akamaihd.net/hphotos-ak-xfp1/t1.0-9/q80/s720x720/10388193_670078589738161_9024678946363386072_n.jpg";"https://fbcdn-sphotos-g-a.akamaihd.net/hphotos-ak-xpa1/t1.0-9/q75/s720x720/10526086_670078596404827_5558062154357421281_n.jpg";"https://fbcdn-sphotos-f-a.akamaihd.net/hphotos-ak-xap1/t1.0-9/q75/s720x720/10487264_670078626404824_5469048820841447739_n.jpg";;
1088168;"BRIGHT BEGINNINGS NYC LLC";"80 BEEKMAN STREET";"NEW YORK";"NY";10038;"MANHATTAN";"347-948-7130";"http://brightbeginningsnyc.com/";" info@brightbeginningsnyc.com";"Bright Beginnings NYC is a New York State licensed Preschool and Childcare Facility serving families in the downtown NYC area. As the only preschool in the Financial District that is operated jointly by parents and teachers, our goal is to provide the highest quality of early childhood education and care for your children at affordable rates. Through our committed parent-teacher partnership, we have designed a fun, creative and enriching environment that will ease and guide your children through their transition from the home setting into a social learning experience. We started Bright Beginnings NYC because we passionately believe that a positive preschool experience is the vital stepping stone to building a bright future – and we are honored that you’ve chosen us to be the first stepping stone in your child’s journey.";"http://brightbeginningsnyc.com/";"https://www.facebook.com/BrightBeginningsNYC";;;"http://brightbeginningsnyc.com/admissions/";;"not mentioned in the website";"not mentioned in the website";"not mentioned in the website";"not mentioned in the website";"not mentioned in the website";"not mentioned in the website";"http://brightbeginningsnyc.com/wp-content/uploads/2013/10/cropped-BrightBeginnings-Logo-1170W-withaddress.png";;;;;;
1088170;"BRIGHT HORIZONS @ 575 LEXINGTON AVE.";"575 LEXINGTON AVENUE";"NEW YORK";"NY";10022;"MANHATTAN";"212-758-6262";;;;;;;;;;;;;;;;;;;;;"Y";
1088171;"BRIGHT HORIZONS AT PEARL STREET";"128 PEARL STREET";"NEW YORK";"NY";10005;"MANHATTAN";"212-422-5222";;;;;;;;;;;;;;;;;;;;;"Y";
1088172;"BRIGHT HORIZONS AT ROCKEFELLER CENTER";"600 FIFTH AVENUE";"NEW YORK";"NY";10020;"MANHATTAN";"212-332-8181";;;;;;;;;;;;;;;;;;;;;"Y";
1088173;"BRIGHT HORIZONS AT 200 PARK AVENUE INFANT TODDLER";"200 PARK AVENUE";"NEW YORK";"NY";10017;"MANHATTAN";"212-286-5437";;;;;;;;;;;;;;;;;;;;;"Y";
1088174;"BRIGHT HORIZONS AT THE OCTAGON";"888 MAIN STREET";"NEW YORK";"NY";10044;"MANHATTAN";"212-750-5301";"http://child-care-preschool.brighthorizons.com/NY/RooseveltIsland/octagon/";;"Bright Horizons is the world's leading provider of employer-sponsored child care, back-up care, education and work/life solutions with more than 700 child care and early education programs and schools for employers and working families across the US, UK, Ireland and Canada. Committed to creating great work environments for its 18,000 employees, the company has been named 12 times as one of FORTUNE magazine's ""Best Companies to Work for in America.""

Bright Horizons provides work/life solutions for more than 800 leading employers to help them address challenges across key life stages. Programs include child care, back-up care, college counseling, elder care, and work/life consulting.

The first few years of life are an extraordinary time that sets the stage for all the years that follow. Our program for learning creates educational environments that empower children to be confident, successful, lifelong learners and socially responsible citizens. Bright Horizons' innovative programs help children, families, and employers work together to be their very best.";"http://child-care-preschool.brighthorizons.com/NY/RooseveltIsland/octagon/";"https://www.facebook.com/brighthorizons";"M-F: 7:30 a.m. to 6:30 p.m. ";"http://www.brighthorizons.com/careers";;;"y";"y";"y";"y";"n";"n";"http://child-care-preschool.brighthorizons.com/BH/Centers/includes/images/bh-logo.png";"http://child-care-preschool.brighthorizons.com/~/media/bh/centers/960x409/marquee10.ashx?bc=ffffff&h=409&thn=0&w=960";"http://child-care-preschool.brighthorizons.com/~/media/bh/centers/960x409/marquee12.ashx?bc=ffffff&h=409&thn=0&w=960";"http://child-care-preschool.brighthorizons.com/~/media/bh/centers/960x409/marquee10.ashx?bc=ffffff&h=409&thn=0&w=960";"http://child-care-preschool.brighthorizons.com/~/media/bh/centers/960x409/marquee5_alt.ashx?bc=ffffff&h=409&thn=0&w=960";;
1088175;"BRIGHT HORIZONS TIMES SQUARE";"4 TIMES SQUARE";"NEW YORK";"NY";10036;"MANHATTAN";"212-840-3336";;;;;;;;;;;;;;;;;;;;;"Y";
1088176;"BRIGHT HORIZONS AT 75 ROCKEFELLER PLAZA";"75 ROCKEFELLER PLAZA";"NEW YORK";"NY";10019;"MANHATTAN";"212-757-2301";;;;;;;;;;;;;;;;;;;;;"Y";
