1088351;"RENAISSANCE VILLAGE";"220 CABRINI BOULEVARD";"NEW YORK";"NY";10033;"MANHATTAN";"212-928-7855";"http://www.renvillage.com/contact.html";"info@renvillage.com";"Renaissance Village Family Learning Center has as its focus the entire family, providing Montessori Nurseries for children and other activities that enhance well being and parenting skills for adults. Our goal is to help create and support happy, secure families. Our mission is to support the parent as the child’s primary teacher.
 
Renaissance Village is a member of American Montessori Society and licensed by New York City Department of Health.
 
The founder of Renaissance is Dr. Tatjana Matano, fourth generation educator originally from Eastern Europe. Tatjana has over twenty years of experience in education as University teacher, trainer in whole brain and accelerated learning for adults and as an early childhood educator. In 2001, after the birth of her second child, she started a special, enriched Nursery program in Hudson Heights in Manhattan which evolved into a Montessori center by 2007. As a mother of two children she herself knows the struggles of parenting and the importance of choosing the right educational environment during early years.
 
Tatjana has assembled a team of devoted teachers and assistants who share her own dedication to the early childhood as the most important period for the fulfillment of one’s potential and who also share her dedication to parenting community as a whole. The Education Director and Head Teacher of Renaissance Village is Ms. Jean Caswell, a veteran of Montessori teaching with over 35 yrs of experience. Ms. Olga Schmukler is her partner, an early childhood educator with outstanding talents in the areas of Music and Art and with over 20 yrs of experience in the classroom. She combines Russian Music pedagogy with Montessori principles . Our program has two more teachers and two assistants who make sure the Montessori philosophy of respect and trust in the child is present throughout the day and beyond the class time.
 
Dr. Matano and Ms. Caswell are dedicated to continuous and thorough training of the entire staff in the principles of Montessori work. They also offer parenting workshops and have developed a nine month program (sept-june) for families entitled “The Joyful Family” which elaborates on all the aspects of family life through the lens of Montessori approach. In addition, the Assistants are trained in Health and Safety, CPR, First Aid, Control of Infectious Disease, Child Abuse Prevention and Food Protection.";"http://www.renvillage.com/contact.html";;"Monday-Friday 8:00 am-6:00 pm. ";;;;"y";"y";"y";"y";"y";"y";;"http://www.renvillage.com/images/daycareimage.gif";"http://www.renvillage.com/images/aboutimg_1.jpg";"http://www.renvillage.com/images/nurseryimg_1.jpg";;;
1088352;"RENANIM MANHATTAN, INC.";"336 EAST 61 STREET";"New York";"NY";10065;"MANHATTAN";"212-750-2266";"http://www.renanimpreschool.com/contact.asp?location=1";"renanimny@gmail.com";"RENANIM is our name. In Hebrew ""Renanim"" means happiness. We offer an excellent preschool education in an atmosphere of happiness and joy for children 18 months to 6 years old. We started in Israel and now operate in Manhattan and in Riverdale. With over 45 years of experience, we have a lot to offer your child.  RENANIM provides a caring, nurturing and stimulating environment where your child will learn through developmentally appropriate activities. We strive to build confidence and self-esteem, fostering active learning through exploration and inquiry. Our classes are organized according to age. While the programs for the younger children differ from those for the older children, the curriculum for all of the children is designed to encourage them to participate in creative activities, and activities that promote language and speech. ";"http://www.renanimpreschool.com/contact.asp?location=1";"https://www.facebook.com/renanim.preschool";"8:30am - 6:00pm";;;;"n";"y";"y";"y";"n";"n";;"https://lh4.googleusercontent.com/-4zK8S2DzMJI/TlMeGWd3WoI/AAAAAAAAAV0/mqgtEvRzkrA/s480/DSCN1161.JPG";"https://lh6.googleusercontent.com/-vtjpbh-4Cm4/TlMeF2UnRNI/AAAAAAAAAVk/BvV3GnrWCpI/s480/DSCN1166.JPG";"https://lh5.googleusercontent.com/-Iuqp3DjgGCc/TlMeF_NapQI/AAAAAAAAAVg/ffSVGGEeB80/s480/DSCN1175.JPG";"https://lh5.googleusercontent.com/-6I2IGKaF-5U/TlMdsLNdzbI/AAAAAAAAAVI/GwQ2YetRuNo/s480/DSCN1079.JPG";;
1088353;"RHINELANDER CHILDREN'S AID SOCEITY";"350 EAST 88 STREET";"NEW YORK";"NY";10128;"MANHATTAN";"212-876-0500";"http://www.childrensaidsociety.org/rhinelander-childrens-center";"Jacquelinek@childrensaidsociety.org";"The Rhinelander Nursery School, located in the Yorkville neighborhood, is a community of families and teachers who are committed to fostering an early love of learning and school.
(Ages 2 1/2-5)

At Rhinelander, the emphasis is on nurturing the needs of each child within a group setting. Our child-centered approach supports language and literacy development, social and emotional growth and creative thinking. We believe learning should be fun and employ a play-based, multi-sensory approach. Children develop their skills and senses differently — some need to ""see it""; some need to ""hear it""; others need to ""try it"". Our multi-faceted lesson plans address diverse learning styles.";"http://www.childrensaidsociety.org/rhinelander-childrens-center";"https://www.facebook.com/ChildrensAidNYC";"Mon - Fri: 8:00 am - 6:00 pm";;"http://www.childrensaidsociety.org/rhinelander-childrens-center/nursery-school/admissions";;"n";"y";"y";"y";"y";"y";;"http://www.childrensaidsociety.org/files/imagecache/feature-image/images/header-images/centers/faces.jpg";"http://www.childrensaidsociety.org/files/imagecache/header-image/images/header-images/photo%20%2823%29.JPG";"http://www.childrensaidsociety.org/files/imagecache/feature-image/images/header-images/center-topics/10-15-12%20pk%203.jpg";"http://www.childrensaidsociety.org/files/imagecache/feature-image/images/header-images/center-topics/photo%20%2816%29.JPG";;
1088354;"RITA GOLD EARLY CHILDHOOD CENTER";"525 WEST 120TH STREET BOX 98";"NEW YORK";"NY";10027;"MANHATTAN";"212-678-3013";"http://www.tc.columbia.edu/ritagold/";"recchia@tc.edu";"Founded in 1982 by Leslie Williams and Annette Axtmann as the Center for Infants and Parents (CIP), the Center has long been providing quality early care and education for the youngest children and their families and professional preparation for graduate students whose studies focus on infancy. Over the years and with the support of Teachers College, the Center has grown from one part-time infant toddler room, primarily serving children of TC graduate students, into a more comprehensive service program providing full-time and year-round care and education.

We now serve children from 2 months through 5 years of age whose families are currently affiliated with Columbia University as students, staff, or faculty. Early care and education is provided in three rooms, each with a mixed-age group of children. Adaptability to meet a wide variety of developmental needs is built into the program. The Center's growth and development has also been supported through the gifts of many kind and generous donors. We are grateful to Rita and Herbert Gold for their support of our most recent expansion.";"http://www.tc.columbia.edu/ritagold/";;"Monday through Thursday, 8:45am-5pm, and Fridays 8:45am-3pm";;"http://www.tc.columbia.edu/ritagold/index.asp?Id=Admissions&Info=Enrollment";;"y";"y";"y";"y";"n";"n";"http://www.tc.columbia.edu/ritagold/styles/images/RitaGold_Header.jpg";"http://www.tc.columbia.edu/i/a/29028_child_reading.jpg";"http://www.tc.columbia.edu/i/a/28658_hands.jpg";"http://www.tc.columbia.edu/i/a/29646_infant_room_photo.jpg";"http://www.tc.columbia.edu/i/a/29065_child_drawing.jpg";;
1088355;"RIVER PARK NURSERY SCHOOL AND KINDERGARTEN";"711 AMSTERDAM AVENUE";"NEW YORK";"NY";10025;"MANHATTAN";"212-663-1205";"http://www.riverparknurseryschool.com/";"riverparkns@verizon.net";"For more than 30 years, River Park Nursery School has been nurturing the young children of the Upper West Side community - preparing them with the skills necessary to move confidently between the family and the wider world of learning in society.

Our core goal is the individual growth and the development of the whole child - creatively, socially, emotionally, and intellectually. We meet each child at his or her own level and pace, then guide and build from there. Through this personal approach a sense of trust, dignity and self-respect is strengthened. ";"http://www.riverparknurseryschool.com/";;;;"http://www.riverparknurseryschool.com/admissions.html";;"n";"n";"y";"y";"n";"n";"http://www.riverparknurseryschool.com/images/logo.gif";"http://www.riverparknurseryschool.com/images/frontpage_1.jpg";"http://www.riverparknurseryschool.com/images/frontpage_2.jpg";"http://www.riverparknurseryschool.com/images/philosophy_1.jpg";"http://www.riverparknurseryschool.com/images/Curriculum_1.jpg";;
1088356;"RIVER SCHOOL - WESTSIDE (INFANT/ TODDLER)";"75 WEST END AVENUE";"NEW YORK";"NY";10023;"MANHATTAN";"212-707-8300";;;;;;;;;;;;;;;;;;;;;"Y";
1088357;"RIVERSIDE MONTESSORI SCHOOL";"202 RIVERSIDE DRIVE";"NEW YORK";"NY";10025;"MANHATTAN";"212-665-1600";"https://www.twinparks.org/riverside/contact-us/";"rmoffice@twinparks.org";"Our mission is to nurture children in a child-centered setting that fosters the growth of confident, caring, and successful children. Each of our three preschools in Manhattan’s Upper West side provides a gentle, secure environment. Each helps children learn how to learn. And each lays a firm foundation for building a dynamic community of life-long learners.

Twin Parks Montessori is the largest accredited Montessori program in Manhattan and the only Infant Toddler Program in New York State to be accredited by both the American Montessori Society (AMS) and the Middle States Commission on Elementary Schools (MSCES). Twin Parks Montessori Schools enjoy membership in the New York State Association of Independent Schools (NYSAIS), the Independent School Admission Association of Greater New York (ISAAGNY) and the Parents League, as well as affiliate schools of Columbia University.";"https://www.twinparks.org/riverside/contact-us/";;"Mon - Thu: 8:00 am - 6:00 pm
Fri: 8:00 am - 5:00 pm";"https://www.facebook.com/TwinParksMontessoriSchools?ref=ts";"https://www.twinparks.org/wp-content/uploads/2013/06/ApplicationForm_AllSchools_111213.pdf";;"y";"y";"y";"y";"n";"n";"https://www.twinparks.org/wp-content/themes/TwinParks/img/logo-4.png";"https://fbcdn-sphotos-e-a.akamaihd.net/hphotos-ak-prn2/v/t1.0-9/q71/s720x720/1378138_634813716551556_1827905838_n.jpg?oh=60b8924e3cb4b3fa5855fbb6b662fa68&oe=5445178C&__gda__=1412826551_ba0e2b89ebbbcda9fb282672e5e4d681";"https://fbcdn-sphotos-h-a.akamaihd.net/hphotos-ak-xap1/t1.0-9/p480x480/1375067_633303623369232_1049315053_n.jpg";"https://fbcdn-sphotos-b-a.akamaihd.net/hphotos-ak-xpa1/t1.0-9/p180x540/1186709_615614438471484_361539241_n.jpg";"https://fbcdn-sphotos-b-a.akamaihd.net/hphotos-ak-xpa1/t1.0-9/q71/s720x720/1450350_673048752728052_1946757677_n.jpg";;
1088358;"RM PREP, LLC";"75-77 READE STREET";"NEW YORK";"NY";10007;"MANHATTAN";"212-513-7735";;;;;;;;;;;;;;;;;;;;;"Y";
1088359;"ROOSEVELT ISLAND DAY NURSERY";"4 RIVER ROAD";"NEW YORK";"NY";10044;"MANHATTAN";"212-593-0750";"http://ridn.org/";"preschool@ridn.org";"The Roosevelt Island Day Nursery (RIDN) is an international school whose population reflects the rich ethnic, cultural and racial diversity of the Roosevelt Island community. The Day Nursery provides infant, toddler, and preschool programs for children ages 3 months through 5 years.

RIDN is located in two sites offering views of the East River the Queensboro Bridge and the NYC skyline. Each school provides opportunities for year round outdoor play in well equipped playgrounds and beautiful green lawns.

RIDN has been serving the community for over 30 years and welcomes visitors to see and learn more about our many programs.";"http://ridn.org/";"https://www.facebook.com/RooseveltIslandDayNursery";"9am-6pm";;"http://ridn.org/?page_id=5";"http://ridn.org/wp-content/uploads/2013/02/River-Road-Family-Handbook-2012-2013.pdf";"y";"y";"y";"y";"n";"n";;"http://ridn.org/wp-content/uploads/2009/10/aDSC_6830-300x200.jpg";"http://ridn.org/wp-content/uploads/2009/10/aDSC_6750-300x200.jpg";;;;
1088360;"ROOSEVELT ISLAND DAY NURSERY";"405 MAIN STREET";"NEW YORK";"NY";10044;"MANHATTAN";"212-935-3747";"http://ridn.org/";"preschool@ridn.org";"The Roosevelt Island Day Nursery (RIDN) is an international school whose population reflects the rich ethnic, cultural and racial diversity of the Roosevelt Island community. The Day Nursery provides infant, toddler, and preschool programs for children ages 3 months through 5 years.

RIDN is located in two sites offering views of the East River the Queensboro Bridge and the NYC skyline. Each school provides opportunities for year round outdoor play in well equipped playgrounds and beautiful green lawns.

RIDN has been serving the community for over 30 years and welcomes visitors to see and learn more about our many programs.";"http://ridn.org/";"https://www.facebook.com/RooseveltIslandDayNursery";"9am-6pm";;"http://ridn.org/?page_id=5";"http://ridn.org/wp-content/uploads/2013/02/Riverwalk-Family-Handbook-2012-2013.pdf";"y";"y";"y";"y";"n";"n";;"http://ridn.org/wp-content/uploads/2009/10/aDSC_6830-300x200.jpg";"http://ridn.org/wp-content/uploads/2009/10/aDSC_6750-300x200.jpg";;;;
1088361;"ROUND THE CLOCK NURSERY";"301 WEST 130 STREET";"NEW YORK";"NY";10027;"MANHATTAN";"212-694-0615";"http://www.roundtheclocknursery.org/";"rcnursery@msn.com";;"http://www.roundtheclocknursery.org/";"https://www.facebook.com/rcnursery";;;"http://www.roundtheclocknursery.org/";;"y";"y";"y";"y";"y";"n";"http://www.roundtheclocknursery.org/images/English_ezg_logo.jpg";"http://www.roundtheclocknursery.org/IDs_0261.jpg";"http://www.roundtheclocknursery.org/IDs_0151.jpg";"http://www.roundtheclocknursery.org/group_w200_h200.jpg";"http://www.roundtheclocknursery.org/extimages/p_Dec_14_movies_039.jpg";;
1088362;"ROUND THE CLOCK NURSERY, INC";"3333 Broadway";"NEW YORK";"NY";10031;"MANHATTAN";"212-234-1870";"http://www.roundtheclocknursery.org/";"rcnursery@msn.com";;"http://www.roundtheclocknursery.org/";"https://www.facebook.com/rcnursery";;;"http://www.roundtheclocknursery.org/";;"y";"y";"y";"y";"y";"n";"http://www.roundtheclocknursery.org/images/English_ezg_logo.jpg";"http://www.roundtheclocknursery.org/IDs_0261.jpg";"http://www.roundtheclocknursery.org/IDs_0151.jpg";"http://www.roundtheclocknursery.org/group_w200_h200.jpg";"http://www.roundtheclocknursery.org/extimages/p_Dec_14_movies_039.jpg";;
1088363;"ROUND THE CLOCK NURSERY, INC.";"301B WEST 130 STREET";"NEW YORK";"NY";10027;"MANHATTAN";"212-694-0615";"http://roundtheclocknursery.org/104.html";"rcnursery@msn.com";;"http://www.roundtheclocknursery.org/";"https://www.facebook.com/rcnursery";;;"http://www.roundtheclocknursery.org/";;"y";"y";"y";"y";"y";"n";"http://www.roundtheclocknursery.org/images/English_ezg_logo.jpg";"http://www.roundtheclocknursery.org/IDs_0261.jpg";"http://www.roundtheclocknursery.org/IDs_0151.jpg";"http://www.roundtheclocknursery.org/group_w200_h200.jpg";"http://www.roundtheclocknursery.org/extimages/p_Dec_14_movies_039.jpg";;
1088364;"SEPHARDIC ACADEMY OF MANHATTAN";"1274 SECOND AVENUE";"New York";"NY";10065;"MANHATTAN";"212-249-6391";"http://sephardicacademy.org/";"admin@sephardicacademy.org
";"With an unwavering commitment to the rich traditions and culture we treasure, SAM creates a warm and nurturing atmosphere with an unwavering commitment to enrich a child's social, academic, cognitive and spiritual development.At SAM, we believe in educating the whole child and offering them a warm and nurturing environment in which to thrive in their early, formative years.";"http://sephardicacademy.org/";;"9am-3pm  ";;"http://sephardicacademy.org/PreschoolApplication201415.pdf";;"n";"y";"y";"y";"n";"n";"http://sephardicacademy.org/sitebuilder/images/logo.162x132.jpg";"http://sephardicacademy.org/sitebuilder/images/Tea_crop2-740x280.jpg";;;;;
1088365;"SEVENTH AVENUE CENTER FOR FAMILY SERVICES HEAD START";"711 LENOX AVENUE";"NEW YORK";"NY";10039;"MANHATTAN";"212-862-0600";;;;;;;;;;;;;;;;;;;;;"Y";
1088366;"SHALOM YELADIM EARLY CHILDHOOD CENTER.";"135 BENNETT AVENUE";"NEW YORK";"NY";10040;"MANHATTAN";"212-568-1900";"http://www.shalomyeladim.com/favicon.ico";;"Our mission is to provide each child with a safe and stimulating environment.

The well- rounded curriculum encourages the students to reach their full potential in emotional, social, physical, academic and spiritual areas of life.

In addition, we strive to provide our parents with a secure and convenient place, with a feeling of home and family.

 ";"http://www.shalomyeladim.com/favicon.ico";;"7:00 am to 6:30 pm";;;;"y";"y";"y";"y";"n";"n";"http://static.wixstatic.com/media/f5fd7d_5816ab3e201a06f6f3ec54c41d153d2f.png_srz_p_290_129_75_22_0.50_1.20_0.00_png_srz";"http://static.wixstatic.com/media/f5fd7d_f3e95db3d4c14941a7da6ce2cffacb68.jpg_srz_p_397_270_75_22_0.50_1.20_0.00_jpg_srz";;;;;
1088367;"SHELTERING ARMS LEARNING CENTER";"2493 ADAM CLAYTON POWELL BLVD";"NEW YORK";"NY";10030;"MANHATTAN";"212-368-1743";;;;;;;;;;;;;;;;;;;;;"Y";
1088368;"SMARTER TODDLER";" 406 West 55th Street";"NEW YORK";"NY";10019;"MANHATTAN";"212-757-2145";"http://www.smartertoddler.net/";"admin55@SmarterToddlerPreSchool.com";"At Smarter Toddler we strive to have a positive and welcoming environment. We provide a relaxed admissions process, remarkable teachers, placing value on diversity, and accommodating children who have needs requiring additional attention.";"http://www.smartertoddler.net/";;;;"http://www.smartertoddler.net/admissions/";;"y";"y";"y";"y";"n";"n";"http://www.smartertoddler.net/images/logo.jpeg";;;;;;
1088369;"SMARTER TODDLER NURSERY & PRESCHOOL";"100 WEST 89 ST";"NEW YORK";"NY";10024;"MANHATTAN";"212-721-4964";"http://www.smartertoddler.net/contact/inquiry/";"admin55@SmarterToddlerPreSchool.com";"At Smarter Toddler we strive to have a positive and welcoming environment. We provide a relaxed admissions process, remarkable teachers, placing value on diversity, and accommodating children who have needs requiring additional attention.";"http://www.smartertoddler.net/";;;;"http://www.smartertoddler.net/admissions/";;"y";"y";"y";"y";"n";"n";"http://www.smartertoddler.net/images/logo.jpeg";;;;;;
1088370;"SOCIETY OF THIRD STREET MUSIC SCHOOL SETTLEMENT PRESCHOOL";"235 EAST 11 STREET";"NEW YORK";"NY";10003;"MANHATTAN";"212-777-3240";;;;;;;;;;;;;;;;;;;;;"Y";
1088371;"ST. BENEDICT''S DAY NURSERY";"21 WEST 124 STREET";"NEW YORK";"NY";10027;"MANHATTAN";"212-423-5715";;;;;;;;;;;;;;;;;;;;;"Y";
1088372;"ST. IGNATIUS LAYOLA DAY NURSERY";"240 EAST 84TH STREET";"NEW YORK";"NY";10028;"MANHATTAN";"212-734-6427";"http://ignatiusdn.org/";;"St. Ignatius Loyola Day Nursery is a home away from home where faith, love, and knowledge form the cornerstones of a rigorous child-centered curriculum. In a bright, safe, beautiful townhouse on East 84th Street, children develop a strong sense of self, an abiding respect for others, and a lifelong love of learning. ";"http://ignatiusdn.org/";;;;"http://ignatiusdn.org/admissions/application-process/";;"y";"y";"y";"y";"n";"n";;;;;;;
1088373;"ST. THOMAS MORE PLAY GROUP";"65 EAST 89 STREET";"NEW YORK";"NY";10128;"MANHATTAN";"212-534-3977";"http://stthomasmoreplaygroup.org/";;"Our primary objective is to provide a warm, responsive, and supportive atmosphere for each child to begin his social and academic journey through life. It is our belief that a child’s first school experience should be his strongest in terms of trust and security in his teachers and surroundings. Our caring and relaxed approach provides each child with a positive foundation enabling him to cope with a wide variety of future educational environments and pressures. We want children to leave the Play Group with strong self-esteem and a feeling of confidence and enthusiasm for learning.

We accommodate each child in the Play Group as totally unique in his emotional needs, group adaptation capabilities, and skills readiness. Rudimentary socialization skills are an important emphasis in our program, but not at the expense of the child’s sense of self or overall happiness. Individual differences and “stages” are quickly perceived and respected. Our program and facilities provide a rich environment for learning and growth. A wide variety of activities and materials encourage the child’s emotional, intellectual, social and physical development. Individual and group projects spark curiosity and stimulate the children to observe, experiment freely, become problem solvers, and acquire basic skills without the fear of failure.";"http://stthomasmoreplaygroup.org/";;"Schedule of Programs:
Twos:  (2P) Tuesday, Wednesday, Thursday
1:15-3:15pm
Threes:  (3P) Monday, Tuesday, Thursday,
12:45-3pm, or
(3F) Monday through Friday,
8:45am-12pm
Fours:  (4T) Transitional Class, and
(4R) Regular Class:
Monday through Thursday, 8:45am-1pm;
Friday, 8:45am-12:15pm. ";;;;"n";"y";"y";"y";"n";"n";;"http://stthomasmoreplaygroup.org/images/home/home-1a.jpg";"http://stthomasmoreplaygroup.org/images/home/home-2a.jpg";"http://stthomasmoreplaygroup.org/images/home/home-3a.jpg";"http://stthomasmoreplaygroup.org/images/home/home-1b.jpg";;
1088374;"ST.BARTHOLOMEW COMMUNITY PRE-SCHOOL";"109 EAST 50 STREET";"NEW YORK";"NY";10022;"MANHATTAN";"212-378-0238";"http://www.stbarts.org/preschool/";"admissions@stbarts.org";"St. Bart's educational philosophy is based on fostering a love of learning, while celebrating and embracing each child’s uniqueness. We are committed to providing an environment where children’s curiosity is encouraged.";"http://www.stbarts.org/preschool/";;;;;;"n";"y";"y";"y";"n";"n";;"http://www.stbarts.org/monkimage.php?mediaDirectory=mediafiles&mediaId=2248953&fileName=preschool-gals-in-tube-0-0-175-232.jpg";"http://www.stbarts.org/monkimage.php?mediaDirectory=mediafiles&mediaId=2982517&fileName=preschool-0-0-236-315.jpg";"http://www.stbarts.org/monkimage.php?mediaDirectory=mediafiles&mediaId=2248943&fileName=preschool-in-a-queue-0-0-177-263.jpg";"http://www.stbarts.org/monkimage.php?mediaDirectory=mediafiles&mediaId=2248955&fileName=preschool-3-girls-0-0-216-281.jpg";;
1088375;"STAR AMERICA M. INC.";"780 8 AVENUE";"NEW YORK";"NY";10036;"MANHATTAN";"212-262-4896";;;;;;;;;;;;;;;;;;;;;"Y";
1088376;"STEPHEN WISE EARLY CHILDHOOD CENTER";"30 WEST 68 STREET";"NEW YORK";"NY";10023;"MANHATTAN";"212-877-4050";"http://ecc.swfs.org/ECC/About";"vreiss@swfs.org";"The SWFS Balfour Brickner Early Childhood Center (ECC) carries on Stephen Wise Free Synagogue’s long tradition of educating young children. In 1949, the Synagogue opened what was then called the Nursery School and Kindergarten, where children learned through creative play in a Jewish environment. Now, over 60 years later, the ECC continues to educate and inspire the youngest members of the Stephen Wise community.";"http://ecc.swfs.org/ECC/About";;;;"http://ecc.swfs.org/ECC-Admissions/Overview";;"n";"y";"y";"y";"y";"y";"http://ecc.swfs.org/Images/hdr_logo.gif";"http://ecc.swfs.org/Images/gallery/2013/about-us.jpg";"http://ecc.swfs.org/Images/gallery/2013/admissions.jpg";"http://ecc.swfs.org/Images/gallery/2013/philosophy-1.jpg";"http://ecc.swfs.org/Images/gallery/staff.jpg";;
1088377;"SUNSHINE DAY CARE";"1330 5TH AVENUE";"NEW YORK";"NY";10026;"MANHATTAN";"212-444-1177";"http://sunshinenewyork.com/locations.html";;"Sunshine Daycare provides educational infant, toddler, and preschool programs to children ages six weeks through 5 years of age. Our experienced, nurturing staff is passionate about showing children, as early as possible, that learning isn’t a chore— it’s a lot of fun!

An Exceptional Early Childhood Center
    As a matter of convenience for working parents, we are open from 7:30a.m. to 6:30p.m., Monday through Friday.
    Our age-specific curriculum is designed to stimulate and cultivate the student’s intellect in a fun way that makes them want to come in every day.
    We believe that a healthy mind can’t be attained without a healthy body, so we provide a nutritious breakfast, lunch and snack every day.
    Sunshine pre-school programs have been servicing diverse families and communities in Brooklyn, Manhattan and the Bronx since 2004. Our universal goal is to offer affordable family solutions for parents while inspiring a passion for knowledge in children at a young age.
    We are proud of our affordable, top-quality Pre-K programs, so as a means to extend our services to a broad range of financial abilities, we accept all New York City vouchers issued by HRA and ACD.

Sunshine’s Philosophy
    We are an Early Childhood center that serves not as a mere daycare center, but as a place where your child can begin to build the foundation for a life of educational pursuits.
    We treat every activity as a chance for your child to learn and grow. No activity is without an enriching purpose behind it.
    We feel that by keeping your children intellectually and socially stimulated, they will hit the ground running while attending school in their later years.
    Communication between our parents, children and faculty is extremely important to us, so we have an “open door policy” to ensure every question, concern, or issue is addressed. ";"http://sunshinenewyork.com/locations.html";;"7:30a.m. to 6:30p.m., Monday through Friday";"http://sunshinenewyork.com/careers.html";"http://sunshinenewyork.com/register.html";;"y";"y";"y";"y";"n";"n";"http://sunshinenewyork.com/img/logo2.jpg";;;;;;
