"id";"name";"address";"city";"state";"zip";"county";"phone";"main website";"email";"detail";"location url";"facebook page";"business hours";"career/employment url";"application/registration url";"parent handbook url";"infant (under 12 months)";"toddler (1-2yrs)";"preschools (2-3yrs)";"pre-kindergarden(4yr)";"before/afterschools";"camps";"logo url (only small logo if available)";"pictures url 1";"picture url 2";"picture url 3";"picture url 4";"bad url?";
89419;"St James Episcopal Preschool";"156 Monroe N";"La Grange";"TX";78945;"FAYETTE";"979-968-9501";"http://www.stjameslagrange.org/our-preschool/";"st-james-preschool@cmaaccess.com";"Each child is a unique creation of God.  Young children are curious by nature.  They are excited and eager to participate in activities that encourage hands-on experiences.  The environment at our preschool is safe, positive, and supportive.  We believe in offering full and rich opportunities to develop in each child a love for God, self-esteem, responsibility, and a readiness for life long-learning that is appropriate to each child.

 ";"http://www.stjameslagrange.org/our-preschool/";"https://www.facebook.com/stjameslagrange";"8:15am to 12:15";;;;"n";"y";"y";"y";"n";"n";;"http://stjameslagrange.org/s/cc_images/cache_4087182395.png?t=1391608059";"http://stjameslagrange.org/s/cc_images/cache_4087182396.jpg?t=1391608059";"http://stjameslagrange.org/s/cc_images/cache_4087182397.jpg?t=1391608059";"http://stjameslagrange.org/s/cc_images/cache_4087182399.jpg?t=1391608059";;
89423;"ST Jerome Little Lions Learning Center";"9820 Chapel Rd";"Waco";"TX";76712;"MCLENNAN";"(254) 666-6222";"http://www.stjeromewaco.org/index.cfm?load=page&page=167";"DirectorLLLC@StJeromeWaco.org";"Little Lions Learning Center (LLLC) is a faith-based preschool that supports the cognitive, social, emotional, physical, and spiritual development of young children.

Little Lions Learning Center strives to develop the faith, mind, and body of its students through a high quality education in a secure and nuturing environment that fosters the development of the whole child through play-based learning.

Your child will feel at home in one of Little Lions Learning Center's small classes.  Little Lions Learning Center has a low student to teacher ratio so your child will not feel lost in the crowd, but instead receive individualized attention from his or her teacher.";"http://www.stjeromewaco.org/index.cfm?load=page&page=167";;"7:30am-5:30pm";;;;"n";"n";"y";"y";"n";"n";;"http://www.stjeromewaco.org/eccbanners/St%20Jerome%20banner.jpg";"http://www.stjeromewaco.org/pictures/LLLC_Class_room_1.jpg";"http://www.stjeromewaco.org/pictures/LLLC_Class_room_2.jpg";"http://www.stjeromewaco.org/pictures/LLLC_Class_room_6.jpg";;
89427;"ST Johns After School Program";"102 E Avenue G";"La Porte";"TX";77571;"HARRIS";"281-470-2575";;;;;;;;;;;;;;;;;;;;;"Y";
89430;"ST Johns Day Care Center";"2513 North 8TH";"McAllen";"TX";78501;"HIDALGO";"956-686-0231";;;;;;;;;;;;;;;;;;;;;"Y";
89432;"St Johns Methodist School For Little Children";"400 Jackson";"Richmond";"TX";77469;"FORT BEND";"281-342-7971";"http://stjohnslittleschool.org/";"director@stjohnslittleschool.org";"Since its inception 40 years ago in 1973, St. John’s School for Little Children has striven to provide children with high quality academic instruction in a very accepting, loving, Christian environment.  

It is our intent that the Little School program helps prepare your child for success in school and in life.  What is our goal for your child?  To become an independent, responsible human being with a great desire and ability to learn, question, communicate, and to function in a social setting.   We believe these traits serve them throughout their lives.  We try to accomplish this through the activities we plan, the way we organize the classrooms, select developmentally appropriate toys and materials, plan daily schedules, and talk with children.


";"http://stjohnslittleschool.org/";;"M-F 8:30 - 5:30";"http://stjohnslittleschool.org/713802.ihtml";"stjohnslittleschool.org/files/Files%20Folder/Preschool/Registration%20Application-2014-2015.docx";;"n";"n";"y";"y";"n";"n";"http://stjohnslittleschool.org/files/Preschool/Images/sjlslogo.png";;;;;;
89437;"ST Luke Christian Child Development Center";"2781 W AVE N";"San Angelo";"TX";76904;"TOM GREEN";"325.949.8311";"http://www.stluke-sanangelo.org/page10.html";;"St. Luke Christian Child Development Center is a ministry of St. Luke United Methodist Church.  As an outreach to the community, it is designed to provide young children with creative and Christ centered learning experiences that promote good self image and self acceptance. The center offers children and their families an atmosphere of love in which children are allowed to develop social, motor, verbal, academic and spiritual skills at their own maturation level. ";"http://www.stluke-sanangelo.org/page10.html";;;;"http://www.stluke-sanangelo.org/page10.html";;"n";"n";"y";"y";"n";"n";"http://www.stluke-sanangelo.org/img2.jpg";;;;;;
89439;"ST Luke Methodist DC";"9915 Montwood";"El Paso";"TX";79925;"EL PASO";"915-591-8126";"http://www.stlukemethodist.org/st-luke-preschool/";;"Looking for a preschool for your child?  St. Luke United Methodist Church offers preschool classes for children ages 2-kindergarten.

At St. Luke Preschool your child will be taught age appropriate curriculum, with social skills such as sharing, playing with others, manners, and taking turns.  In addition to classroom instruction, each class has scheduled outside play time each days as the weather permits.

Hours of class instruction are from 8 – 11:30am, Monday through Friday with early drop off and afternoon care offered for an additional fee.

The school year follows the Ysleta School District Calendar, although there are a few days each year that Ysleta gives students off that the St. Luke Pre-school is in session.

If you would like more information, or would like to register your child please contact the Preschool director Cindy Jury at 591-8126, or stop by in person at St. Luke UMC 9915 Montwood Dr, across from Eastwood High School.Get your child enrolled in a program where they will have a great time learning with other children!";"http://www.stlukemethodist.org/st-luke-preschool/";;"8 – 11:30am, Monday through Friday";;;;"n";"y";"y";"y";"n";"n";"http://www.stlukemethodist.org/hp_wordpress/wp-content/uploads/2014/03/Childrens-Church-Website-Banner-300x102.jpg";;;;;;
89440;"ST Luke the Evangelist Early Childhood Center";"11011 Hall RD";"Houston";"TX";77089;"HARRIS";"281-481-0314";"http://www.stlukescatholic.com/index.cfm?load=page&page=249";;"The mission of St. Luke the Evangelist's Early Childhood Center is to maximize your child’s potential by providing hands on materials, dedicated teachers, personalized curriculum and life long skills to cultivate your child’s intellectual, physical, and social development in a safe and loving Christian environment.

We offer a 5 day program for 18 months to 3 year olds, as well as a Pre-K 5 day program with all times being from 9-2 p.m. daily. Space is limited.";"http://www.stlukescatholic.com/index.cfm?load=page&page=249";;"9am-2pm";;"http://www.stlukescatholic.com/documents/ECC/ECC%20Enrollment%20Application.pdf";;"n";"y";"y";"y";"n";"n";"http://www.stlukescatholic.com/pictures/Childhood-Logo.jpg";"http://www.stlukescatholic.com/pictures/ECC/ECC%20Cover%20Page.jpg.gif";"http://www.stlukescatholic.com/pictures/Classroom%20Fun.jpg";"http://www.stlukescatholic.com/pictures/ECC/037.JPG";"http://www.stlukescatholic.com/pictures/ECC/NO%20506.JPG";;
89442;"ST Lukes Child Development Program";"3011 W Kansas";"Midland";"TX";79701;"MIDLAND";"432-694-2574";"http://www.stlukesumcmidland.org/ministries/child-development-program";;"Our Child Development Program is licensed by the Texas Department of Protective & Regulatory Services and meets or exceeds all the standards of a licensed day care center. We are licensed to care for children from 6 weeks to the age of 12 years.";"http://www.stlukesumcmidland.org/ministries/child-development-program";;"Monday - Friday from 
7:00 am to 6:00 pm";;;;"y";"y";"y";"y";"y";"n";;;;;;;
89443;"St Lukes Episcopal School";"16292 F M 849";"Lindale";"TX";75771;"SMITH";"903-881-8733";"http://slesl.org/indexadd.html";;;"http://slesl.org/indexadd.html";;"8am-6pm";;;;"n";"y";"y";"y";"y";"y";"http://slesl.org/Image/top%20private%20school%20lindale%20tx.gif";;;;;;
89449;"St Mark Lutheran Preschool";"501 Willow DR";"Lake Jackson";"TX";77566;"BRAZORIA";"979-297-9082";;;;;;;;;;;;;;;;;;;;;"Y";
89451;"ST Mark Pre School";"301 WEST PECAN";"MCALLEN";"TX";78501;"HIDALGO";"956-686-2650";"http://www.stmark-umc.org/site/cpage.asp?cpage_id=140010444&sec_id=140002871";"stmarkumcpreschool@yahoo.com";"The mission of St. Mark Preschool and Child Care is to provide safe, quality care for children in a joyful Christian environment that provides learning and self worth. ";"http://www.stmark-umc.org/site/cpage.asp?cpage_id=140010444&sec_id=140002871";;"Monday- Friday
7:15 am - 6:oo pm ";;;;"y";"y";"y";"y";"y";"n";;;;;;;
89453;"St Marks Church DCC";"1100 W 15TH St";"Plano";"TX";75075;"COLLIN";"972-578-7970";;;;;;;;;;;;;;;;;;;;;"Y";
89457;"St Marks United Methodist Church Daycare Center";"1902 Vance Jackson";"San Antonio";"TX";78213;"BEXAR";"210-348-9697";;;;;;;;;;;;;;;;;;;;;"Y";
89460;"St Marys Child Development Center";"507 Spruce W";"West";"TX";76691;"MCLENNAN";"254-826-7043";"http://stmaryswest.com/index.cfm?load=page&page=165";"kristel.holy@stmaryswest.com";;"http://stmaryswest.com/index.cfm?load=page&page=165";;;;;"http://stmaryswest.com/student-handbook";"y";"y";"n";"n";"n";"n";;;;;;;
89465;"ST Matthews Episcopal Day School";"727 W Browning";"Pampa";"TX";79065;"GRAY";"806-665-0703";;;;;;;;;;;;;;;;;;;;;"Y";
89469;"St Michaels Parish Day School";"1613 W 43rd ST";"Houston";"TX";77018;"HARRIS";"713-681-6422";;;;;;;;;;;;;;;;;;;;;"Y";
89470;"St Paul Parents Day Out";"711 James Dr";"Richardson";"TX";75080;"DALLAS";"972-231-8605";"http://www.saintpaulchurch.org/index.cfm?load=page&page=158";"PDO@SaintPaulChurch.org";"At the Saint Paul ""Parents Day Out"" program, we strive to provide a safe Christ-centered environment in which children ages 2, 3, and 4 years old can grow in their social, physical, and spiritual development while having lots of FUN! Class assignment is determined by age as of September 1 of the current school year.";"http://www.saintpaulchurch.org/index.cfm?load=page&page=158";;"9am-3pm";;;;"n";"y";"y";"y";"n";"n";"http://www.saintpaulchurch.org/eccbanners/Banner_1.jpg";"http://www.saintpaulchurch.org/pictures/pdo%20clowns.jpg";;;;;
89472;"St Paul Catholic Learning Center";"1201 Donaldson Ave";"San Antonio";"TX";78228;"BEXAR";"210-738-8715";;;;;;;;;;;;;;;;;;;;;"Y";
89473;"ST Paul Child Enrichment Center";"805 E Main";"Bishop";"TX";78343;"NUECES";"361-584-2033";;;;;;;;;;;;;;;;;;;;;"Y";
89474;"ST Paul Christian Learning Center";"703 N Elm ST";"Denton";"TX";76201;"DENTON";"940-387-6651";"http://splcdenton.org/CLC.php";"spclc@splcdenton.org";"St. Paul Christian Learning Center helps children grow in a learning and caring Christian environment.  Our aim is to give quality care while stimulating young minds.";"http://splcdenton.org/CLC.php";;;;;;"n";"y";"y";"y";"n";"n";"http://splcdenton.org/images/a863a7cc75c74362609489bdbe9a5121_pd0y_k6pk.png";"http://splcdenton.org/images/11bb71ba23cccc0cb869bb7dd7d704e8.jpg";;;;;
89476;"ST Paul Early Childhood Program";"18223 PT Lookout";"Houston";"TX";77058;"HARRIS";"281-333-0176";;;;;;;;;;;;;;;;;;;;;"Y";
89480;"St Paul Lutheran Church and School";"101 Third N";"Thorndale";"TX";76577;"MILAM";"512-898-2711";"http://www.stpaulthorndale.com/";"melchercindy@hotmail.com,cmelcher@stpaulthorndale.com";;"http://www.stpaulthorndale.com/";;;;"http://www.stpaulthorndale.com/regis.php";;"n";"n";"y";"y";"y";"n";"http://www.stpaulthorndale.com/images/paw2.jpg";"http://www.stpaulthorndale.com/images/slideshow/305.jpg";"http://www.stpaulthorndale.com/images/slideshow/304.jpg";"http://www.stpaulthorndale.com/images/slideshow/303.jpg";"http://www.stpaulthorndale.com/images/slideshow/302.jpg";;
89481;"St Paul Lutheran Creative CC";"201 Veteran DR";"Columbus";"TX";78934;"COLORADO";"979-732-6183";"http://www.splctx.org/creative-child-center.html";"stpaulccc@splctx.org";"We minister to families with young children by providing an excellent school in a Christian atmosphere of love, acceptance, and respect. Our 
goal is to foster the development of the whole child in these aspects: 
physical, spiritual, emotional, and intellectual.";"http://www.splctx.org/creative-child-center.html";"https://www.facebook.com/groups/170617049639398/";"Monday - Friday 7:00 AM - 6:00 PM";;;;"n";"y";"y";"y";"n";"n";"http://www.splctx.org/uploads/1/8/2/4/18245539/1390861980.png";;;;;;
89482;"ST Paul Lutheran Day Care";" 1572 CR 211";"Giddings";"TX";78942;"LEE";"979-366-2870";;;;;;;;;;;;;;;;;;;;;"Y";
89484;"St Paul Lutheran Preschool";"108 Gayle E";"Edna";"TX";77957;"JACKSON";"361-782-3364";;;;;;;;;;;;;;;;;;;;;"Y";
89487;"St Paul Presbyterian Early Childhood";"7200 Bellaire BLVD";"Houston";"TX";77074;"HARRIS";"713-772-1819";"http://saintpaulhouston.org/ecm/";"stpaulecm@yahoo.com";"For nearly 50 years, our program has focused on a child’s natural curiosity as a way to build a strong educational base. We maintain an atmosphere of play and fun with positive reinforcement and age-appropriate curricula and activities – all in a loving, Christian environment that builds the child’s self-esteem. Our low student-to-teacher ratios ensure a safe and nurturing environment.";"http://saintpaulhouston.org/ecm/";;"7 a.m. to 6 p.m.";;;;"n";"y";"y";"y";"n";"n";;"http://saintpaulhouston.org/wp-content/uploads/2013/11/IMG_0537.jpg";;;;;
89489;"St Paul's Lutheran Church After School Program";"712 Schilling ST";"Baytown";"TX";77520;"HARRIS";"281-425-1472";"http://www.stpaulsbaytown.org/after-school-program.html";;"On Monday, March 31, 2008 we opened our After School Program.  This free program will bring new life to more than 35 kids from our neighborhood as well as to their families.  New life that will mean a safe place for the kids to go after school where there will be caring  people to help with homework and to teach new skills.  New life that may mean exposure to the gospel of Jesus for the first time.   The children have chapel time once a week in the sanctuary with Bible lesson, prayers, and music.  ";"http://www.stpaulsbaytown.org/after-school-program.html";;;;;;"n";"n";"n";"y";"y";"n";;"http://www.stpaulsbaytown.org/uploads/2/2/8/1/22811690/1425555685_orig.jpg";"http://www.stpaulsbaytown.org/uploads/2/2/8/1/22811690/2688530_orig.jpg";"http://www.stpaulsbaytown.org/uploads/2/2/8/1/22811690/5092962_orig.jpg";"http://www.stpaulsbaytown.org/uploads/2/2/8/1/22811690/950714204_orig.jpg";;
89493;"ST Pauls Mornings with Jesus Catholic Early Education";"10000 David Moore DR";"Austin";"TX";78748;"TRAVIS";"512-280-4460";"http://www.morningswithjesus.webs.com/";;"Our Mission is to provide children with the best possible opportunity to connect within and learn about God’s world in a loving, safe and spiritual setting.";"http://www.morningswithjesus.webs.com/";;;;;;"n";"y";"y";"y";"n";"n";;"http://morningswithjesus.webs.com/apps/photos/";;;;;
89496;"St Peter Lutheran Preschool";"130 Luther LN";"Gun Barrel City";"TX";75156;"HENDERSON";"903-887-5077";"http://www.stpeterlutheranpreschool.com/";"stpeterpreschool@gmail.com";"St. Peter Lutheran Preschool, a ministry of St. Peter Lutheran Church, is a non-profit organization sponsored by St. Peter Lutheran Church. St. Peter Lutheran Church and Preschool are both members of the Lutheran Church-Missouri Synod. St. Peter Lutheran Preschool is called to provide a Christ-centered, first-school experience for children, while developing their love for learning and celebrating their individual uniqueness.";"http://www.stpeterlutheranpreschool.com/";"https://www.facebook.com/pages/St-Peter-Lutheran-Church-Gun-Barrel-City-TX/137838149592399";"Monday-Friday from 6:30AM to 6:00PM";;"http://www.stpeterlutheranpreschool.com/wp-content/uploads/2013/08/AdmissionInformation.pdf";;"n";"y";"y";"y";"n";"n";"http://www.stpeterlutheranpreschool.com/wp-content/themes/stpeter/images/logo.png";"http://www.stpeterlutheranpreschool.com/wp-content/themes/stpeter/images/sb-img-1.png";;;;;
89501;"St Philips Methodist Discover Club";"5501 Beechnut";"Houston";"TX";77096;"HARRIS";"713-666-2761";"http://www.spumc.com/Discovery.htm";;"Have you ever heard of the DISCOVERY SCHOOL? It's a day school ministry of St. Philip's United Methodist Church that provides very young children the opportunity to learn, play, and enjoy the company of other children in a safe, nurturing environment that reflects God's love.";"http://www.spumc.com/Discovery.htm";;;;;;"n";"y";"y";"y";"n";"n";"http://www.spumc.com/Images/Logo.jpg";"http://www.spumc.com/Images/Nav-Discovery.jpg";"http://www.spumc.com/Images/Discovery-3.jpg";"http://www.spumc.com/Images/Discovery-1.jpg";"http://www.spumc.com/Images/Art-5-2012.jpg";;
89503;"St Phillip's Preschool";"16321 Great Oaks DR S";"Round Rock";"TX";78681;"WILLIAMSON";"512-244-1538";"http://www.stphilipsumc.org/preschool/";;"St. Philip’s Preschool operates a state-licensed preschool program for children ages 2-5 year olds. Our purpose is to provide a preschool program in which each child can grow and develop spiritually, cognitively, physically, emotionally and socially within a Christian atmosphere. We believe each child is a child of God—a special unique person valued for his/her own worth, who is growing and learning at his/her own pace as he/she actively relates to our world through play—- a child’s “work.” We believe that this program is one of the church’s outreaches into our community as we strive to meet the needs of children and encourage participation and education. ";"http://www.stphilipsumc.org/preschool/";"https://www.facebook.com/pages/St-Philips-Preschool/201884163170771";"9am-2pm";;;;"n";"y";"y";"y";"n";"n";"http://www.stphil.dreamhosters.com/wp-content/uploads/2013/12/logo3.png";"https://fbcdn-sphotos-d-a.akamaihd.net/hphotos-ak-frc1/t1.0-9/q71/s720x720/1939970_829418430417338_112390945_n.jpg";"https://fbcdn-sphotos-b-a.akamaihd.net/hphotos-ak-prn1/t1.0-9/q71/s720x720/1016548_829417473750767_2056000204_n.jpg";"https://fbcdn-sphotos-g-a.akamaihd.net/hphotos-ak-prn2/t1.0-9/1493139_804397116252803_287298287_n.jpg";"https://scontent-a-lax.xx.fbcdn.net/hphotos-prn1/t1.0-9/1012235_804395532919628_1839977433_n.jpg";;
89506;"St Rose Of Lima";"3600 Brinkman";"Houston";"TX";77018;"HARRIS";"713-692-1941";;;;;;;;;;;;;;;;;;;;;"Y";
89508;"ST Stephens Presbyterian CHERI";"2217 Theta";"Houston";"TX";77034;"HARRIS";"713-946-4006";;;;;;;;;;;;;;;;;;;;;"Y";
89509;"ST Stephens Preschool";"6500 St. Stephen's DR";"Austin";"TX";78746;"TRAVIS";"512-327-1213";"http://www.sstx.org/home";"bkirkpatrick@sstx.org";"St. Stephen's Episcopal School, a coeducational boarding and day school of the Diocese of Texas, is a caring, diverse community, inclusive of all faiths and grounded in the Christian tradition, which nurtures moral growth and values the potential and dignity of every human being. We challenge motivated students to live intelligently, creatively and humanely as contributing members of society. We develop the whole person by providing rigorous academic preparation, stimulating physical activities and rich opportunities in the fine arts.";"http://www.sstx.org/home";;;"http://www.sstx.org/employment";"http://www.sstx.org/admissionfaq";;"n";"n";"y";"y";"y";"n";;"http://media.cdn.whipplehill.net/580/photo/2013/09/large_photo172366_1793772.jpg";"http://media.cdn.whipplehill.net/580/photo/2013/12/large_photo172366_2000215.jpg";"http://media.cdn.whipplehill.net/580/photo/2014/04/large_photo172366_2165679.jpg";"http://media.cdn.whipplehill.net/580/photo/2013/12/large_photo172366_1992188.jpg";;
89514;"ST Thomas More Preschool";"10205 R R 620 N";"Austin";"TX";78726;"TRAVIS";"512-258-1721";"http://stmaustin.org/st-thomas-more-preschool";;"St. Thomas More is very proud of its Preschool program which is designed to be an extension of the family. Our program has been carefully developed for the enrichment of the whole child within a loving, Catholic environment. We give special attention to the developmental stages, skills and needs of our children, while encouraging and nurturing each child’s God-given talents. Our goal is to make preschool a positive, rewarding and fun, growing experience for the child; intellectually, physically, emotionally, socially, and spiritually. - See more at: http://stmaustin.org/st-thomas-more-preschool#sthash.WpMGOnnp.dpuf";"http://stmaustin.org/st-thomas-more-preschool";;"9:30am-1:30pm";;;"http://stmaustin.org/preschool-handbook";"n";"y";"y";"y";"n";"n";"http://www.stmaustin.org/sites/default/files/uploads/Preschool_Logo.jpg";"http://www.stmaustin.org/sites/default/files/uploads/cindy%20%26%20chris2.jpg";"http://www.stmaustin.org/sites/default/files/uploads/ipod_sock.jpg";"http://www.stmaustin.org/sites/default/files/uploads/childcare_main.jpg";"http://stmaustin.org/sites/default/files/styles/banner-narrow/public/banners/stmgrotto.jpg?itok=tF4eZ3oQ";;
89517;"St. Lawrence Day Care";"236 E Petaluma Blvd";"San Antonio";"TX";78221;"BEXAR";"210-924-4026";;;;;;;;;;;;;;;;;;;;;"Y";
89518;"St. Albans Day Care Center";"1417 Austin";"Harlingen";"TX";78550;"CAMERON";"956-428-2326";;;;;;;;;;;;;;;;;;;;;"Y";
89520;"St. Andrews CDC";"16320 Huebner Rd";"San Antonio";"TX";78248;"BEXAR";"210-493-9380";"http://www.standrewsa.org/ministry4.php";"alanik@standrewsa.org";"Our MDO program emphasizes hands-on, developmentally appropriate play experiences. Blue Roof School has carefully planned to provide quality Christian child care. We recognize the uniqueness of each child and provide for individualized experiences to help children reach their maximum potential. At Blue Roof School, the children are given the opportunity to:

    Develop decision-making practices by selecting activities from a variety of learning centers
    Express themselves creatively through open-ended art, music, dramatic play, and the use of unstructured materials
    Experience positive, loving interactions with children and adults
    Verbalize feelings in a supportive, accepting environment that encourages independence and self-control
    Participate in and enjoy language experiences
    Develop fine and gross motor skills and participate in physical activities
    Practice proper bathroom function and hygiene (a.k.a. - potty training)

This program focuses attention on language development, large motor skills use and mastery, and social development. The MDO daily schedule is developed to meet the needs for balanced active and quiet play times, large and small group interaction, and indoor and outdoor activities.";"http://www.standrewsa.org/ministry4.php";;;;"http://www.standrewsa.org/ministry4.php";"http://www.standrewsa.org/ministry4.php";"n";"y";"y";"y";"y";"n";;"http://www.standrewsa.org/images/Image/user/Copy%20%286%29%20of%20monica%20class%20september-%20october%20001.jpg";"http://www.standrewsa.org/images/Image/user/ML9_2213.jpg";"http://www.standrewsa.org/images/Image/user/ML9_2182.jpg";"http://www.standrewsa.org/images/Image/user/ML9_2291.jpg";;
89523;"St. Anthony Day Care Center";"1707 Centennial Blvd";"San Antonio";"TX";78211;"BEXAR";"210-924-4443";;;;;;;;;;;;;;;;;;;;;"Y";
89527;"St. Clare of Assisi Preschool and Mother's Day Out";"3131 El Dorado Blvd";"Houston";"TX";77059;"HARRIS";"281-286-3395";;;;;;;;;;;;;;;;;;;;;"Y";
89534;"St. Georges & St. Patricks Episcopal School";"4040 Bellfort W";"Houston";"TX";77025;"HARRIS";"713-666-1408";;;;;;;;;;;;;;;;;;;;;"Y";
89535;"St. John Bosco Child Development Center";"5630 West Commerce St.";"San Antonio";"TX";78237;"BEXAR";"210-432-1686";"http://www.stjohnbosco-satx.org/campus_life/cdc/cdc.html";"sguerrero@stjohnbosco-satx.org";"Welcome to St. John Bosco Child Development Center (CDC). Our staff is dedicated to providing your child with the finest care possible. In following St. John Bosco’s teachings, our center focuses on all aspects of your child’s development.

Our mission is to educate youth and form them spiritually in the Salesian tradition of Reason, Religion, and Loving Kindness.  All of us at St. John Bosco School and Development Center work together to help make St. John Bosco a place where children love to learn and learn to love.";"http://www.stjohnbosco-satx.org/campus_life/cdc/cdc.html";"https://www.facebook.com/StJohnBoscoSATX";"6:30 a.m. to 6:00 p.m.";;"http://www.stjohnbosco-satx.org/admissions/admissions.html";"http://www.stjohnbosco-satx.org/campus_life/cdc/images/CDC%20handbook%202012%20july.pdf";"y";"y";"y";"y";"y";"n";;"https://fbcdn-sphotos-e-a.akamaihd.net/hphotos-ak-frc1/t1.0-9/q79/s720x720/10245498_823263837701725_3749112891663053516_n.jpg";"https://fbcdn-sphotos-c-a.akamaihd.net/hphotos-ak-prn1/t1.0-9/q71/s720x720/1017157_815161168511992_3362040958535656702_n.jpg";"https://fbcdn-sphotos-d-a.akamaihd.net/hphotos-ak-frc1/t1.0-9/q77/s720x720/10003907_815154925179283_8442745281615152305_n.jpg";"https://fbcdn-sphotos-e-a.akamaihd.net/hphotos-ak-frc1/v/t1.0-9/q71/s720x720/10013335_816956524999123_5264902142186702193_n.jpg?oh=7a8db1f3dfc40442dee91f11d202ccb0&oe=53D8CCAE&__gda__=1405089167_78a59f8850c23661ac1e44b8b390e7ac";;
89536;"St. John Lutheran Parochial Day Care";"606 S. Center";"Marion";"TX";78124;"GUADALUPE";"830-420-2934";;;;;;;;;;;;;;;;;;;;;"Y";
