90362;"Tri-County Head Start";"902 Teneha";"Center";"TX";75935;"SHELBY";"936-598-7146";"http://www.tricountycommunityaction.org/334061.ihtml";;"Head Start is a comprehensive program that serves children ages 3-5 and their families. It is a child focused program with the overall goal of increasing the school readiness of young children in low income families. ";"http://www.tricountycommunityaction.org/334061.ihtml";;;"www.tricountycommunityaction.org/648954.ihtml";"http://www.tricountycommunityaction.org/files/Store%20Downloads/Application.pdf";;"n";"n";"y";"y";"n";"n";;;;;;;
90364;"Trimmier YMCA";"4400 Success DR";"Killeen";"TX";76542;"BELL";"254-554-7107";;;;;;;;;;;;;;;;;;;;;"Y";
90366;"Trinity By The Sea Day School";"433 Trojan";"Port Aransas";"TX";78373;"NUECES";"361-749-6448";"http://www.trinitybythesea.org/";"Trinitybytheseadayschool@gmail.com";"Trinity Day School is an outreach ministry of Trinity by the Sea Episcopal Church.
We care for children ages 15 months to through 5 years.
We provide excellence in child care for toddlers and preschool children in a loving Christian environment.  Our program includes music, art, math, science, language, fine and gross motor activities, social and emotional activities, and cognitive activities. We also offer a morning Pre-Kindergarten program which surpasses State guidelines. 
Full or part-time schedules available.";"http://www.trinitybythesea.org/";;;;;;"n";"y";"y";"y";"n";"n";;"http://www.trinitybythesea.org/wp-content/uploads/2014/02/cropped-Joe-Gant.jpg";"http://www.trinitybythesea.org/wp-content/uploads/2013/07/day-school-.jpg";;;;
90368;"Trinity Child Development Center";"3505 Main ST N";"Taylor";"TX";76574;"WILLIAMSON";"512-365-2381";"http://www.trinity-taylor.org/tcdc";"tlchurch@trinity-taylor.org";"For over ten years, Trinity Child Development Center has been committed to providing a loving Christian environment while building a strong spiritual, academic, and social foundation for young children.  We are licensed by the Texas Department of Protective and Regulatory Services.";"http://www.trinity-taylor.org/tcdc";;;;;;"y";"y";"y";"y";"y";"n";;"http://www.trinity-taylor.org/sites/trinity-taylor.ctshost.org/files/media/styles/large/public/TCDC%20Group.JPG?itok=lGxIfE_5";;;;;
90376;"Trinity Extended Day";"215 Teague St";"Longview";"TX";75601;"GREGG";"903-753-0612";"http://www.trinityschooloftexas.com/";"sayala@trinityschooloftexas.com";"The Trinity School of Texas believes that each student is a manifestation of the Creator God, a unique individual in a social matrix searching for self-expression and identity. The school endeavors to provide a developmentally appropriate intellectual challenge in an environment and an atmosphere of understanding, guidance, and love so that all students may achieve their full academic and personal potential. The school as a family encourages each student to develop the life skills of independence
and interdependence.

Beginning with the foundation of an Early Childhood program, the curriculum strives to offer a harmony among academic subjects, visual and performing arts, and physical education, culminating in the college preparatory program of the Upper School. Students are consistently encouraged and guided to develop personal initiative, independence of mind, clear and accurate expression of thought, and respect for their own health and well-being. The curriculum and regular religious observances seek to demonstrate to students the love of God, the stewardship for his creation, and the responsibility to love and care for others even as they are loved. Education at The Trinity School of Texas endeavors not only to enhance what students know, but also to affect who they are and how they relate to others.

The philosophy and purpose of The Trinity School of Texas are exhibited in our students not only when they are at school but also as they enter into the larger world, well prepared to function independently and with charity in the pursuit of knowledge, with a proper regard for themselves as children of God, and with a love of and responsibility for God’s creation. We hope to have engendered in each student an enthusiasm for life-long learning, a respect and regard for others, and a commitment to find solutions to personal, societal, and global problems.";"http://www.trinityschooloftexas.com/";"https://www.facebook.com/trinityschooloftexas";"Mon - Fri: 7:30 am - 4:00 pm";"http://www.trinityschooloftexas.com/index.php/about-us/employment";"http://www.trinityschooloftexas.com/index.php/admissions/the-admission-process";;"n";"n";"y";"y";"y";"n";"http://www.trinityschooloftexas.com/images/ouTSTanding_logo2.png";"https://fbcdn-sphotos-f-a.akamaihd.net/hphotos-ak-frc3/t1.0-9/q71/s720x720/10253940_586436528119873_8768376103120783566_n.jpg";"https://fbcdn-sphotos-a-a.akamaihd.net/hphotos-ak-prn1/t1.0-9/q72/s720x720/10247252_586432718120254_5538309246507265725_n.jpg";"https://fbcdn-sphotos-f-a.akamaihd.net/hphotos-ak-frc3/t1.0-9/p180x540/10329128_586432481453611_4406138689923652752_n.jpg";"https://fbcdn-sphotos-c-a.akamaihd.net/hphotos-ak-frc3/t1.0-9/q71/s720x720/10329084_586436771453182_8921357359417771769_n.jpg";;
90378;"Trinity Lutheran Center for Children";"901 Boca Chica Blvd";"Brownsville";"TX";78520;"CAMERON";"956-542-0027";"http://www.tlcbrownsville.com/Blank-1.html";;"Trinity Lutheran Child Care has been caring for Brownsville's children since 1985. We believe that all children are special and we offer a quality child care program for infants, toddlers, preschoolers and after-school students. Our goal is to provide a safe, comfortable, Christian environment for early learning and development. Our curriculum encourages social, emotional, physical, intellectual and spiritual growth. We strive to help each child learn self-discipline and independence, as well as, learn to relate to others, value friendship, and to respect one another. 

We encourage parents to come to our facility with their child/children for an informal tour. We look forward to visiting with you and meeting your family's child care needs. ";"http://www.tlcbrownsville.com/Blank-1.html";;"6:30am-6:00pm";;;;"y";"y";"y";"y";"y";"n";"http://www.tlcbrownsville.com/publishImages/Blank-1~~element64.jpg";"http://www.tlcbrownsville.com/publishImages/Blank-1~~element52.JPG";;;;;
90379;"Trinity Lutheran Child Development Center";"2001 Hunter";"Tyler";"TX";75701;"SMITH";"903-593-7465";"http://www.tlctyler.org/early-childhood-ministry";"aschutz@tlctyler.org";"Trinity Lutheran Early Childhood Ministry is a Christ centered School where we are grounded in the Word of God and dedicated to showing the love of Jesus to all our students and their families. Trinity is much more than a daycare center. We have the rare opportunity, with Jesus as our foundation, to provide care not only to our students but to the entire family. Through our Jesus Time curriculum we offer a take home sheet that allows families to study God’s Word together at home. We also have special events to bring families together in God’s Name to celebrate His love in our lives. We believe that God has called you to this place at this time and it is our privilege to respond to that call by showing your family His grace and love!";"http://www.tlctyler.org/early-childhood-ministry";;"7am - 6pm, Monday - Friday";;"http://www.tlctyler.org/early-childhood-ministry/admissions";;"n";"n";"n";"y";"y";"y";;"https://scontent-a-sjc.xx.fbcdn.net/hphotos-ash3/t1.0-9/p180x540/1378388_631932510161884_469737492_n.jpg";"https://fbcdn-sphotos-c-a.akamaihd.net/hphotos-ak-ash3/t1.0-9/p480x480/533928_488478931173910_128628440_n.jpg";"https://fbcdn-sphotos-b-a.akamaihd.net/hphotos-ak-frc3/t1.0-9/q72/s720x720/1981884_701378863217248_1251862248_n.jpg";"https://scontent-b-sjc.xx.fbcdn.net/hphotos-prn2/t1.0-9/q71/s720x720/1377355_709298302425304_595751761_n.jpg";;
90381;"Trinity Lutheran Childrens Ctr";"1316 Washington Ave";"Houston";"TX";77002;"HARRIS";"713-224-3207";"http://www.trinitydt.org/earlychildhood";;"Our goal at Trinity is to provide families of the community, church, and school with a safe, educational, Christ–centered Early Childhood experience. We strive to work in partnership with parents who have the primary and most critical role in the nurturing of their child. It is also our intent to help parents strengthen the family unit according to God’s plan and purpose.  Our caring and well-trained staff members serve as positive role models and provide care that is supportive, nurturing,and responsive to each child’s individual needs. All staff meet and exceed the TDFPS training standards and are certified in CPR and First Aid. Several of our staff members are Certified Teachers.
";"http://www.trinitydt.org/earlychildhood";"https://www.facebook.com/trinitydt";"Monday through Friday, from 6:30 a.m. to 6:00 p.m. ";;;;"y";"y";"y";"y";"n";"n";;"http://www.trinitydt.org/uploads/ECC_banner.jpg";;;;;
90383;"Trinity Lutheran Early Childhood Center";"264 C R 143";"Riesel";"TX";76682;"MCLENNAN";"254-896-7105";;;;;;;;;;;;;;;;;;;;;"Y";
90384;"Trinity Lutheran Early Childhood Center";"3512 YMCA DR";"San Angelo";"TX";76904;"TOM GREEN";"325-947-1148";;;;;;;;;;;;;;;;;;;;;"Y";
90385;"Trinity Lutheran Head Start";"1511 Damon";"Rosenberg";"TX";77471;"FORT BEND";"281-238-9445";;;;;;;;;;;;;;;;;;;;;"Y";
90386;"Trinity Lutheran Preschool";"402 Atchison";"Sealy";"TX";77474;"AUSTIN";"979-885-2211";"http://www.tlcsealy.org/preschool/";;"Trinity Lutheran Preschool is committed to Christian education.  Our Christian preschool is an extension of the mission and ministry of Trinity Lutheran Church.  Through the school, we reach the younger children of our community, teaching them in a spiritual environment.  We teach them how to use the Bible, God’s Word for development of their faith, for a guide in life, and as a primary evangelism tool.
";"http://www.tlcsealy.org/preschool/";;"8 a.m. – 12 p.m.";;;;"n";"n";"n";"y";"y";"n";;"http://www.tlcsealy.org/preschool/wp-content/themes/preschool-wp28/sliderimage/6.jpg";"http://www.tlcsealy.org/preschool/wp-content/themes/preschool-wp28/sliderimage/1.jpg";"http://www.tlcsealy.org/preschool/wp-content/themes/preschool-wp28/sliderimage/2.jpg";"http://www.tlcsealy.org/preschool/wp-content/themes/preschool-wp28/sliderimage/4.jpg";;
90388;"Trinity Lutheran Preschool";"1530 E Washington";"Navasota";"TX";77868;"GRIMES";"936-825-9244";"https://www.facebook.com/TrinityLutheranPreschool/info";;"Our school has been in operation for 16 years and continues through God's Grace to surround children with the love of Jesus every day!
Children ages 18 months up to PreKindergarten enjoy developmentally appropriate learning activities as well as supervised outdoor play and
center time.
We offer QUALITY CARE IN A CHRISTIAN ENVIRONMENT!

";"https://www.facebook.com/TrinityLutheranPreschool/info";"https://www.facebook.com/TrinityLutheranPreschool/info";"Mon - Fri: 7:15 pm - 5:30 pm";;;;"n";"y";"y";"y";"n";"n";;"http://www.tlcsealy.org/preschool/wp-content/uploads/wppa/194.jpg";"http://www.tlcsealy.org/preschool/wp-content/uploads/wppa/370.jpg";"http://www.tlcsealy.org/preschool/wp-content/uploads/wppa/351.jpg";"http://www.tlcsealy.org/preschool/wp-content/uploads/wppa/308.jpg";;
90390;"Trinity Lutheran School Extended Care";"18926 Klein Church RD";"Spring";"TX";77379;"HARRIS";"(281)376-5773, ext 270";"http://www.trinityklein.org/school/early-childhood/ece-programs/extended-care/";;"Trinity provides supervised care for children before and after regular school hours. Extended care is available from 7:00 AM through 6:00 PM. Students arriving before 7:30 AM must report to Room 101. At 7:30 AM students in grades 1-8 will be sent to the designated before school care classroom. At 3:30 PM all students not picked up must report to the appropriate extended care room, or they must be under the direct supervision of a parent, teacher or coach.";"http://www.trinityklein.org/school/early-childhood/ece-programs/extended-care/";;"7am-6pm";;"http://www.trinityklein.org/ministries/early-childhood/admissions/";;"n";"n";"n";"y";"y";"n";;;;;;;
90401;"Triple L Ranch Child Development Center";"737 County Line Road";"New Braunfels";"TX";78130;"COMAL";"830-620-0254";"www.google.com.ph/url?sa=t&rct=j&q=&esrc=s&source=web&cd=1&ved=0CCgQFjAA&url=http%3A%2F%2Fwww.triplelranchnb.com%2F&ei=YoloU5qPFs-48gW85oLIDw&usg=AFQjCNEny8gpXs7SzohD7FaXVwAnSrpTLw&bvm=bv.66111022,d.dGc&cad=rjt";;"At Triple L Ranch our focus is on providing Love, Laughter and Learning throughout the day.
The three L's provide us with the base for what we stand for:
Love: We want each child to feel LOVED in their parents’ absence.
Laughter: It is important to LAUGH and have Fun during the day
Learn: We want to provide each child with the necessary tools to LEARN     Knowing the tremendous impact the early years have on a child, it is our goal to provide a supportive environment. We work together with parents to make each child’s years with us a positive and beneficial experience. We believe that it is our job as Caregivers and Parents to ensure each child is ready for the challenges ahead of them.";"www.google.com.ph/url?sa=t&rct=j&q=&esrc=s&source=web&cd=1&ved=0CCgQFjAA&url=http%3A%2F%2Fwww.triplelranchnb.com%2F&ei=YoloU5qPFs-48gW85oLIDw&usg=AFQjCNEny8gpXs7SzohD7FaXVwAnSrpTLw&bvm=bv.66111022,d.dGc&cad=rjt";;"Monday-Friday from 6:30AM to 6:00PM";;"http://www.triplelranchnb.com/Enrollment";;"y";"y";"y";"y";"y";"n";"http://media.cargocollective.com/1/12/406337/headerimg/Screen%20Shot%202014-01-27%20at%2012.46.28%20PM.png";"http://payload205.cargocollective.com/1/12/406337/6410541/Screen%20Shot%202013-11-25%20at%2010.54.27%20AM.png";"http://payload205.cargocollective.com/1/12/406337/6410541/9.jpg";"http://payload205.cargocollective.com/1/12/406337/6410557/open.jpg";"http://payload205.cargocollective.com/1/12/406337/6410541/sblox.jpg";;
90404;"Trotter YMCA Child Care Center";"1331 Augusta";"Houston";"TX";77057;"HARRIS";"713-781-2980";;;;;;;;;;;;;;;;;;;;;"Y";
90406;"Troy Headstart";"902 AUSTIN E";"Troy";"TX";76579;"BELL";"254-938-2570";"http://www.hccaa.com/headstart/headstartlocations.html";;"Head Start is a comprehensive child development program for low-income families designed to meet the needs of children age 3 to 5 including children with disabilities.  Components emphasized are education, health (medical, dental, nutrition, and mental health), and social services.  Parent involvement is an essential part of the program.  Head Start represents an organized method of assisting families to assess their needs.  Special needs children receive a full range of Head Start developmental services. ";"http://www.hccaa.com/headstart/headstartlocations.html";;"Monday thru Friday: 8:00 a.m. to 4:00 p.m. ";"http://www.hccaa.com/home/employment.html";;;"n";"n";"y";"y";"n";"n";"http://www.hccaa.com/images/89_logoblocks.GIF";;;;;;
90407;"Tru Kare";"107 E 7th";"Sundown";"TX";79372;"HOCKLEY";"806-229-3300";;;;;;;;;;;;;;;;;;;;;"Y";
90411;"Truman Price Elementary";"2906 E. Roberts";"Donna";"TX";78537;"HIDALGO";"956-464-1303";"http://donna.truman.schooldesk.net/";;"I think you might agree with me that reading is extremely important.  Students who read are more successful in all the academic content areas. So please ensure that your child reads at least 20 minutes everyday.  Make sure that your child knows that you value reading and let your children catch you reading.  Find opportunities to read with your child such as road signs while you are driving,  magazines while waiting in a doctor's lobby, or just reading for leisure.  Another thing that you can do to help children become better readers is to use close-caption when they are watching television.  Let's keep our students reading!";"http://donna.truman.schooldesk.net/";;"7:50am-3:30pm";;;;"n";"n";"y";"y";"y";"n";;"http://donna.truman.schooldesk.net/DesktopModules/SimpleGallery/ImageHandler.ashx?width=400&height=300&HomeDirectory=%2FPortals%2FDonna%2FTruman%2FGallery%2FAlbum%2F4866&fileName=Spring%20Fling%20Literacy%20Night%20266.JPG&portalid=409";"http://donna.truman.schooldesk.net/DesktopModules/SimpleGallery/ImageHandler.ashx?width=400&height=300&HomeDirectory=%2FPortals%2FDonna%2FTruman%2FGallery%2FAlbum%2F4866&fileName=Spring%20Fling%20Literacy%20Night%20272.JPG&portalid=409";"http://donna.truman.schooldesk.net/DesktopModules/SimpleGallery/ImageHandler.ashx?width=400&height=300&HomeDirectory=%2FPortals%2FDonna%2FTruman%2FGallery%2FAlbum%2F4866&fileName=Spring%20Fling%20Literacy%20Night%20254.JPG&portalid=409";"http://donna.truman.schooldesk.net/DesktopModules/SimpleGallery/ImageHandler.ashx?width=400&height=300&HomeDirectory=%2FPortals%2FDonna%2FTruman%2FGallery%2FAlbum%2F4866&fileName=Spring%20Fling%20Literacy%20Night%20266.JPG&portalid=409";;
90413;"TSTC Child Development Headstart";"2702 Dogwood";"Harlingen";"TX";78550;"CAMERON";"956-425-5292";;;;;;;;;;;;;;;;;;;;;"Y";
90414;"TSTC Early Head Start Child Development";"2225 North 28th St";"Harlingen";"TX";78550;"CAMERON";"956-425-4085";;;;;;;;;;;;;;;;;;;;;"Y";
90415;"Tucker Headstart CDC";"1521 W. Tucker Blvd.";"Arlington";"TX";76013;"TARRANT";"817-548-8678";"http://www.childcareassociates.org/find-a-location/5/";"tucker@childcareassociates.org";"More than 40 years ago, we set out to provide a basic necessity for many Texas families... quality child care. Today, Child Care Associates is the largest private non-profit child development organization in this area, operating 37 child development centers throughout Fort Worth and Tarrant County. We also oversee several other programs and special initiatives in this region, all focused on early childhood development.

Child Care Associates currently has a collaboration with two Tarrant County school districts using resources provided by Fort Worth ISD and Hurst/Euless/Bedford ISD that consists of 40 classrooms on a number of elementary school campuses. We also have other local collaborations where ISD teachers spend quality classroom time in our child development centers.";"http://www.childcareassociates.org/find-a-location/5/";"https://www.facebook.com/childcareassociates";"7:30 a.m. - 4:30 p.m. ";"http://www.childcareassociates.org/employment-opportunities/";;;"n";"n";"y";"y";"n";"n";"http://www.childcareassociates.org/images/logo.png";"http://www.childcareassociates.org/properties/5/CDC%20Building%20-%20Tucker.jpg";;;;;
90417;"Tulia Child Development Center";"134 N Bowie";"Tulia";"TX";79088;"SWISHER";"806-995-2786";;;;;;;;;;;;;;;;;;;;;"Y";
90418;"Turkey Creek Junior Academy";"1101 Hawk Trail";"Copperas Cove";"TX";76522;"CORYELL";"254-449-8319";"http://www.childcarecopperascove.com/";"childcare.tcja@gmail.com";"Turkey Creek Junior Academy has been in business for 16 years providing a quality learning environment for your children while you are working. We have a 13,000 square foot area with a beautifully controlled area and an acre of playground.
";"http://www.childcarecopperascove.com/";;"5:30am to 6:00pm";;;;"y";"y";"y";"y";"y";"n";"http://www.childcarecopperascove.com/cs/Satellite?blobcol=urlheaderimage&blobheader=image%2Fjpeg&blobheadername1=Content-Disposition&blobheadervalue1=inline%3B+filename%3Dchildcarecopperascove_siteheader.jpg&blobkey=id&blobtable=FoundationSite&blobwhere=1309921868749&ssbinary=true&moddate=2012-06-26%2004:32:04";"http://www.childcarecopperascove.com/cs/Satellite?blobcol=urlmainimage&blobheader=image%2Fjpeg&blobheadername1=Content-Disposition&blobheadervalue1=inline%3B+filename%3Dchildcarecopperascove_845415-callout.jpg&blobkey=id&blobtable=FoundationPage&blobwhere=1309816574031&ssbinary=true&moddate=2012-06-26%2004:33:06";;;;;
90420;"Turner CDC";"219 E 3rd";"Quanah";"TX";79252;"HARDEMAN";"940-663-2541";;;;;;;;;;;;;;;;;;;;;"Y";
90427;"Tuy Pathu";"9311 Nakita";"El Paso";"TX";79907;"EL PASO";"915-858-5835";;;;;;;;;;;;;;;;;;;;;"Y";
90428;"Tweaty and Christy Day Care";"210 E. SAM HOUSTON";"PHARR";"TX";78577;"HIDALGO";"956-283-9102";"https://www.facebook.com/TweatyandChristyDaycare/info";"Tweatychristydaycare@yahoo.com";;"https://www.facebook.com/TweatyandChristyDaycare/info";"https://www.facebook.com/TweatyandChristyDaycare/info";"Mon - Sun: 7:00 am - 9:00 pm";;;;"y";"y";"y";"y";"y";"n";;"https://fbcdn-sphotos-c-a.akamaihd.net/hphotos-ak-ash2/t1.0-9/p180x540/934940_371717192940323_1178814601_n.jpg";"https://fbcdn-sphotos-a-a.akamaihd.net/hphotos-ak-ash2/t1.0-9/s720x720/426765_262232123888831_1346734143_n.jpg";"https://fbcdn-sphotos-e-a.akamaihd.net/hphotos-ak-ash2/t1.0-9/p180x540/559240_244924608952916_166964904_n.jpg";"https://fbcdn-sphotos-a-a.akamaihd.net/hphotos-ak-ash2/t1.0-9/p180x540/393922_262228247222552_1941057805_n.jpg";;
90429;"Tweedy Day Care";"502 BLAKE STREET";"KILLEEN";"TX";76541;"BELL";"254-526-8687";;;;;;;;;;;;;;;;;;;;;"Y";
90431;"Twin Lakes Child Development Center";"1150 Bell S";"Cedar Park";"TX";78613;"WILLIAMSON";"512-335-8141";;;;;;;;;;;;;;;;;;;;;"Y";
90437;"Two by Two Christian Preschool";"103 S Tammye Lane";"Madisonville";"TX";77864;"MADISON";"936-348-7422";;;;;;;;;;;;;;;;;;;;;"Y";
90439;"TWU Clubhouse";"1600 Oakland ST";"Denton";"TX";76204;"DENTON";"940-898-3653";"http://www.twu.edu/housing/clubhouse.asp";"clubhouse@mail.twu.edu";"The Clubhouse is a recreational program designed for school age children between the ages of 5 and 12 (At the time of the child’s enrollment) of enrolled TWU students with priority given to TWU students living on-campus in family housing. Non-students affiliated with TWU will be considered on a space available basis. ";"http://www.twu.edu/housing/clubhouse.asp";;"Monday - Friday from 7:30am - 5:30pm";;"http://www.twu.edu/downloads/housing/TheClubhouse-EnrollmentPckt-Sp2014.pdf";;"n";"n";"n";"y";"y";"y";"http://www.twu.edu/images/housing/CLUBHOUSE.gif";;;;;;
90440;"TX Migrant Council-Pharr Head Start";"210 W. Navarro";"Pharr";"TX";78577;"HIDALGO";"956-702-8127";;;;;;;;;;;;;;;;;;;;;"Y";
90443;"Tyler Day Nursery";"2901 W. Gentry Prkwy";"Tyler";"TX";75702;"SMITH";"903-592-4861";"http://tylerdaynursery.org/?cp=1";"tdned@sbcglobal.net ";"Welcome to Tyler Day Nursery:
The oldest, licensed, nonprofit child-care program in the state of Texas!
For 76 years we have prided ourselves on providing quality child-care and preschool education for children of low-income and poverty level families in a healthy, safe and loving environment.
";"http://tylerdaynursery.org/?cp=1";;"7:30 a.m. to 5:30 p.m., Monday through Friday";;;;"y";"y";"y";"y";"n";"n";;"http://tylerdaynursery.org/clients/8/8e/8ed7c4ff1d995b028c1180c1bccb3f4a/5537677_sta.jpg";"http://tylerdaynursery.org/clients/8/8e/8ed7c4ff1d995b028c1180c1bccb3f4a/6773951_org.jpg";"http://tylerdaynursery.org/clients/8/8e/8ed7c4ff1d995b028c1180c1bccb3f4a/6774025_org.jpg";"http://tylerdaynursery.org/clients/8/8e/8ed7c4ff1d995b028c1180c1bccb3f4a/5575277_sta.png";;
90444;"Tyler Little Red School House Inc";"6611 Broadway S";"Tyler";"TX";75703;"SMITH";"903-561-0746";;;;;;;;;;;;;;;;;;;;;"Y";
90446;"Tyler Street Christian Academy";"915 Ninth Street West";"Dallas";"TX";75208;"DALLAS";"214-941-9717";"http://www.tsca.org/tylerstreet/site/default.asp";;"Tyler Street Christian Academy is an independent, non-denominational private PK-12 grade school located in North Oak Cliff.

Founded in 1972, Tyler Street Christian Academy provides a college preparatory education and seeks to develop Christ-like character preparing graduates for a life of leadership and service to God and the Community.";"http://www.tsca.org/tylerstreet/site/default.asp";;;"http://www.tsca.org/Domain/28";"http://www.tsca.org/domain/29";"http://www.tsca.org/Domain/54";"n";"n";"y";"y";"y";"n";"http://www.tsca.org/cms/lib07/tx02000135/centricity/template/globalassets/images///logo/new%20tsca%20logo.jpg";"http://www.tsca.org/cms/lib07/tx02000135/centricity/moduleinstance/184/large/103_1.jpg?rnd=0.458573852413601";"http://www.tsca.org/cms/lib07/tx02000135/centricity/moduleinstance/184/large/106_1.jpg?rnd=0.354517014862279";"http://www.tsca.org/cms/lib07/TX02000135/Centricity/ModuleInstance/184/large/145_1.jpg?rnd=0.233525267445261";"http://www.tsca.org/cms/lib07/TX02000135/Centricity/ModuleInstance/184/large/150_1.jpg?rnd=0.607992606986311";;
90447;"Tyrrell YMCA";"4401 Ferndale";"Port Arthur";"TX";77642;"JEFFERSON";"409-962-6644";;;;;;;;;;;;;;;;;;;;;"Y";
90448;"Tzu Chi Great Love Preschool and Kindergarten";"534 Beltline Road West";"Richardson";"TX";75080;"DALLAS";"214-446-1776";"https://www.facebook.com/pages/Tzu-Chi-Great-Love-Preschool-Kindergarten-Official-Page/128271533871244?id=128271533871244&sk=info";"tzuchigreatlove@hotmail.com";"The mission of Tzu Chi Great Love Preschool and Kindergarten is to provide students with a rich and rewarding educational experience that will motivate them to enhance their academic learning and to develop inner strength.

All Tzu Chi Great Love Preschool and Kindergarten programs reflect a commitment to provide young children with the opportunity to promote their positive character traits of kindness, trustworthiness, and integrity.";"https://www.facebook.com/pages/Tzu-Chi-Great-Love-Preschool-Kindergarten-Official-Page/128271533871244?id=128271533871244&sk=info";"https://www.facebook.com/pages/Tzu-Chi-Great-Love-Preschool-Kindergarten-Official-Page/128271533871244?id=128271533871244&sk=info";"7am-6pm";;;;"n";"n";"y";"y";"y";"n";;"https://fbcdn-sphotos-f-a.akamaihd.net/hphotos-ak-frc3/t1.0-9/36194_128558043842593_5644675_n.jpg";"https://fbcdn-sphotos-d-a.akamaihd.net/hphotos-ak-frc3/t1.0-9/36708_128281067203624_2258793_n.jpg";"https://fbcdn-sphotos-b-a.akamaihd.net/hphotos-ak-frc3/t1.0-9/36708_128280987203632_2410267_n.jpg";"https://fbcdn-sphotos-e-a.akamaihd.net/hphotos-ak-ash2/t1.0-9/36708_128281050536959_6905039_n.jpg";;
