933311;"Gifted and Talented Kid's Academy";"14551 Cullen Blvd Ste. B";"Houston";"TX";77047;"HARRIS";"713-738-5955";"http://www.giftedandtalentedkidsacademy.com/";"giftedandtalentedkids@gmail.com";;"http://www.giftedandtalentedkidsacademy.com/";"https://www.facebook.com/gifted.kidsacademy?ref=tn_tnmn";"6:00am - 6:00pm";"http://www.giftedandtalentedkidsacademy.com/#!work-for-us!";"http://www.giftedandtalentedkidsacademy.com/#!enrollment-package";;"y";"y";"y";"y";"y";"y";;;;;;;
933317;"Gingerbread House";"1311 Austin ST";"San Angelo";"TX";76903;"TOM GREEN";"325-653-3972";;;;;;;;;;;;;;;;;;;;;"Y";
933319;"Glen Rose Early Head Start";"200 South Barnard";"Glen Rose";"TX";76043;"SOMERVELL";"254-898-0770";"http://www.txns.org/headstart.html";;"The mission of Texas Neighborhood Services is found in its chartered by-laws originally created in 1965 and modified throughout the corporation’s history. The chartered mission is to administer the social programs of the United States, State, Public or Private assignment or award in the various counties applied for and to administer other programs designed to assist citizens in the counties we serve. Texas Neighborhood Services strategically targets this mission with the support of three significant groups in the community; representatives of the low-income, elected officials from the public sector, and business leaders from the private sector. The objective of working with these groups is to seek out, identify, and aid in the elimination of the causes of poverty within the communities served, help people prepare for, find and retain long term employment, and match employers with a quality, job-ready workforce. TNS executes this mission to make the entire community more responsive to the needs and interests of its citizens. This is accomplished by mobilizing available resources and bringing about a greater institutional sensitivity to the individuals being helped while at the same time developing a system of priorities among projects, activities, and areas, as needed, for the most effective and efficient use of resources.";"http://www.txns.org/headstart.html";;;"http://www.txns.org/employment.html";;;"n";"n";"y";"y";"n";"n";"http://www.txns.org/Head_Start_Logo.gif";;;;;;
933320;"GLM Child Development & Learning Center";"4807 Wayne Street";"Houston";"TX";77026;"HARRIS";"713-670-8335";;;;;;;;;;;;;;;;;;;;;"Y";
933321;"Gloria's Day Care Center, LLC";"3417 W. Fiesta Loop";"Laredo";"TX";78043;"WEBB";"956-725-1316";;;;;;;;;;;;;;;;;;;;;"Y";
933324;"Gloryland Kidz Learning Center";"8433 FM 1464 ste 4";"Richmond";"TX";77407;"FORT BEND";"281-980-9705";;;;;;;;;;;;;;;;;;;;;"Y";
933325;"Godblessings C.DC.";"14214F - 14206 Hwy 3";"Webster";"TX";77598;"HARRIS";"409-497-5024";;;;;;;;;;;;;;;;;;;;;"Y";
933331;"Gods Lil Angels 24 Hour Day Care";"2421 Matland Dr";"Dallas";"TX";75232;"DALLAS";"214-853-2518";;;;;;;;;;;;;;;;;;;;;"Y";
933336;"Grace Academy";"15401 Bellaire Blvd";"Houston";"TX";77083;"HARRIS";"281-564-7220";;;;;;;;;;;;;;;;;;;;;"Y";
933337;"Grace Noah's Learning Center, Inc.";"467 State Hwy. 173 N.";"Bandera";"TX";78003;"BANDERA";"830-796-4722";"http://www.gracebandera.org/about.html";"gracenoahsark@att.net";"Grace Noah's Ark Learning Center, a non profit organization, is a ministry of Grace Lutheran Church.  Noah's Ark philosophy is to provide a loving, safe environment for children to develop the potential that God has planned for them.  

 

The City of San Antonio has awarded the Texas Rising Star Provider Certificate to Grace Noah's Ark Learning Center.  In order to receive this recognition the center had to meet certain qualifications.  Noah's Ark received a 3 star rating out of a possible 4 stars.  This program is through the Texas Workforce Commission who assist low income families and single parents with their child care tuition.";"http://www.gracebandera.org/about.html";;"Monday through Friday from 7:00 am to 6:00 pm.  ";;;;"not mentioned in the website";"not mentioned in the website";"not mentioned in the website";"not mentioned in the website";"not mentioned in the website";"not mentioned in the website";;;;;;;
933340;"Grandma's Little Angels Learning Center LLC";"415 San Jose St.";"San Juan";"TX";78589;"HIDALGO";"956-781-5432";;;;;;;;;;;;;;;;;;;;;"Y";
933345;"Greenspoint Christian Academy";"11703 Walters RD";"Houston";"TX";77067;"HARRIS";"281-440-9422";;;;;;;;;;;;;;;;;;;;;"Y";
933347;"Grins-N-Giggles Playhouse";"630 CR 4700";"Winnsboro";"TX";75494;"WOOD";"903-629-3322";;;;;;;;;;;;;;;;;;;;;"Y";
933350;"Growing Minds Learning Center, LLC";"529 E Mulberry ST";"Angleton";"TX";77515;"BRAZORIA";"979-849-9900";;;;;;;;;;;;;;;;;;;;;"Y";
933353;"Gulfton Promise Head Start";"6615 Rookin";"Houston";"TX";77074;"HARRIS";"713-721-1547";;;;;;;;;;;;;;;;;;;;;"Y";
933354;"Hagy Learning Center a division of NDCP";"1301 Streit DR";"Amarillo";"TX";79106;"POTTER";"806-356-8093";"http://www.ndcp.net/";;;"http://www.ndcp.net/";;;;;;"y";"y";"y";"y";"y";"n";;;;;;;
933356;"Handprints Academy";"606 Pioneer Rd";"Mesquite";"TX";75149;"DALLAS";"972-285-6683";;;;;;;;;;;;;;;;;;;;;"Y";
933357;"Happy Faces CDC";"508 N Gray ST";"Killeen";"TX";76541;"BELL";"254-554-8451";;;;;;;;;;;;;;;;;;;;;"Y";
933359;"Happy Heart Child Care";"521 E Highway 34";"Italy";"TX";76651;"ELLIS";"972-483-1800";"https://www.facebook.com/pages/Happy-Heart-Childcare/223415637668762?id=223415637668762&sk=info";"happy.hearts2@yahoo.com";;"https://www.facebook.com/pages/Happy-Heart-Childcare/223415637668762?id=223415637668762&sk=info";"https://www.facebook.com/pages/Happy-Heart-Childcare/223415637668762?id=223415637668762&sk=info";"Mon - Fri: 6:00 am - 6:00 pm";;;;"not mentioned in the website";"not mentioned in the website";"not mentioned in the website";"not mentioned in the website";"not mentioned in the website";"not mentioned in the website";;"https://fbcdn-sphotos-g-a.akamaihd.net/hphotos-ak-prn2/t1.0-9/q71/s720x720/1601303_773280996015554_2278990427380060572_n.jpg";"https://fbcdn-sphotos-e-a.akamaihd.net/hphotos-ak-ash3/t1.0-9/q74/s720x720/1920565_743748825635438_1235267129_n.jpg";"https://fbcdn-sphotos-b-a.akamaihd.net/hphotos-ak-ash3/t1.0-9/q77/s720x720/10252098_773280582682262_6766735030766538779_n.jpg";"https://fbcdn-sphotos-a-a.akamaihd.net/hphotos-ak-frc3/t1.0-9/q72/s720x720/10155710_773280382682282_339909067179416831_n.jpg";;
933360;"Happy Hippopotamus Daycare Academy East";"1700 Eastman Road North";"Longview";"TX";75601;"GREGG";"903-236-7777";"http://happyhippodc.com/happy_hippo_website_006.htm";"cheryld@hippodaycare.com";"The Happy Hippopotamus Daycare Academy East is located between Eden and Alpine on Eastman Rd. right by the Forest Park Middle School. Serving the Longview ISD, Hallsville and East Longview areas, we offer six classrooms, an after-school area, dining room and a huge shaded playground for safe, constructive playtime! We care for children from newborn to 12 years and offer Texas School Ready (TSR) Program with a grant for 3 & 4 year olds! We also use the Scholastic Learning Curriculum. Come meet our friendly and experienced staff see why the Hippo East is the place to be! ";"http://happyhippodc.com/happy_hippo_website_006.htm";;;"http://happyhippodc.com/linked/hhda_east_employment_app.pdf";"http://happyhippodc.com/linked/hhda_east_admission_booklet.pdf";"http://happyhippodc.com/linked/hhda_east_parent_handbook.pdf";"y";"y";"y";"y";"y";"y";;"http://happyhippodc.com/images/happy_hippo_website003001.jpg";"http://happyhippodc.com/images/happy_hippo_website004001.jpg";;;;
933366;"Harris Intermediate Ryan YMCA";"8400 Cleburne RD W";"Fort Worth";"TX";76123;"TARRANT";"817-825-3231";"http://www.ymcafw.org/Locations/Ryan/Teens/Camp_Opportunities/camp_opportunities.aspx";"sjohnson@ymcafw.org";"The CIT Program provides participants with training in how to use effective leadership skills throughout their lives. The leadership skills include communication, teamwork, setting goals and making plans to achieve them, decision making, developing strong relationships with others, increasing confidence, creativity, handling conflicts and problem solving. This program is for students entering the 7th grade in the fall of 2013 and CITs will assist in day camp programs and field trips.";"http://www.ymcafw.org/Locations/Ryan/Teens/Camp_Opportunities/camp_opportunities.aspx";"https://www.facebook.com/ymcafortworth";"6:30am to 6:30pm ";"http://www.ymcafw.org/employment.aspx";"https://ops1.operations.daxko.com/Online/Login.aspx?ReturnUrl=/Online/Membership/myaccount.aspx?cid=3117&cid=3117";;"n";"n";"n";"n";"y";"y";;"http://www.ymcafw.org/uploadedImages/Global_Images/Teens/Teens.jpg";"http://www.ymcafw.org/uploadedImages/Global_Images/Family/AA%20family.jpg";"http://www.ymcafw.org/uploadedImages/Spotlight/Web-SeptemberInfo.2.gif";"http://www.ymcafw.org/uploadedImages/Images/Adults/campainger%20tools.jpg";;
933367;"Hart to Hart Learning Center";"211 N Lamesa RD";"Midland";"TX";79701;"MIDLAND";"432-685-3121";;;;;;;;;;;;;;;;;;;;;"Y";
933368;"Hartman Elementary AlphaBest";"510 Birmingham S";"Wylie";"TX";75098;"DALLAS";"214-548-3973";"http://www.alphabest.org/contact-district.cfm";"info@alphabest.org";" AlphaBEST designs and operates extended day, summer and tutoring programs that offer opportunities for students to learn, develop, explore, and have fun beyond the school day in a safe, educational environment.

Founded in 2005, AlphaBEST Education currently provides licensed afterschool services to approximately 8,000+ students nationally. Additionally, AlphaBEST provides tutoring programs including supplemental education services.";"http://www.alphabest.org/contact-district.cfm";"https://www.facebook.com/AlphaBestEducationInc";;"http://www.alphabest.org/careers.cfm";"https://services.procareonline.com/WaitList/Waitlist.aspx?key=5188540738";;"n";"n";"n";"y";"y";"y";;"http://www.alphabest.org/pilotFiles/photoImages/files/Drama%20Notebook.jpg";"http://www.alphabest.org/pilotFiles/photoImages/files/camp%20invention2.JPG";"http://www.alphabest.org/pilotFiles/photoImages/files/Go%20far%20start24.jpg";"http://www.alphabest.org/pilotFiles/photoImages/files/Wylie%202.JPG";;
933371;"Haven's Learning Center";"311 S. Conway";"Alton";"TX";78573;"HIDALGO";"956-581-4342";;;;;;;;;;;;;;;;;;;;;"Y";
933375;"Head Start Jim Martin Elementary";"730 Canterbury";"San Antonio";"TX";78228;"BEXAR";"210-397-1444";"http://www.family-service.org/headstart_sites.htm";"Support@family-servicew.org";" Family Service Association of San Antonio has been building strong families since 1903. It is the oldest human service agency in San Antonio dedicated to helping children, seniors, and families in need.

From five neighborhood locations and from more than 56 school campuses, Family Service provides high quality service in English and Spanish to the residents of 28 counties of all ethnic and racial backgrounds and all socio-economic levels.

Family Service is a private, non-profit, non-sectarian agency funded by the United Way, United States Department of Health and Human Services, fee-for-service contracts with both public and private organizations, foundation and corporate grants, private contributions, client fees, and outpatient mental health insurance. 

Fees are charged on a sliding scale, and no one is denied help because of their inability to pay the full cost of service.";"http://www.family-service.org/headstart_sites.htm";"https://www.facebook.com/pages/Family-Service-Association-of-San-Antonio-Inc/116535046186";"7:30 a.m. to 2:30 p.m.";;;;"y";"y";"y";"y";"n";"n";"http://www.family-service.org/images/Logos/logo_1.gif";;;;;;
933376;"Head Start Mary Hull Elementary School";"7320 Remuda";"San Antonio";"TX";78227;"BEXAR";"210-397-0971";"http://www.family-service.org/headstart_sites.htm";"Support@family-servicew.org";" Family Service Association of San Antonio has been building strong families since 1903. It is the oldest human service agency in San Antonio dedicated to helping children, seniors, and families in need.

From five neighborhood locations and from more than 56 school campuses, Family Service provides high quality service in English and Spanish to the residents of 28 counties of all ethnic and racial backgrounds and all socio-economic levels.

Family Service is a private, non-profit, non-sectarian agency funded by the United Way, United States Department of Health and Human Services, fee-for-service contracts with both public and private organizations, foundation and corporate grants, private contributions, client fees, and outpatient mental health insurance. 

Fees are charged on a sliding scale, and no one is denied help because of their inability to pay the full cost of service.";"http://www.family-service.org/headstart_sites.htm";"https://www.facebook.com/pages/Family-Service-Association-of-San-Antonio-Inc/116535046186";"7:30 a.m. to 2:30 p.m.";;;;"y";"y";"y";"y";"n";"n";"http://www.family-service.org/images/Logos/logo_1.gif";;;;;;
933377;"Head Start Park Village Elementary School";"5855 Midcrown Dr.";"San Antonio";"TX";78218;"BEXAR";"210-637-4890, Ext: 42593";"http://www.family-service.org/headstart_sites.htm";"Support@family-servicew.org";" Family Service Association of San Antonio has been building strong families since 1903. It is the oldest human service agency in San Antonio dedicated to helping children, seniors, and families in need.

From five neighborhood locations and from more than 56 school campuses, Family Service provides high quality service in English and Spanish to the residents of 28 counties of all ethnic and racial backgrounds and all socio-economic levels.

Family Service is a private, non-profit, non-sectarian agency funded by the United Way, United States Department of Health and Human Services, fee-for-service contracts with both public and private organizations, foundation and corporate grants, private contributions, client fees, and outpatient mental health insurance. 

Fees are charged on a sliding scale, and no one is denied help because of their inability to pay the full cost of service.";"http://www.family-service.org/headstart_sites.htm";"https://www.facebook.com/pages/Family-Service-Association-of-San-Antonio-Inc/116535046186";"7:30 a.m. to 2:30 p.m.";;;;"y";"y";"y";"y";"n";"n";"http://www.family-service.org/images/Logos/logo_1.gif";;;;;;
933378;"Head Start Pilgrim School";"500 Pilgrim Drive";"San Antonio";"TX";78213;"BEXAR";"210-525-0350";"http://www.family-service.org/headstart_sites.htm";"Support@family-servicew.org";" Family Service Association of San Antonio has been building strong families since 1903. It is the oldest human service agency in San Antonio dedicated to helping children, seniors, and families in need.

From five neighborhood locations and from more than 56 school campuses, Family Service provides high quality service in English and Spanish to the residents of 28 counties of all ethnic and racial backgrounds and all socio-economic levels.

Family Service is a private, non-profit, non-sectarian agency funded by the United Way, United States Department of Health and Human Services, fee-for-service contracts with both public and private organizations, foundation and corporate grants, private contributions, client fees, and outpatient mental health insurance. 

Fees are charged on a sliding scale, and no one is denied help because of their inability to pay the full cost of service.";"http://www.family-service.org/headstart_sites.htm";"https://www.facebook.com/pages/Family-Service-Association-of-San-Antonio-Inc/116535046186";"7:30 a.m. to 2:30 p.m.";;;;"y";"y";"y";"y";"n";"n";"http://www.family-service.org/images/Logos/logo_1.gif";;;;;;
933382;"Heaven's Best Child Development Center";"2615 Blodgett";"Houston";"TX";77004;"HARRIS";"832-892-5339";"https://www.facebook.com/pages/Heavens-Best-Montessori-School-24hr-Child-Development-Center/222636807796978?id=222636807796978&sk=info";"share@heavensbestmontessori.com";"Quality education, at a moderate price, delivering amazing results in 3, 6, 9 and 12 month intervals. Watch your child's progress. Stop by and and enroll today!";"https://www.facebook.com/pages/Heavens-Best-Montessori-School-24hr-Child-Development-Center/222636807796978?id=222636807796978&sk=info";"https://www.facebook.com/pages/Heavens-Best-Montessori-School-24hr-Child-Development-Center/222636807796978?id=222636807796978&sk=info";;;;;"y";"y";"y";"y";"n";"n";;"https://fbcdn-sphotos-a-a.akamaihd.net/hphotos-ak-ash2/t1.0-9/s720x720/307066_222651284462197_554978085_n.jpg";"https://scontent-b-lax.xx.fbcdn.net/hphotos-frc3/t1.0-9/s720x720/295990_222643447796314_346554310_n.jpg";"https://fbcdn-sphotos-a-a.akamaihd.net/hphotos-ak-ash2/t1.0-9/s720x720/295990_222643451129647_953558313_n.jpg";"https://fbcdn-sphotos-f-a.akamaihd.net/hphotos-ak-frc3/t1.0-9/s720x720/295990_222643444462981_972449420_n.jpg";;
933385;"Heavens Little Angels Child Care";"2254 Areba St";"Dallas";"TX";75203;"DALLAS";"214-941-0304";;;;;;;;;;;;;;;;;;;;;"Y";
933388;"Heritage Daycare";"1604 Central Texas Expressway";"Lampasas";"TX";76550;"LAMPASAS";"512-556-9800";"http://newcovenantlampasas.com/preschool";;"At New Covenant Church, we love and serve babies in the name of Jesus.

Babes in Christ is a creative, loving, and peaceful place designed to care for children birth through crawlers. We want parents to feel confident that their child will be ministered to while in the nursery and will leave the nursery having had a touch from God.

In His steps is where walkers & talkers engage in a time of praise and worship, toddler Bible class, and play. Kids love it…so do their parents!

If you choose, a Mother’s Lounge is provided in the back of the worship center. There you may change, feed, or rock your baby in privacy while still being able to hear the service.
";"http://newcovenantlampasas.com/preschool";;;;;;"n";"y";"y";"y";"y";"n";"http://l.b5z.net/zirw/182/i/u/6050619/i/menu/a1.jpg";;;;;;
933389;"Hershey's Angels Childcare";"7630 Sanford Rd.";"Houston";"TX";77071;"HARRIS";"713-988-9870";;;;;;;;;;;;;;;;;;;;;"Y";
933395;"Highland Park Tiger Learning Center";"401 West 25th Street";"Texarkana";"TX";75503;"BOWIE";"903-792-7991";"http://www.txkisd.net/campuses/hp.asp";"Jennifer.Cross@txkisd.net";"Highland Park Elementary provides a rich academic environment for students with a focus on creating a health-conscientious student who understands their individual role in preserving the wellness of people and the environment. Through their wellness efforts, students learn the importance of maintaining a healthy environment by recycling, reducing and reusing with the addition of creating a greater awareness of the importance in sustaining a healthier lifestyle. ";"http://www.txkisd.net/campuses/hp.asp";;;"http://www.txkisd.net/departments/employment_careeropportunities.asp";"http://www.txkisd.net/departments/registrationandenrollment.asp";"http://www.txkisd.net/pdf/handbook/Elementary.pdf?42534157";"n";"n";"y";"y";"y";"n";;;;;;;
933398;"Hiram Clarke Head Start";"3810 West Fuqua";"Houston";"TX";77045;"HARRIS";"713-491-6178";;;;;;;;;;;;;;;;;;;;;"Y";
933399;"Honey Bee Academy";"6713, 6715 St. Augustine, 6717 St. Augustine";"Houston";"TX";77021;"HARRIS";"713-748-1895";;;;;;;;;;;;;;;;;;;;;"Y";
933400;"Hope Christian Academy Lambs";"3730 E McKinney ST Suite 101";"Denton";"TX";76208;"DENTON";"940-380-1141";"http://hopechristianacademy.com";"info@hopechristianacademy.com";"The goal of God's Fingerprints and Hope Christian Academy is to provide a high quality faith-centered educational experience for families and children in Littleton, Lakewood, Morrison and surrounding Colorado(CO) communities. We invite future parents to explore our website and visit us to learn more about our exceptional and unique educational program. ";"http://hopechristianacademy.com";;;;"http://hopechristianacademy.com/Enroll/";;"n";"n";"y";"y";"y";"n";"http://hopechristianacademy.com/Images/Headers/Site_Top.png";"http://hopechristianacademy.com/Images/Headers/Enroll.jpg";"http://hopechristianacademy.com/Images/Headers/Preschool.jpg";"http://hopechristianacademy.com/Images/Headers/Elementary.jpg";"http://hopechristianacademy.com/Images/Headers/Activities.jpg";;
933401;"Hope Christian Academy Moses";"3730 E McKinney ST 103";"Denton";"TX";76208;"DENTON";"940-243-7484";"http://hopechristianacademy.com";"info@hopechristianacademy.com";"The goal of God's Fingerprints and Hope Christian Academy is to provide a high quality faith-centered educational experience for families and children in Littleton, Lakewood, Morrison and surrounding Colorado(CO) communities. We invite future parents to explore our website and visit us to learn more about our exceptional and unique educational program. ";"http://hopechristianacademy.com";;;;"http://hopechristianacademy.com/Enroll/";;"n";"n";"y";"y";"y";"n";"http://hopechristianacademy.com/Images/Headers/Site_Top.png";"http://hopechristianacademy.com/Images/Headers/Enroll.jpg";"http://hopechristianacademy.com/Images/Headers/Preschool.jpg";"http://hopechristianacademy.com/Images/Headers/Elementary.jpg";"http://hopechristianacademy.com/Images/Headers/Activities.jpg";;
933403;"Hope School";"321 Old River Crossing";"Johnson City";"TX";78636;"BLANCO";"830-868-7400";;;;;;;;;;;;;;;;;;;;;"Y";
933408;"Huey Learning Center";"1416 N 5th ST";"Wichita Falls";"TX";76306;"WICHITA";"940-766-4332";;;;;;;;;;;;;;;;;;;;;"Y";
933409;"Hutto Head Start";"80 Mager LN";"Hutto";"TX";78634;"WILLIAMSON";"512-639-1004";"http://www.wbco.net/services.html";"marybaileyhs@wbco.net";"Head Start and Early Head Start are comprehensive child and family development programs that prepare children from birth to five years of age to become successful school students and members of society.  Head Start was started in the mid-1960’s and has grown into a multi-faceted partnership involving the federal government and local education, social service and health organizations.  Children and families participate in the program on the basis of eligibility criteria.  ";"http://www.wbco.net/services.html";;;;"http://www.wbco.net/pdf/Head%20Start%20Pre-Apps/Enrollment%20Application.pdf";;"y";"y";"y";"y";"n";"n";"http://www.wbco.net/images/WBCO-interior_07.gif";"http://www.wbco.net/images/WBCO-interior_03.gif";;;;;"Thursday"
933411;"I'm Just a Kid!";"323 W. Sunset";"San Antonio";"TX";78209;"BEXAR";"210-822-3016";"http://imjustakid.net/";"vacemas@aol.com";"Vision: A world where children receive the nurturing, guidance and love they need to develop; and providers can learn these practices, unrestricted by the general economy of society.
Mission: To provide care beyond minimum standards; where the foundation is love, safety, and a healthy environment; nurturing and guidance are provided while implementing early childhood best practices. ";"http://imjustakid.net/";;"Monday-Friday

  7AM to 6PM";;;"http://imjustakid.net/";"not mentioned in the website";"not mentioned in the website";"not mentioned in the website";"not mentioned in the website";"not mentioned in the website";"not mentioned in the website";;"http://imjustakid.net/wp-content/uploads/2012/11/Fire_pre_groupslide.png";"http://imjustakid.net/wp-content/uploads/2012/11/karate-vicki-Copyslide.bmp";"http://imjustakid.net/wp-content/uploads/2012/11/karate-1-Copyslide.bmp";"http://imjustakid.net/wp-content/uploads/2012/12/IMAG0249-1024x612.jpg";;
933412;"Ideal Day Care and Learning Center";"1000 E Red Bird Ln";"Dallas";"TX";75241;"DALLAS";"214-371-9228";;;;;;;;;;;;;;;;;;;;;"Y";
933416;"Imagination Station";"705 S. Raul Longoria Ste. I";"Edinburg";"TX";78539;"HIDALGO";"956-381-6490";;;;;;;;;;;;;;;;;;;;;"Y";
933418;"Imagination Station University";"5601 W. Mile 3";"Mission";"TX";78574;"HIDALGO";"956-432-0249";;;;;;;;;;;;;;;;;;;;;"Y";
933419;"Imelda's Day Care II";"4500 Southmost Rd.";"Brownsville";"TX";78521;"CAMERON";"956-546-0913";;;;;;;;;;;;;;;;;;;;;"Y";
933420;"Imelda's Gardens Child Care Center";"6206 Southmost Rd.";"Brownsville";"TX";78521;"CAMERON";"956-550-8458";;;;;;;;;;;;;;;;;;;;;"Y";
933430;"Jerry's Mother Goose";"3620 Clarksville Street";"Paris";"TX";75460;"LAMAR";"903-785-9635";;;;;;;;;;;;;;;;;;;;;"Y";
933432;"Johnson's Day Care & Learning Center #2";"2820 Clark";"Laredo";"TX";78043;"WEBB";"956-795-8824";;;;;;;;;;;;;;;;;;;;;"Y";
933433;"Jubilee Children Academy";"11522 Harwin Dr.";"Houston";"TX";77072;"HARRIS";"832-328-1919";;;;;;;;;;;;;;;;;;;;;"Y";
933435;"Junior Lobo Academy";"1498 IH 20 N Frontage";"Cisco";"TX";76437;"EASTLAND";"254-631-7378";"http://www.juniorloboacademy.com/";;"Junior Lobo Academy is located inside the beautiful Myrtle Wilks Community Center in Cisco, Texas. We are open Monday thru Friday from 7:30 am to 5:30 pm. Junior Lobo Academy is the only state licensed daycare center in Cisco, Texas opened year around to the public. We enroll children from 0 months to 12 years old. Junior Lobo Academy provides breakfast, lunch and afternoon snack to our children. The meals meet 60% of the daily nutrition for each child. Junior Lobo Academy provides a daily curriculum to enhance educational needs of our children.  Curriculum includes ABC's, 123's, colors, shapes, self help skills, proper hygiene, shoe tying, and getting along with others. Junior Lobo Academy helps qualifying parents find ways to pay for childcare.  We currently accept CCPO which helps pay for all or most monthly childcare fees. We are more than happy to give tours of our facility and programs. ";"http://www.juniorloboacademy.com/";;"Mon - Fri: 7:30 am to 5:30 pm";;"http://www.juniorloboacademy.com/upload/Admission%20Form.alpha.pdf";;"not mentioned in the website";"not mentioned in the website";"not mentioned in the website";"not mentioned in the website";"not mentioned in the website";"not mentioned in the website";"http://www.juniorloboacademy.com/bg-1-273366.jpeg?u=1224620719";;;;;;
933437;"Just Kids";"7819 Gardenia Rd";"Gilmer";"TX";75645;"UPSHUR";"903-801-0462";;;;;;;;;;;;;;;;;;;;;"Y";
