"Id";"Name";"Address";"City";"State";"Zip";"County";"Phone";"Main url";"Email";"Details";"location website";"Facebook page";"Career employment";"Application/registration url";"Parent handbook url";"Infant (under 12 months)";"Toddler (1-2yrs)";"Preschools (2-3yrs)";"pre-kindergarden(4yr)";"before/afterschools";"camps";"logo url";"monday hour";"tuesday hour";"wednesday hour";"thursday hour";"friday hours";"saturday hour";"sunday hour";"notes"
1179475;"ST MICHAEL";"3431 SAINT MICHAELS BLVD NW";"CANTON";"OH";44718;"STARK";3304922657;"https://www.smscanton.org/";"stmichaelelem@youngstowndiocese.org";"In 1952, under the leadership of Reverend Ferdinand Hartmann, the first mass of St. Michaels took place on July 6th. The mass was held in the auditorium of Avondale School with 250 in attendance. In order to assist with funding of the parish, clubs were formed by men and women. At this time babysitting clubs were also formed so that men and women could attend the meetings of the various clubs. This cooperative spirit has continued to be a part of the parish today. The parish was able to purchase a rectory in late 1952, and this housed the pastor as well as served as a gathering for weekday masses. The equipment for this was all donated, and the parish began to grow. The goal of the Fr. Hartmann was to make St. Michaels the home of ""friendly people."" Although the church was the main priority, members of St. Michaels were even more eager to provide a Catholic education for for their children. The first campaign dinner for this construction was launched in 1953, and within in 10 days $130,000 was raised for the cause. The school was officially established on November 23, 1953, with the arrival of the four sisters of Notre Dame to help prepare with the opening. The first communion class of 1954 consisted of 22 students, and 6 students graduated that same year. The first outside activities were also created in 1954, and these included Boy Scouts, Girl Scouts, and Club Scout troops, as well as San Michel Club for teenagers and a Garden Club for women. The parish has since grown in both size and population, and has recently celebrated it's 60th anniversary in 2012. It has grown to accomodate 2,300 families with over 900 families in the grade school and the school of religion. ";"https://www.smscanton.org/";"https://web.facebook.com/pg/stmichaelschoolcanton/about/?ref=page_internal";;"https://www.smscanton.org/student-forms";"https://www.smscanton.org/student-forms";;;"x";"x";;;"https://scontent.flhe2-1.fna.fbcdn.net/v/t1.0-1/c0.0.200.200/p200x200/12645093_1125366074174742_1892079360883066280_n.jpg?_nc_cat=106&_nc_eui2=AeF3mJlFLJ7k0W3pHxwvwMk9zFrA3YNoUKQ44P3CeY_imfkvpdXd6OJ3714LudMy4msL0tYjW4PZep6oxGAeWn2hqus9eSXk6uRlgQNpxnsQhINE2moj_W1yt42O6n4pazs&_nc_ht=scontent.flhe2-1.fna&oh=29d66da49cb82b05c594582e05daba69&oe=5C42539B";"7:30 AM to 2:35 PM.";"7:30 AM to 2:35 PM.";"7:30 AM to 2:35 PM.";"7:30 AM to 2:35 PM.";"7:30 AM to 2:35 PM.";"Closed";"Closed";
1179476;"ST MICHAEL CATHOLIC SCHOOL";"8700 BRECKSVILLE RD";"BRECKSVILLE";"OH";44141;"CUYAHOGA";4407170398;"https://www.stmichaelschoolinfo.com/";"smsbrecksville@yahoo.com";"We welcome you to St. Michael Catholic Preschool.  Our school is part of St. Michael School, which educates children from preschool through eighth grade.  The St. Basil Campus, located at 8700 Brecksville Road in Brecksville, is home to preschool, Jr. Kindergarten, two kindergarten classes, and two first grades.

 

The St. Michael Campus is located on the corner of Chestnut and Brecksville Roads in Independence.  Our licensed preschool program has become one of the most popular preschool programs in our area. 

 

The State of Ohio has acknowledged that we developed what most parents and educators only dream of--a real Early Childhood Learning Center here at the St. Basil Campus.";"https://www.stmichaelschoolinfo.com/st-basil-campus";"https://web.facebook.com/St-Michael-School-Alumni-Community-1863558367255458/";;"https://www.stmichaelschoolinfo.com/kindergarten-registration";"https://docs.wixstatic.com/ugd/5d081f_d1435b40e96a4fda9163fcc8015a7d59.pdf";;;"x";"x";;;"https://static.wixstatic.com/media/5d081f_cd3273ae15944ce88edcbd698d53301a.jpg/v1/fill/w_365,h_215,al_c,q_80,usm_0.66_1.00_0.01/5d081f_cd3273ae15944ce88edcbd698d53301a.jpg";"8:45a.m.-2:45 p.m";"8:45a.m.-2:45 p.m";"8:45a.m.-2:45 p.m";"8:45a.m.-2:45 p.m";"8:45a.m.-2:45 p.m";"Closed";"Closed";
1179477;"ST MICHAEL CONSOLIDATED";"300 MARKET ST";"RIPLEY";"OH";45167;"BROWN";9373924202;"http://stmichaelripley.com/";"kelly.gilkerson@stmichaelripley.org";"St. Michael offers a truly unique educational experience.  We combine the Catholic school experience with a small town, rural values creating a family atmosphere which can only be found at St. Michael.  Our students are taught the faith every day and have the opportunity to participate in Holy Mass every Friday and are able to pray several times a day including participating in activities like stations of the cross, praying the rosary and adoration of the Holy Eucharist.  In addition to the core classes that students would receive at our public school counterparts, St. Michael students have art, music and physical education.  This year we are adding keyboarding and foreign language curriculum as well.

We are the only Catholic school in Brown County and we have children from as far away as North Adams School District and Felicity.  We have buses that run from Georgetown and Ripley. Although we do charge tuition, it is very reasonable and tuition assistance is available through both state-sponsored scholarships and other funding.  St. Michael students are able to participate in the same extra-curricular activities as students from other schools.  Although we are a Catholic school and we do teach our faith, we have many non-Catholic students who enjoy our Christian-based curriculum.  So, if we are the right fit for you, please don’t hesitate to contact us regarding your enrollment at St. Michael School!

As of October 1, 2018, St. Michael School has 101 students enrolled. All staff, volunteers, or any other adult who has direct contact with St. Michael students must have Virtus training, background checks through selection.com, as well as maintain Virtus compliance.";"http://stmichaelripley.com/";"https://web.facebook.com/pg/Stmichaelripleyohio/";;"http://www.stmichaelcatholicschool.org/PDF/Registration%20Form.pdf";"http://stmichaelripley.com/index.php/handbook/st-michael-school-parent-and-student-handbook-2018-revised/";;;"x";;;;"https://scontent.flhe2-1.fna.fbcdn.net/v/t1.0-1/c3.0.200.200/p200x200/14068028_1030108873776050_7557435047466382034_n.jpg?_nc_cat=102&_nc_eui2=AeF9G1fe86f266u5uQ7daJWE9VqrDA7MwXYRxVy2Z7XkbKrVbLUDCut_O8uYcH26vpJKSeWL5VlLTchxE3Kaw3vEwCzoOOXeerdxKpkWsAJW9mAGB3brKozF_QOF0V56aG8&_nc_ht=scontent.flhe2-1.fna&oh=4a22ba52dccd0114d98110ad4ae8fbcb&oe=5C54C6D9";"7:55: AM-2:50 p.m";"7:55: AM-2:50 p.m";"7:55: AM-2:50 p.m";"7:55: AM-2:50 p.m";"7:55: AM-2:50 p.m";"Closed";"Closed";
1179478;"ST MICHAEL THE ARCHANGEL SCHOOL";"723 SUTTON PL";"FINDLAY";"OH";45840;"HANCOCK";4194232738;"http://www.findlaystmichaelschool.org/";;"At the center of education at St. Michael the Archangel School in Findlay, Ohio are beliefs and teachings of the Catholic Church. St. Michael offers a challenging curriculum steeped in Catholic tradition and conveyed by inventive and dedicated teachers who hold high academic and behavioral standards.  We help to develop our next generation of Catholic leaders by developing their faith and providing an atmosphere in which the Gospel message is at the fore.  Our educators excel at making these beliefs come alive in themselves and in those whom they teach, while emphasizing a Spirit-filled, faith-based community that uses the Gospel Message to develop a deeper understanding of APPLES.";"http://www.findlaystmichaelschool.org/";"https://web.facebook.com/pg/Stmichaelthearchangelschool/";;"http://www.findlaystmichaelschool.org/registration.html";"http://www.findlaystmichaelschool.org/assets/18-19_student-handbook.pdf";;;"x";"x";"x";;"http://www.findlaystmichaelschool.org/images/image_shieldlogo.png?crc=148385194";"8:00AM to 2:37PM";"8:00AM to 2:37PM";"8:00AM to 2:37PM";"8:00AM to 2:37PM";"8:00AM to 2:37PM";"Closed";"Closed";
1179479;"ST PATRICK";"610 S PORTLAND ST";"BRYAN";"OH";43506;"WILLIAMS";4196363592;"http://www.saintpatrickschoolbryan.org/";"lcinadr@saintpatrickschoolbryan.org";"St. Patrick Catholic School is a fully accredited school in Bryan, Ohio that educates students from preschool through eighth grade. We are accredited through the Ohio Catholic School Accrediting Association.";"http://www.saintpatrickschoolbryan.org/";"https://web.facebook.com/stpatcs/?_rdc=1&_rdr";;"http://www.saintpatrickschoolbryan.org/school-calendar";"http://www.saintpatrickschoolbryan.org/filedownload/showall_by_tags/tag/handbook";;;"x";"x";"x";;"https://scontent.flhe2-1.fna.fbcdn.net/v/t1.0-1/c65.18.220.220/s200x200/313219_167491133331934_1501260842_n.jpg?_nc_cat=110&_nc_eui2=AeGD_e0M8T0YoKU7ETIig7NEts-qHtYxMUoUAqjd8Rb198JZgwSshzDQ5oE1QYH3IwXD2D2IekBFfcZi19VD58JOAcXX63vJfKBe8XPngNd_7kj1Pp1AC3T9uc1va_BbbrQ&_nc_ht=scontent.flhe2-1.fna&oh=310ec96456b4436a12798d80e6c7baa1&oe=5C5BD135";"8:00 AM to 2:30 PM.";"8:00 AM to 2:30 PM.";"8:00 AM to 2:30 PM.";"8:00 AM to 2:30 PM.";"8:00 AM to 2:30 PM.";"Closed";"Closed";
1179480;"ST PASCHAL BAYLON";"5360 WILSON MILLS RD";"CLEVELAND";"OH";44143;"CUYAHOGA";4404426766;"https://www.saintpaschal.net/";"office@saintpaschal.com";"Saint Paschal Baylon School is a National Blue Ribbon School of Excellence serving students in preschool through grade 8.";"https://www.saintpaschal.net/";"https://web.facebook.com/stpaschalbaylonschoolohio/?_rdc=1&_rdr";;"https://www.saintpaschal.net/admissions/";"https://www.saintpaschal.net/wp-content/uploads/2018/06/PARENT-STUDENT_HANDBOOK_2017-2018-FINAL2.pdf";;;"x";"x";"x";;"https://scontent.flhe2-1.fna.fbcdn.net/v/t1.0-1/p200x200/16806951_777368035746245_5994489280287994409_n.jpg?_nc_cat=103&_nc_eui2=AeFoO4ez1kAGb76-rdCW3AkzFimBmIx2yGyaJDK1h-WrKpoVHbp-G_mYzbNwF4Wj_lzY9hSQtM48QaZNBRuAdgL_uld4ztWwKmIRBSgXn6nrWfPGftZDzh0TESUwroe8F4c&_nc_ht=scontent.flhe2-1.fna&oh=682279c97d7a41a122722ea72beee553&oe=5C511752";"8:05 a.m - 2:30 p.m";"8:05 a.m - 2:30 p.m";"8:05 a.m - 2:30 p.m";"8:05 a.m - 2:30 p.m";"8:05 a.m - 2:30 p.m";"Closed";"Closed";
1179482;"ST PATRICK";"226 ELM ST";"LONDON";"OH";43140;"MADISON";7408520161;"https://www.stpatricklondon.org/";;;"https://www.stpatricklondon.org/School/";"https://web.facebook.com/pages/St-Patrick-School/729420010478890?_rdc=1&_rdr";;;;;;;;;;;;;;;;;;
1179483;"ST PATRICK";"420 E WATER ST";"TROY";"OH";45373;"MIAMI";9373393705;"http://www.stpattroy.org/";"rsprock@stpattroy.org";"St. Patrick School has a rich and storied history dating back to 1888.  The parish had been serving the growing Catholic members of Troy for more than a quarter of a century when they planned for the construction of a new elementary school just north of the church on Crawford Street. It became a commanding two-story building with grades 6, 7, and 8 on the first floor, and grades 2, 3, 4, and 5 on the second floor.  The top floor was shared with the Sisters of the Precious Blood that taught at the school.  This “red brick school” served the parish well.  The cost to build the school was $2,661.84

“St. Patrick Free School”, as it was called, opened with nearly 50 students.  Operating expenses were met through an assessment of $2.40 from each parishioner over the age of 16.  The word “free” was appropriate because there was no tuition to attend the school.

Ground breaking for a new school took place in November of 1952, with the cornerstone being put in place on April 10, 1953.  The new school had 8 of the most modern classrooms, separate playgrounds for boys and girls, and a beautifully equipped kitchen.  This new state of the art building opened to students on September 14, 1953.";"https://sites.google.com/stpattroy.org/stpatrickcatholictroy/home";"https://web.facebook.com/stpattroy/";;"https://docs.google.com/viewer?a=v&pid=sites&srcid=ZGVmYXVsdGRvbWFpbnxzdHBhdHJpY2t0cm95c2Nob29sfGd4OjUxMmRiNWZiZTNmOWU2NA";;;;"x";;"x";;"https://lh5.googleusercontent.com/UjE18l552yEE_2TpSkp2kuVUfbBLSDJd0yLwISM4n3BMO6y4yuHjy9nCjUd_mjZJs5jPsJGx=w16383";"8:15am - 3:15pm";"8:15am - 3:15pm";"8:15am - 3:15pm";"8:15am - 3:15pm";"8:15am - 3:15pm";"Closed";"Closed";
1179484;"ST PATRICK OF HEATHERDOWNS";"4201 HEATHERDOWNS BLVD";"TOLEDO";"OH";43614;"LUCAS";4193811775;"http://toledostpatsschool.org/";"mary.miller@toledostpats.org";"The first step in establishing St. Patrick’s as a parish was made on June 15, 1955 when Bishop George Rehring purchased an eleven acre plot along Heatherdowns Boulevard from sisters Emma and Louise Kneer.

The parish was officially “born” on June 7, 1956, when Fr. James Brogan was appointed associate pastor at Maumee St. Joseph, armed with a list of 615 families who would become his new parish. Legend has it that Fr. Brogan visited each and every one of those households personally.

On September 23, 1956, a meeting of the new parish was held at Our Lady of Perpetual Help, and the name “St. Patrick” was chosen upon the Bishop’s recommendation. Fr. Brogan’s middle name, by the way, was Patrick.
Before the church was built, the first Masses were held in the auditorium of Heatherdowns School; there were four Masses each Sunday, with Fr. William Seelaus, an Oblate from St. Francis deSales High School assisting Fr. Brogan.
The first Sunday collection at St. Pat’s totaled $4,914.82.

Ground was broken for the church and school on St. Patrick’s Day – March 17, 1957. A St. Patrick’s Day party followed – in a tradition that was kept for 37 years.
The first Mass celebrated on St. Pat’s property was in November of 1957, in the basement of the new building.

The first Mass celebrated in the church building was Midnight Mass on Christmas Eve 1957.

In the winter of 1957, at the direction of the Bishop, a house was purchased on what is now Green Valley to serve as a temporary rectory. Fourteen years later, a house down the road was built by parishioner Ken Mossing to serve as the convent. Beginning in 1990 events came full circle and the convent house now serves as the rectory.

In September of 1958, 527 students started their school year at St. Patrick’s School in the West wing, now known as Seton Hall. As St. Pat’s rapidly grew, in 1960 the East Wing – what is now known as Neumann Hall – was added, complete with 13 more classrooms.

In 1963, the new rectory, now called the Crites Community Center, was completed, and served as home to three pastors, 22 other priests (including the late Bishop James Hoffman), six seminarians, three youth directors, and numerous others in its 27 years as a residence. The Crites Center was named after Peg and Chuck Crites, who were longtime volunteer workers during the years of Fr. Brogan and Fr. Wilhelm.";"http://toledostpatsschool.org/";"https://web.facebook.com/StPatrickOfHeatherdowns/?_rdc=1&_rdr";;"toledostpatsschool.org/registration";"https://cld.bz/fjYsKTo";;;;"x";;;"https://s3.amazonaws.com/media.cloversites.com/24/24cd79d3-d14b-4e86-95f9-83e447bb7a43/site-images/4344e28a-9285-4faf-b722-b72f658d8bbc.png";"8:45a.m.-3:00 p.m";"8:45a.m.-3:00 p.m";"8:45a.m.-3:00 p.m";"8:45a.m.-3:00 p.m";"8:45a.m.-3:00 p.m";"Closed";"Closed";
1179486;"ST PAUL";"303 S MAIN ST";"NORTH CANTON";"OH";44720;"Stark";3304940223;"https://spsnorthcanton.com/";"stpaulspictures@gmail.com";"St. Paul School ignites enthusiasm, inspires excellence and nurtures lifelong learners as we live and teach like Jesus.  We are a diocesan Roman Catholic school affiliated with St. Paul Parish.  For nearly 100 years, St. Paul School has provided an education that maximizes each child's potential, while planting seeds of a strong Catholic faith life through prayer and worship.  We are a community of educators, students and families who share a deep commitment to serve others.  Our graduates are regularly recognized for academic excellence and positions of leadership.  We are here to educate the whole child: intellectually, physically, spiritually and emotionally, within a loving and nurturing environment. St. Paul school is a Roman Catholic elementary school in the Diocese of Youngstown serving grades PreK-8th.";"https://spsnorthcanton.com/";"https://web.facebook.com/pg/stpaulncanton/about/?ref=page_internal";;"https://spsnorthcanton.com/media/1/SPECC%20Registration%20Packet(1).pdf";"https://spsnorthcanton.com/media/1/2015-2016%20Student%20Handbook%202.docx";;;"x";;;;"https://static.radiuswebtools.com/templates/hca_stpaul/images/logo.png";"7:30 a.m to 2:35 PM.";"7:30 a.m to 2:35 PM.";"7:30 a.m to 2:35 PM.";"7:30 a.m to 2:35 PM.";"7:30 a.m to 2:35 PM.";"Closed";"Closed";
1179487;"ST PAUL";"61 MOSS RD";"WESTERVILLE";"OH";43082;"DELAWARE";6148822710;"http://stpaulk-8.org/";"stpaulinfo@stpaulk-8.org";"St. Paul School in Westerville, Ohio is a Roman Catholic community dedicated to teaching, living and learning in the light of Christ. We foster the development of the Roman Catholic faith by encompassing instruction, prayer, religious experiences, and service. ";"http://stpaulk-8.org/";"https://web.facebook.com/St.PaulRams/";;"http://stpaulk-8.org/Parents";"http://stpaulk-8.org/stpaul/media/documents/general%20downloads/Parent-Student-Handbook-2018-2019.pdf";;;"x";;"x";;"https://scontent.flhe2-1.fna.fbcdn.net/v/t1.0-1/p200x200/39165116_1936105733114789_3470484607692963840_n.jpg?_nc_cat=102&_nc_eui2=AeGZg2NOUfCBjVKcp6-LNfu9OKSwI7dmdXo0I4r_D7dQOstLvKTpYSC7soXgAmokXAGC24JWC-PqB8CfuD18yDviU_1hMY1FpAGzWUxCFzc8p2QuakgRCcb-IW__LDK_Dy0&_nc_ht=scontent.flhe2-1.fna&oh=947d10d355da511bd23e88d0bc9db8a9&oe=5C4E5C8A";"7:50  a.m-2:35  p.m";"7:50  a.m-2:35  p.m";"7:50  a.m-2:35  p.m";"7:50  a.m-2:35  p.m";"7:50  a.m-2:35  p.m";"Closed";"Closed";
1179488;"ST PAUL";"925 E STATE ST";"SALEM";"OH";44460;"COLUMBIANA";3303373451;"http://stpaulsalem.org/";"stpaulelemsalem@youngstowndiocese.org";"Welcome to the St. Paul School web site! Since 1904, Saint Paul School continues to strive to provide families a community that evangelizes, educates, and contributes to the formation of a healthy and morally sound life-style.";"http://www.stpaul.k12.oh.us/";"https://web.facebook.com/StPaulSchoolSalem/";;"https://www.dropbox.com/sh/db4kquf8oqzmgek/AAD9Ms0RPlk73jikRMqOtvLsa?preview=Student+Registration+Form+2014.pdf";;;;"x";;;;"https://scontent.flhe2-1.fna.fbcdn.net/v/t1.0-1/c12.0.200.200/p200x200/734621_144581252377142_87375658_n.jpg?_nc_cat=100&_nc_eui2=AeHTxpb69m2qU0qJLuaDxjg00kGtf796LeMm32zZvqAxcba89OP-QsHd79y0aiZwWJhwOvYS7JqdTGEouWEIThZPW1eLF1mn3jVfMhtk9jvEC8kBdiSt2jSsU50kyq7o71Q&_nc_ht=scontent.flhe2-1.fna&oh=ed3d56960410d9def42aaf383af693fa&oe=5C41035E";;;;;;;;
1179489;"ST PAUL LUTHERAN";"1075 GLENWOOD AVE";"NAPOLEON";"OH";43545;"HENRY";4195925536;"https://www.school.stpaulnapoleon.org/";"fwiechers@stpaulnapoleon.org";"At St. Paul we strive to prepare students for lives of service in Christ Jesus. Come visit us and see the difference of a Christ-centered education. We offer strong academics, a variety of extra-curriculars, and caring faculty";"https://www.school.stpaulnapoleon.org/";"https://web.facebook.com/stpaulnapoleon?_rdc=1&_rdr";;"https://www.school.stpaulnapoleon.org/enroll";;;;"x";"x";;;"https://static.wixstatic.com/media/043a88_edbd219f32074d32b973ff29ac03b6df.png/v1/fill/w_150,h_176,al_c,usm_0.66_1.00_0.01/043a88_edbd219f32074d32b973ff29ac03b6df.png";"8:30AM to 4:00PM";"8:30AM to 4:00PM";"8:30AM to 4:00PM";"8:30AM to 4:00PM";"8:30AM to 4:00PM";"Closed";"7:15AM to 12:00PM";
1179490;"ST PAUL LUTHERAN";"27981 DETROIT RD";"WESTLAKE";"OH";44145;"CUYAHOGA";4408353051;"https://school.stpaulwestlake.org/";"ryoung@stpaulwestlake.org";"St. Paul Lutheran School in Westlake serves children in Preschool- 8th grade, and their families. Celebrating our 160th year, St. Paul has devoted resources, prayers, hard work and love to develop a program that is academically challenging and spiritually enriching. It is also a program that promotes the importance of developing good character. St. Paul is fully accredited and recognized by the state of Ohio. We offer a well-rounded education that teaches the whole child, including art, vocal and instrumental music, technology, Spanish, and interscholastic sports. We have extended care before and after school and
summer camp. Please consider joining us, as we truly do want to make a difference in the lives
of your children.

We believe that God has blessed each and every one of our students with many gifts and we praise God by developing the many talents and skills He has given us.

We strive to help all children reach their
academic potential";"https://school.stpaulwestlake.org/";"https://web.facebook.com/pg/StPaulLutheranWestlake/";"https://school.stpaulwestlake.org/school-info/job-positions/";"https://school.stpaulwestlake.org/enrollment-application-louden-edit-2-docx/";"https://school.stpaulwestlake.org/wp-content/uploads/2018/01/Extended_Care_1718.pdf";;;;"x";"x";;"https://scontent.flhe2-1.fna.fbcdn.net/v/t1.0-1/p200x200/38776705_10160619354520153_7818935842939863040_n.png?_nc_cat=108&_nc_eui2=AeG7MNTYbFXri4jRGKYeb3cU8BNdiLgOtbyLFHqQaVaQlA7dlZ8JVHpHlWvrN_I3aEXReVEeg5JbBohp3Fk2e41hqDofnJU3idCmp0jwzpW6Hb361vAZtsozrnyHhD2SeD4&_nc_ht=scontent.flhe2-1.fna&oh=ecaa92358f613ce0b8e7e990c82e01ce&oe=5C5DA53F";"08:30am-4:00pm";"08:30am-4:00pm";"08:30am-4:00pm";"08:30am-4:00pm";"08:30am-4:00pm";"Closed";"Closed";
1179491;"ST PETER";"429 HURON ST";"HURON";"OH";44839;"ERIE";4194334640;"http://huronstpeterschool.org/";"principal@huronstpeterschool.org";"As Catholic School Educators, we believe our Catholic School is not only a school, but a community of Faith. We believe those entrusted to us are not only students, but children of God. We believe we are not only educators, but ministers of the Gospel.";"http://huronstpeterschool.org/";"https://web.facebook.com/pages/St-Peter-Elementary-School/830569036965410?_rdc=1&_rdr";;"http://huronstpeterschool.org/admissions/admission-process/";"https://drive.google.com/file/d/17pABNz01HGausdh5kcGyNQyutavoI_KZ/view";;;"x";"x";;;"http://huronstpeterschool.org/wp-content/uploads/2017/03/SPSLogo.png";"08:30am-2:55PM";"08:30am-2:55PM";"08:30am-2:55PM";"08:30am-2:55PM";"08:30am-2:55PM";"Closed";"Closed";
1179492;"ST PETER";"6185 CHAMBERSBURG RD";"HUBER HEIGHTS";"OH";45424;"MONTGOMERY";9372338710;;" ";;;"https://web.facebook.com/pages/St-Peter-Elementary-School/886759591347930";;;;;;;;;;;;;;;;;;
1179499;"ST PIUS X";"2950 ILGER AVE";"TOLEDO";"OH";43606;"LUCAS";4195357688;"http://www.stpiusxtoledo.org";"calexander@stpiusxtoledo.org";"It is our belief that the purpose of St. Pius X School is to join with the parents in their efforts to educate their children. It is our privilege to partner with the families of our students in order to provide an education that includes spiritual, intellectual, emotional, and physical development. It is our hope that through this Catholic education each child will develop into a mature Christian who is well prepared to move confidently into the next phase of becoming a responsible adult.

It is our obligation to encourage children and to listen to them so that each grows according to the design written into his/her being. We believe that the school, in collaboration with the parents, can meet these challenges.

Philosophy
We believe that each child is a unique gift created by God. It is our job as educators to work closely with parents to assist each child in their educational development. The experiences that a child has in the first years of their lives are important in the child’s growth and development.

Our curriculum is designed to meet the needs of the whole child, complete with activities and experiences incorporated to enhance each child’s spiritual, cognitive, language, social and physical development. ";"http://www.stpiusxtoledo.org/Home.aspx?Community=43606001";"https://web.facebook.com/stpiusxtoledo/?_rdc=1&_rdr";;"http://www.stpiusxtoledo.org/Data/Communities/43606001/Postings/33_Preschoo/St.%20Pius%20X%20Preschool%20Registration%20Form%202017%20-%202018.pdf";;;;;"x";"x";;"http://www.stpiusxtoledo.org/Data/Communities/43606001/Postings/WebsiteT/footer-logo.jpg";"8:00 a.m. –2:45p.m";"8:00 a.m. –2:45p.m";"8:00 a.m. –2:45p.m";"8:00 a.m. –2:45p.m";"8:00 a.m. –2:45p.m";"Closed";"Closed";
1179493;"ST PETER";"702 CLEVELAND AVE NW";"CANTON";"OH";44702;"STARK";3304520125;"https://spscanton.com/";"stpeterelem@youngstowndiocese.org";"St.Peter Catholic School a Roman Catholic elementary school in the Diocese of Youngstown serves families with children in Preschool through Grade Five.  We are also a part of the Stark County Catholic Regional Elementary School System.  Located in the heart of downtown Canton offering a rich and diverse curriculum with an emphasis on the Arts. 

St. Peter Catholic School, partnered with the Sisters of Notre Dame, and has been in existence since 1860.  Our philosophy has and continues to rely on the Notre Dame philosophy of an integrated education for transformation.  We believe in educating the whole child, both spiritually and academically and instilling the importance of lifelong service to others.";"https://spscanton.com/";"https://web.facebook.com/SPSCanton/";;"https://spscanton.com/165";;;;;"x";;;"https://scontent.flhe2-1.fna.fbcdn.net/v/t1.0-1/c0.0.200.200/p200x200/425127_217334741689198_1941128669_n.jpg?_nc_cat=107&_nc_eui2=AeHIyzVhPFziKYUXpjWpe8-Ptt0I6P_b8DfmqsLBR57PFg_dqkSRovLKWYqhorpi8ayYHIZ9kChPnvcc_1rMyIDxTftXde9P-EfZzCPjg6Mp2Y6gIWMjFpDIo0dZUquAgMA&_nc_ht=scontent.flhe2-1.fna&oh=577fbf09ced7622533f1a48d25c069d8&oe=5C3EA7AE";"8:00 a.m.-3:00 p.m";"8:00 a.m.-3:00 p.m";"8:00 a.m.-3:00 p.m";"8:00 a.m.-3:00 p.m";"8:00 a.m.-3:00 p.m";"Closed";"Closed";
