"id";"name";"address";"city";"state";"zip";"county";"phone";"main url";"email";"details";"location website";"facebook page";"career/employment url";"application/registration url";"parent handbook url";"infant (under 12 months)";"toddler (1-2yrs)";"preschools (2-3yrs)";"pre-kindergarden(4yr)";"before/afterschools";"camps";"logo url";"monday hour";"tuesday hour";"wednesday hour";"thursday hour";"friday hours";"saturday hour";"sunday hour";"notes"
1172412;"WESTMINSTER NURSERY SCHOOL";"13660 UNIVERSITY ST";"WESTMINSTER";"CA";92683;"ORANGE";"(714) 373-1406";"https://www.westminsternurseryschool.com/";"wnsocpreschool@gmail.com";"At WNS, children learn social and classroom skills, while parents enjoy spending time together and creating lifelong friendships.  Westminster Nursery School has been part of the community since 1965.";"https://www.westminsternurseryschool.com/";"https://www.facebook.com/wnsocpreschool/";;;"https://www.westminsternurseryschool.com/parental-requirements";;;"x";"x";;;;"8:30AM - 1:25PM";"8:30AM - 1:25PM";"8:30AM - 1:25PM";"8:30AM - 1:25PM";"8:30AM - 1:25PM";"Closed";"Closed";
1172415;"WILEY WORLD LLC";"2064 E. WASHINGTON STREET";"STOCKTON";"CA";95205;"SAN JOAQUIN";"(209) 323-5953";;;;;;;;;;;;;;;;;;;;;;;
1172417;"WONDERFUL PRESCHOOL: AVENAL";"1225 S 7TH AVE";"AVENAL";"CA";93204;"KINGS";"(661) 706-7689";"https://www.wonderfuleducation.org/";"info@wonderfuleducation.org";"Our preschools offer peace of mind to working parents who know their children are thriving in a safe, nurturing environment. High-quality preschool programs significantly increase high school and college graduation rates.";"https://www.wonderfuleducation.org/preschool/";;"https://www.wonderfuleducation.org/join-our-team/";;"https://www.wonderfuleducation.org/publications/";;;"x";"x";;;"https://static1.squarespace.com/static/59a09484ccc5c50e494ed921/t/59ce8305f6576e4c91f02db7/1525126322014/?format=1500w";;;;;;;;
1172418;"WONDERFUL PRESCHOOL: LOST HILLS";"14823 OFFICE LANE";"LOST HILLS";"CA";93249;"KERN";"(661) 706-7689";"https://www.wonderfuleducation.org/";"info@wonderfuleducation.org";"Our preschools offer peace of mind to working parents who know their children are thriving in a safe, nurturing environment. High-quality preschool programs significantly increase high school and college graduation rates.";"https://www.wonderfuleducation.org/preschool/";;"https://www.wonderfuleducation.org/join-our-team/";;"https://www.wonderfuleducation.org/publications/";;;"x";"x";;;"https://static1.squarespace.com/static/59a09484ccc5c50e494ed921/t/59ce8305f6576e4c91f02db7/1525126322014/?format=1500w";;;;;;;;
1172420;"WOODROE WOODS SCHOOL";"750 FARGO AVE.";"SAN LEANDRO";"CA";94579;"ALAMEDA";"(510) 990-0193";"http://www.woodroewoods.org/";"info@woodroewoods.org";"Utilizing a true play-based philosophy, Woodroe Woods School provides a safe and loving environment for young minds to develop the cognitive, physical, social, and emotional skills to become responsible and confident society members who respect themselves and their community. Woodroe Woods believes in the acceptance of all children, embracing each child’s differences, encouraging them to learn and develop in their own way and at their own pace, all while challenging them to go beyond their successes.";"http://www.woodroewoods.org/";"https://www.facebook.com/woodroewoods.org/";;;;;;"x";"x";;;"https://static.wixstatic.com/media/7e923b_0c34efa597f4475092cfd543de245262~mv2.jpg/v1/fill/w_207,h_156,al_c,q_80,usm_0.66_1.00_0.01/7e923b_0c34efa597f4475092cfd543de245262~mv2.webp";"7AM - 6PM";"7AM - 6PM";"7AM - 6PM";"7AM - 6PM";"7AM - 6PM";"Closed";"Closed";
1172421;"WYSTERIA - SUSD HEAD START";"1921 POCK LANE";"STOCKTON";"CA";95205;"SAN JOAQUIN";"(209) 451-3257";"http://www.headstartprogram.us/";"headstartinfo@sjcoe.net";;"http://www.headstartprogram.us/program/wysteria-head-start-sjcoe-susd";;;;;;;;;;;;;;;;;;;
1172423;"YMCA OF GREATER WHITTIER";"12510 HADLEY ST.";"WHITTIER";"CA";90601;"LOS ANGELES";"(562) 907-6530";"https://www.ymcawhittier.org/";"ymcawhittier@yahoo.com";"The YMCA of Greater Whittier is an association of all people united in a common effort to put Judeo-Christian principles into daily practice and to enrich the quality of spiritual, mental, physical and social life of their families, their community and themselves.";"https://www.ymcawhittier.org/";"https://www.facebook.com/ymcawhittier/";;;;;;"x";"x";"x";"x";"https://www.ymcawhittier.org/images/logo-org.png";"5AM - 9PM";"5AM - 9PM";"5AM - 9PM";"5AM - 9PM";"5AM - 9PM";"6AM - 4PM";"10AM - 4PM";
1172424;"YOLO CRISIS NURSERY";"1701 BALSAM PLACE";"DAVIS";"CA";95618;"YOLO";"(530) 758-6680";"https://yolocrisisnursery.org/";"info@yolocrisisnursery.org ";"The Yolo Crisis Nursery is a place of hope and help for families in Yolo County, CA. Day and night, 365 days a year, we provide safe, temporary care for children up through age 5. We help parents manage emergencies, keep up with their jobs, learn a new job, get medical care, or just get a break. Our services are voluntary and free. We wrap our families with loving care and help them become stable and strong.";"https://yolocrisisnursery.org/";"https://www.facebook.com/FriendsOfTheYoloCrisisNursery/";"https://yolocrisisnursery.org/about-us/#job-openings";"https://yolocrisisnursery.org/help-for-parents/#care-packages";;"x";"x";"x";"x";"x";;"https://yolocrisisnursery.org/wp-content/uploads/2016/11/YCN-logo-600.png";"Open 24/7";"Open 24/7";"Open 24/7";"Open 24/7";"Open 24/7";"Open 24/7";"Open 24/7";
1172425;"YOUNG EXPLORERS - NEWARK";"39766 CEDAR BLVD.";"NEWARK";"CA";94560;"ALAMEDA";"(650) 270-0315";"https://www.youngexplorersnewark.com/";"info@youngexplorersnewark.com";" Through a very structured curriculum, theme based playful activities, and hands on learning, your children will develop various skills and are knowledgeable in areas like early literacy, mathematics, science and language skills. They gain confidence and become problem solvers along with developing a love for life long learning. Our wonderful learning environment teach them how to interact with others and help them with their daily needs and our  harmonious balanced curriculum, as well as variety of stimulating and fun educational activities  ensure a well-balanced education for your child.";"https://www.youngexplorersnewark.com/";"https://www.facebook.com/youngexplorersnewark/";;;;;;"x";"x";;"x";"https://static.wixstatic.com/media/4c5fec_c96fa7116afaca1f80a6f06389097cb5.png/v1/fill/w_289,h_88,al_c,usm_0.66_1.00_0.01/4c5fec_c96fa7116afaca1f80a6f06389097cb5.png";"8:30AM - 6:30PM";"8:30AM - 6:30PM";"8:30AM - 6:30PM";"8:30AM - 6:30PM";"8:30AM - 6:30PM";"Closed";"Closed";
1172426;"ZLATA'S LITTLE LIGHTS TIFERES MENACHEM MENDEL";"1952 S. ROBERTSON BLVD.";"LOS ANGELES";"CA";90034;"LOS ANGELES";"(424) 284-9551";"https://www.zlataslittlelights.com/";"zlataslittlelights@gmail.com";"Our aim at Zlata's Little Lights is to nurture the spark of Judaism in each child until it shines joyously. We seek to create a safe fun, and loving environment which will encourage children to grow in their love of their heritage. Our objective is to help mold self-confident, happy and caring little ones, who take joy in doing mitzvot. Teaching inclusion and acceptance of others is of utmost importance at ZLL.";"https://www.zlataslittlelights.com/";"https://www.facebook.com/Zlataslittlelights";;;;;;"x";"x";;;"https://static.wixstatic.com/media/9771d7_972bf8add19d47cc93db497cbab5fdc4.jpg/v1/fill/w_67,h_124,al_c,q_80,usm_0.66_1.00_0.01/9771d7_972bf8add19d47cc93db497cbab5fdc4.webp";"9AM - 3:30PM";"9AM - 3:30PM";"9AM - 3:30PM";"9AM - 3:30PM";"9AM - 1PM";"Closed";"Closed";
1172427;"ADULT SCHOOL-EARLY HEAD START";"3701 E. WILLOW ST.";"LONG BEACH";"CA";90755;"LOS ANGELES";"(562) 989-4679";"http://www.headstartprogram.us/city/ca-long_beach";;;;;;;;;;;;;;;;;;;;;;
1172429;"ASPEN LEAF NURSERY";"3111 30TH STREET";"SAN DIEGO";"CA";92104;"SAN DIEGO";"(619) 285-0767";"http://www.aspenleafpreschool.com/";;"Each class learns through a variety of structured and unstructured learning experiences. Unstructured learning happens when children are provided with a safe, engaging environment in which to play, explore, interact, and discover on their own. Structured learning experiences are planned by the teachers and by the students. They include art and cooking activities, science projects, games, songs, stories, and more.";"http://www.aspenleafpreschool.com/";;;"http://www.aspenleafpreschool.com/tuition/";;;;"x";"x";;;"http://www.aspenleafpreschool.com/wp-content/uploads/2016/03/cropped-Logo-orange-circle-6pt.png";;;;;;;;
1172430;"BABY ANGELS CENTER";"618 4TH AVENUE";"CHULA VISTA";"CA";91910;"SAN DIEGO";"(619) 852-7909";"http://angelscareacademy.com/";;"Our two centers are licensed by the Department of Social Services (Community Care Licensing Division). At Baby Angels Center, we are licensed to accommodate 18 children, newborns to 24 months (Lic#376701075). At our Baby Angels Center #2, we are licensed to accommodate 12 children, from 24 months to 42 months (Lic#376701127). We are committed to providing a high-quality program. We provide healthy nutritious meals in accordance to CACFP guidelines. Ensuring quality daily experiences for children and promoting positive child outcomes are at the heart of our program.";"http://baby.angelscareacademy.com/";"https://www.facebook.com/Baby-Angels-Center-and-Baby-Angels-Center-2-1460809314158959/";;"http://baby.angelscareacademy.com/admissions-and-enrollment-process/";;"x";"x";"x";"x";;;;"6:30AM - 6PM";"6:30AM - 6PM";"6:30AM - 6PM";"6:30AM - 6PM";"6:30AM - 6PM";"Closed";"Closed";
1172431;"BEGINNING MONTESSORI CHILDREN'S HOUSE INC, THE";"7475 FALLBROOKE AVE";"WEST HILLS";"CA";91307;"LOS ANGELES";"(818) 992-5341";"https://thebeginningmontessori.com/";;"This organization of information—facts and figures—prepares the child for the world of adolescence, when thought and emotion evolve into understanding more abstract, universal concepts such as equity, freedom, and justice.";"https://thebeginningmontessori.com/";"https://www.facebook.com/thebeginningmontessori/";;"https://thebeginningmontessori.com/enrollment/";"https://thebeginningmontessori.com/enrollment/";"x";"x";"x";"x";;;"https://thebeginningmontessori.com/wp-content/uploads/2017/12/The-Beginning-Montessori-logo-3.png";"7AM - 6PM";"7AM - 6PM";"7AM - 6PM";"7AM - 6PM";"7AM - 6PM";"Closed";"Closed";
1172432;"BELLTOWER MONTESSORI ACADEMY";"1187 MAGNOLIA AVENUE";"CORONA";"CA";92879;"RIVERSIDE";"(951) 432-7787";"http://belltowermontessori.com/";"info@belltowermontessori.com";"Here at Belltower we offer the children of the Corona community, ages 6 weeks – 6 years, an authentic Montessori school, which is true to the integrity of the Association Montessori Internationale. Our classrooms are furnished with natural light and exquisite Montessori materials. Tours are offered daily by appointment. We encourage parents to visit during themorning hours. This will allow parents to observe and fully understand the core Montessori Work Cycle. Our highly certified Montessori teachers are dedicated to the growth and development of every child, which includes our commitment to Grace and Courtesy, proper nutrition, and preparing environments which are safe and nurturing. Belltower is Corona’s truly authentic Montessori private school.";"http://belltowermontessori.com/";"https://www.facebook.com/BelltowerMontessoriAcademy/";"http://belltowermontessori.com/jobs/";"http://belltowermontessori.com/admissions/";;"x";"x";"x";"x";;;"https://scontent.fskp3-1.fna.fbcdn.net/v/t1.0-1/p200x200/13466445_1019346441497353_7496819197928152180_n.jpg?_nc_cat=0&oh=6d6351d7c9f0a7f83678ab19702a3a59&oe=5B93AEE9";"6:30AM - 6:30PM";"6:30AM - 6:30PM";"6:30AM - 6:30PM";"6:30AM - 6:30PM";"6:30AM - 6:30PM";"Closed";"Closed";
1172435;"BRIGHT FUTURES CHILDREN CENTER (INFANT)";"1345 LIBERTY ST.";"REDDING";"CA";96001;"SHASTA";"(530) 276-0506";;;"Newly licensed.";;"https://www.facebook.com/Bright-Futures-Children-Center-760940954034780/";;;;"x";"x";"x";;;;"https://scontent.fskp3-1.fna.fbcdn.net/v/t31.0-8/12184218_760943260701216_6537849292299365915_o.jpg?_nc_cat=0&oh=e0ad053ee9739b886fa103239f97ea99&oe=5B8EABA2";"7AM - 6PM";"7AM - 6PM";"7AM - 6PM";"7AM - 6PM";"7AM - 6PM";"Closed";"Closed";
1172436;"BRIGHT HORIZONS AT BISHOP RANCH";"2603 CAMINO RAMON, STE. 150";"SAN RAMON";"CA";94583;"CONTRA COSTA";"(925) 866-7005";"https://child-care-preschool.brighthorizons.com/";;"Welcome! Our goal is to foster a love of learning by providing an enriching and unique experience for all ages. Our science lab is the perfect place to experiment and explore, and the dramatic play areas encourage imaginative play. The four outdoor areas also include gardening boxes, perfect for nature activities, and our Smartboard helps instill confidence in technology for kindergarten prep students. Our Movement Matters Zone encourages healthy habits, and includes a ballet bar, rock-climbing wall, and an instructor-led music class. Come in for one of our parent events or schedule a visit to see what we offer!";"https://child-care-preschool.brighthorizons.com/ca/sanramon/bishopranch/our-center";"https://www.facebook.com/BHatBishopRanch/";"https://jobs.brighthorizons.com/";;"https://child-care-preschool.brighthorizons.com/ca/sanramon/bishopranch/parent-resources";"x";"x";"x";"x";;;"https://child-care-preschool.brighthorizons.com/static/imgs/nav-logo-curve-desktop.svg";"7AM - 6PM";"7AM - 6PM";"7AM - 6PM";"7AM - 6PM";"7AM - 6PM";"7AM - 6PM";"7AM - 6PM";
1172437;"BRIGHT HORIZONS @ USC HSC INFANT CARE CENTER";"1435 PLAYGROUND ST";"LOS ANGELES";"CA";90033;"LOS ANGELES";"(323) 442-3333";"https://child-care-preschool.brighthorizons.com";;"Welcome! This is an exciting stage in your child’s early education, and our talented team of caring teachers is here to inspire learning, encourage confidence, and nurture your child's growth and development. Our World at Their Fingertips curriculum features an arts program that sparks creativity, a language program that fosters an interest in reading, a science program that stimulates curiosity, and more. There’s always something new to explore. And our convenient location, schedules that accommodate your busy workday, and an open-door policy make it easy to stay involved. Visit us and come see what we’re all about!";"https://child-care-preschool.brighthorizons.com/ca/losangeles/uschsc/our-center";"https://www.facebook.com/brighthorizons/";"https://jobs.brighthorizons.com/";;"https://child-care-preschool.brighthorizons.com/ca/losangeles/uschsc/parent-resources";"x";"x";"x";"x";;;"https://child-care-preschool.brighthorizons.com/static/imgs/nav-logo-curve-desktop.svg";"7AM - 6PM";"7AM - 6PM";"7AM - 6PM";"7AM - 6PM";"7AM - 6PM";"Closed";"Closed";
1172440;"CAL-SAFE ESCONDIDO EARLY CHILDHOOD EDUCATION CTR";"750 SAN PASQUAL ROAD";"ESCONDIDO";"CA";92025;"SAN DIEGO";"(760) 291-6063";;;;;;;;;;;;;;;;;;;;;;;
1172441;"CAP KERN EARLY HEAD START PROG - CHRISMAN";"23950 S CHRISMAN ROAD";"TRACY";"CA";95304;"SAN JOAQUIN";"(209) 242-9540";"http://www.headstartprogram.us/";"info@capk.org";;"http://www.headstartprogram.us/program/chrisman-ehs-capk";;;;;;;;;;;;;;;;;;;
1172442;"CAPC - BABY STEPS 1";"521 E. MINER";"STOCKTON";"CA";95202;"SAN JOAQUIN";"(209) 464-4524";"http://www.headstartprogram.us/";"headstartinfo@sjcoe.net";;"http://www.headstartprogram.us/program/baby-steps-sjcoe-capc";;;;;;;;;;;;;;;;;;;
1172444;"CCFC - OSCARYNE WILLIAMS CENTER";"85 TURNER TERRACE";"SAN FRANCISCO";"CA";94107;"SAN FRANCISCO";"(415) 921-7019";;;;;;;;;;;;;;;;;;;;;;;
1172445;"CDCLA GRACE IINO CHILDREN'S CENTER";"231 E. THIRD ST.";"LOS ANGELES";"CA";90013;"LOS ANGELES";"(213) 925-3175";"http://www.cdcla.org/";;"We provide direct early care and education services, consulting services to corporations and other child development programs, and parent education. We are funded by parent fees, in-kind services from the County of Los Angeles, and CalTrans, private foundation  grants and contracts with the California Department of Education.";"http://www.cdcla.org/child_care_centers.html";;"http://www.cdcla.org/job_opportunities.html";"http://www.cdcla.org/cdcla_forms.html";"http://www.cdcla.org/parents_resources.html";"x";"x";"x";"x";;;;"7AM - 6PM";"7AM - 6PM";"7AM - 6PM";"7AM - 6PM";"7AM - 6PM";"Closed";"Closed";
1172446;"CITY TREE CHRISTIAN INFANT CENTER";"320 DATE STREET";"SAN DIEGO";"CA";92101;"SAN DIEGO";"(619) 232-3794";"http://www.citytree.org/";"amanda.ochoa@citytree.org";"Our staff is dedicated to providing quality care and education for each child. We are very proud of the caliber and longevity of our well qualified teaching staff and believe them to be among the finest in San Diego County. We have established goals to help each child meet his/her spiritual, emotional, physical, social and intellectual needs";"http://www.citytree.org/academics/preschool.html";"https://www.facebook.com/citytreeschool";"http://www.citytree.org/about/employment/index.html";"http://www.citytree.org/admissions/application-enrollment.html";;;;"x";"x";"x";"x";"http://www.citytree.org/assets/img/tpl/citytreelogo-white.png";"7AM - 4PM";"7AM - 4PM";"7AM - 4PM";"7AM - 4PM";"7AM - 4PM";"Closed";"Closed";
1172448;"EARLY BIRD INFANT TODDLER CENTER";"1922 PALMETTO AVENUE";"PACIFICA";"CA";94044;"SAN MATEO";"(831) 566-8595";"http://www.earlybirditc.com/";"earlybirditc@gmail.com";"Early Bird Infant Toddler Center is a Reggio Emilia based school offering quality early care for infants and toddlers ages 6 weeks- 24 months in Pacifica. We recognize the challenge that many new parents face as they worry about going back to work after welcoming their newest addition. Finding quality child care is not an easy task. We have worked hard to open a facility where young children feel at home and parents can feel at ease. Each child is paired up with a primary care teacher to encourage strong relationship building. Our environments are very home like. Unlike traditional child care settings, we mindfully removed lots of primary colors and plastic toys and have replaced these items with real experiences. Our curriculum revolves around relationship building with the whole family. We make discoveries based off of children's interests and document the child's learning to share with the family. Our mission is to support families and make them feel comfortable with the place where their child will spend their day. In order to create a strong family network, we are offering optional Saturday drop-in play groups with activities for the children and snacks for families.";"http://www.earlybirditc.com/";;"http://www.earlybirditc.com/employment-opportunities/";;"https://static1.squarespace.com/static/57254211a3360ce750988e2b/t/5845e03ce4fcb5c4ed92aa86/1480974399308/Early%2BBird%2BFamily%2BHandbook.pdf";;;;;;;"http://static1.squarespace.com/static/57254211a3360ce750988e2b/t/57a3ed6129687f89223a552d/1520892753711/?format=1500w";"7AM - 5:30PM";"7AM - 5:30PM";"7AM - 5:30PM";"7AM - 5:30PM";"7AM - 5:30PM";"Closed";"Closed";
1172449;"EARLY HEAD START-SRJC";"1501 MENDOCINO AVE. ROOM #3844";"SANTA ROSA";"CA";95401;"SONOMA";"(707) 544-6911";"https://childdevcenter.santarosa.edu/";;;"https://www.santarosa.edu/about-srjc/";;;;"https://childdevcenter.santarosa.edu/sites/childdevcenter.santarosa.edu/files/Childcare.pdf";;;;;;;"https://www.santarosa.edu/assets/images/srjc_logo_internal.svg";"8:30AM - 5PM";"8:30AM - 5PM";"8:30AM - 5PM";"8:30AM - 5PM";"8:30AM - 5PM";"Closed";"Closed";
1172450;"ECO HOUSE- INFANT";"2951 LONG BEACH BLVD.";"LONG BEACH";"CA";90806;"LOS ANGELES";"(562) 997-8800";"https://www.childrentoday.org/";"info@childrentoday.org";"The mission of Children Today is to foster long-term stability and success in children and families who are facing homelessness or who are involved in the child welfare system.  We do this by providing trauma-informed child development and family support services. ";"https://www.childrentoday.org/contact-us.html";;;;;"x";"x";"x";"x";;;"https://www.childrentoday.org/uploads/1/3/1/8/13181278/1434407494.png";"7AM - 6PM";"7AM - 6PM";"7AM - 6PM";"7AM - 6PM";"7AM - 6PM";"Closed";"Closed";
1172451;"ESCONDIDO CHRISTIAN PRESCHOOL";"927 IDAHO AVENUE";"ESCONDIDO";"CA";92025;"SAN DIEGO";"(760) 745-6296";"http://www.ecslions.org/";"info@ecslions.org";"We believe God's plan calls for a personal relationship with Christ and a distinctive, committed life of service to God and man. We begin with the conviction that children are uniquely imprinted with the image of God. In order to reach the potential God has for each child, we believe that children should have a well-rounded program that encourages them to develop socially, emotionally, cognitively, physically and spiritually. Children, in order to develop according to their own developmental time table, should be offered a wide variety of activities encouraging them to learn. As a Christian school, our obligation before God, is to help each child learn about and develop a love for Christ and the Bible through daily experiences and application to everyday life.";"http://www.ecslions.org/preschool-index.cfm";"https://www.facebook.com/ECSLions/";;"http://www.ecslions.org/PreschoolAdmissions.cfm";"http://www.ecslions.org/parent-resources.cfm";"x";"x";"x";"x";;;"https://scontent.fskp3-1.fna.fbcdn.net/v/t1.0-1/p200x200/1601158_685310001491211_1437672594_n.png?_nc_cat=0&oh=574e79be81b60dc29352961f40ab476e&oe=5B542954";"6AM - 6:30PM";"6AM - 6:30PM";"6AM - 6:30PM";"6AM - 6:30PM";"6AM - 6:30PM";"Closed";"Closed";
1172452;"EVELYNE LOBO VILLEGAS EARLY HEAD START";"32204 DEL OBISPO STREET";"SAN JUAN CAPISTRANO";"CA";92675;"ORANGE";"(949) 661-5243";"http://www.headstartprogram.us/";;"info@ochsinc.org";"http://www.headstartprogram.us/program/evelyne-lobo-villegas-head-start";;;;;;;;;;;;;;;;;;;
1172454;"FUSD-ROOSEVELT PACE-INFANT/TODDLER";"4250 E. TULARE";"FRESNO";"CA";93702;"FRESNO";"(559) 457-3683";;;;;;;;;;;;;;;;;;;;;;;
1172455;"GROWING BRILLIANT PRESCHOOL ACADEMY (INF)";"1622 SIERRA GARDENS DRIVE";"ROSEVILLE";"CA";95661;"PLACER";"(916) 749-4325";"https://www.growingbrilliant.com/";"lisa@growingbrilliant.com";"At Growing Brilliant Preschool Academy, young children learn through structured education and exploration. Our Roseville campus offers a safe and nurturing environment, where children are well-cared for with the appropriate amount of adult interaction and structure. This sets the stage for a lifetime of learning and healthy development!";"https://www.growingbrilliant.com/preschool-academy-programs/";"https://www.facebook.com/GrowingBrilliant/";;;;"x";"x";"x";"x";"x";;"https://www.growingbrilliant.com/wp-content/uploads/2015/02/gb_logo.png";"8:30AM - 7PM";"8:30AM - 7PM";"8:30AM - 7PM";"8:30AM - 7PM";"8:30AM - 7PM";"Closed";"Closed";
1172456;"IVIE LEAGUE CHRISTIAN PRESCHOOL";"4827 CRENSHAW BLVD.";"LOS ANGELES";"CA";90043;"LOS ANGELES";"(323) 294-5437";;;;;;;;;;;;;;;;;;;;;;;
1172458;"JOURNEY BEGINS INFANT CARE CENTER, THE";"6438 YORK BLVD.";"LOS ANGELES";"CA";90042;"LOS ANGELES";"(323) 244-8334";"http://thejourneybegins.net/";;"The Journey Begins (TJB) knows that each child is an individual and needs to be treated as such. Children begin care at all stages of development and we will guide them through these stages and build upon them. Flexibility of the program is important, as the needs of infants are constantly changing and developing. A positive and happy staff, a trusting relationship between care-giver and the child, clean and well-organized environment, room to play, indoors and outside, in a safe and stimulating environment.";"http://thejourneybegins.net/";;;"http://thejourneybegins.net/";"http://thejourneybegins.net/wp-content/uploads/2018/04/TJB_Parent_Handbook_3_18.pdf";"x";"x";"x";"x";;;"http://thejourneybegins.net/wp-content/uploads/2015/07/tjbtitle4.png";"7AM - 6PM";"7AM - 6PM";"7AM - 6PM";"7AM - 6PM";"7AM - 6PM";"Closed";"Closed";
1172461;"KIDS DEPOT OF OTAY RANCH";"1394 EAST PALOMAR ST. STE. 210";"CHULA VISTA";"CA";91913;"SAN DIEGO";"(858) 699-1710";"http://www.kids-depot.com/";"info@kids-depot.com ";"The philosophy of Kids Depot is to provide a developmentally appropriate program for young children that fosters the whole child concept, respects each child as an individual and stimulates a child’s natural interest in, and enjoyment of, learning. We believe that given the opportunity, all children have natural abilities to thrive and grow; we applaud our parents for giving them that opportunity by bringing them to our schools.";"http://www.kids-depot.com/";"https://www.facebook.com/kidsdepotofotay/";;;;"x";"x";"x";"x";"x";;"http://www.kids-depot.com/wp-content/uploads/2017/02/Kids-Depot-Logo-1.png";"5:30AM - 6:30PM";"5:30AM - 6:30PM";"5:30AM - 6:30PM";"5:30AM - 6:30PM";"5:30AM - 6:30PM";"Closed";"Closed";
1172462;"KINDERCARE LEARNING CENTER";"1650 STONER CREEK RD.";"CITY OF INDUSTRY";"CA";91748;"LOS ANGELES";"(626) 965-3550";"http://www.kindercare.com/";;"Little minds are wide open and ready to learn, and we have a unique way of encouraging children to become life-long learners. A recent study of 5000 KinderCare children using the nationally-recognized BRIGANCE® Early Childhood Screens III found that our students are exceeding expectations on their assessments.";"http://www.kindercare.com/our-centers/cty-of-industry/ca/300743?utm_campaign=KC_Local&utm_source=L3M_Local&utm_medium=A&utm_content=300743&_google";"https://www.facebook.com/KinderCare.CtyofIndustry.CA/";;;;"x";"x";"x";"x";;;"https://scontent.fskp3-1.fna.fbcdn.net/v/t1.0-1/p200x200/29570876_2553158201377228_877504886251544421_n.jpg?_nc_cat=0&oh=0a0bab9fa0314413593d25e467816ae4&oe=5B60AB4B";"6:30AM - 6:30PM";"6:30AM - 6:30PM";"6:30AM - 6:30PM";"6:30AM - 6:30PM";"6:30AM - 6:30PM";"Closed";"Closed";
1172463;"KINDERPLEX @ THE WETLANDS";"3801 EAST BAYSHORE";"PALO ALTO";"CA";94303;"SANTA CLARA";"(650) 605-9500";;;;;;;;;;;;;;;;;;;;;;;
