"id";"name";"address";"city";"state";"zip";"county";"phone";"main url";"email";"details";"location website";"facebook page";"career/employment url";"application/registration url";"parent handbook url";"infant (under 12 months)";"toddler (1-2yrs)";"preschools (2-3yrs)";"pre-kindergarden(4yr)";"before/afterschools";"camps";"logo url";"monday hour";"tuesday hour";"wednesday hour";"thursday hour";"friday hours";"saturday hour";"sunday hour";"notes"
1172527;"KIDS CHOICE AFTER SCHOOL CARE";"1711 STANFORD AVENUE";"STANFORD";"CA";94305;"SANTA CLARA";"(650) 656-8170";"http://kidschoiceafterschoolcare.org/";"nbarrios@kidschoiceafterschoolcare.org";"Kids Choice offers a stimulating environment designed to promote social, emotional, intellectual, and physical development. Through our program, we will provide a variety of learning experiences that foster the development of a positive self-image while making the learning process enjoyable. We respect each child as an individual with unique qualities personality, intelligence, and creativity. Our goals are to provide affordable quality child care; an open and inviting line of communication between parents and staff; and a rich curriculum that will meet each child’s developmental needs. The program objectives are to provided age-appropriate, hands-on curriculum that will also meet the developmental needs of each child. The curriculum focuses on various areas of learning for the children’s growth and enjoyment, which include manipulatives, reading, math, creative arts, physical development, science, social development, cooking, homework skills, and the value of children learning through play. We are committed to providing a high quality program, aligning with the National Association for the Education of Young Children (NAEYC) quality standards.";"http://kidschoiceafterschoolcare.org/";;;"http://kidschoiceafterschoolcare.org/wp-content/uploads/2018/01/Kids-Choice-Application.pdf";"http://kidschoiceafterschoolcare.org/wp-content/uploads/2018/01/Parent-Handbook.pdf";;;;"x";"x";;"http://kidschoiceafterschoolcare.org/wp-content/uploads/2018/01/JPEG72_big.jpg";"8AM - 6PM";"8AM - 6PM";"8AM - 6PM";"8AM - 6PM";"8AM - 6PM";"Closed";"Closed";
1172528;"K.E.E.P.-SFPM";"2340 JACKSON STREET";"SAN FRANCISCO";"CA";94115;"SAN FRANCISCO";"(415) 749-3544";"http://www.sfpublicmontessori.org/";;"A first-of-its-kind program in the San Francisco Unified School District, bridging pre-k and elementary, SFPM is at once innovative and proven. Montessori schools have been helping children learn and grow around the world for more than 100 years.";"http://www.sfpublicmontessori.org/";"https://www.facebook.com/group.php?gid=303086428863";;"http://www.sfpublicmontessori.org/enrollment";"https://gallery.mailchimp.com/22c289544d2772cf2afb33e62/files/72038350-58fb-4a8d-9d87-42c07e9cefaa/Parent_Handbook_2017_2018.pdf";;;"x";"x";"x";;"http://www.sfpublicmontessori.org/sites/all/themes/sfpm960/logo.png";"8:15AM - 2:30PM";"8:15AM - 2:30PM";"8:15AM - 2:30PM";"8:15AM - 2:30PM";"8:15AM - 2:30PM";"Closed";"Closed";
1172531;"LIL' SCHOOL, THE";"8089 MADISON AVE, #11";"CITRUS HEIGHTS";"CA";95610;"SACRAMENTO";"(520) 456-8234";"http://www.thelilschool.com/";"contact@thelilschool.com";"Inspired by several approaches, (Reggio Emilia, European Programs, and Creative Curriculum), we thrive to give a well-rounded education that will allow your child to develop into a confident creative thinker.";"http://www.thelilschool.com/";"https://www.facebook.com/thelilschool/";;;"https://parentportal.runsandbox.com/Login?ReturnUrl=%2F";"x";"x";"x";"x";"x";"x";"https://static.wixstatic.com/media/72b8d9_86058cb9e74044e397d02cc21e1ac67e.png/v1/fill/w_230,h_90,al_c,usm_0.66_1.00_0.01/72b8d9_86058cb9e74044e397d02cc21e1ac67e.png";"6:30AM - 6PM";"6:30AM - 6PM";"6:30AM - 6PM";"6:30AM - 6PM";"6:30AM - 6PM";"Closed";"Closed";
1172532;"LONGLEY WAY ELEMNTARY SCHOOL";"2601 LONGLEY WAY";"ARCADIA";"CA";91007;"LOS ANGELES";"(626) 684-2899";"https://lw.ausd.net/";"jkissel@ausd.net";"Longley Way Elementary is a very special place where we highly value the “community feel” we have on our campus and making a difference in the lives of all our students. Leadership is a core value at Longley Way and we strive to empower all our students to see themselves as leaders in all they do both at school and home. We also put great emphasis on preparing our students to be 21st Century learners through collaboration, respecting differences, and going deeper in their thinking. We are an AVID Elementary and also in the beginning stages of Leader in Me, both of which offer a backbone for how we run our school. ";"https://lw.ausd.net/";"https://www.facebook.com/longleywaypta/";;;"https://lw.ausd.net/apps/pages/index.jsp?uREC_ID=954191&type=d&pREC_ID=1279453";;;"x";"x";;;;"7:30AM - 4PM";"7:30AM - 4PM";"7:30AM - 4PM";"7:30AM - 4PM";"7:30AM - 4PM";"Closed";"Closed";
1172533;"LOS ANGELES SOUTHWEST COLLEGE CDC";"1600 W. IMPERIAL HWY.";"LOS ANGELES";"CA";90047;"LOS ANGELES";"(323) 241-5000";"http://www.lasc.edu/";"lasccommunications@lasc.edu";"The Child Development Program prepares individuals for various levels of employment in child development centers, preschools, recreation centers, public school settings, Head Start programs, family and in-home daycare and other areas where caring for young children is the principal function. The program integrates theoretical and empirical concepts of development with field and laboratory experiences.";"http://www.lasc.edu/chdev/";"https://www.facebook.com/LASouthwestCollege/?rf=110583158970702";"http://www.laccd.edu/Employment/Pages/default.aspx";"http://www.lasc.edu/chdev/career_opportunities.html";"http://www.lasc.edu/chdev/Child%20Development.pdf";;;"x";"x";;"x";"http://www.lasc.edu/images/images2014/LASC_logo2014_BlueAndGold_TRANSPARENT.png";"8AM - 6:30PM";"8AM - 6:30PM";"8AM - 6:30PM";"8AM - 6:30PM";"8AM - 1PM";"Closed";"Closed";
1172534;"MERCED ELEMENTARY SCHOOL";"1545 E. MERCED AVE.";"WEST COVINA";"CA";91790;"LOS ANGELES";"(626) 646-9956";"http://merced.wcusd.org/";;"Through a unified effort among staff, parents, and community, Merced Elementary School strives to nurture students into becoming empowered, lifelong learners who embrace responsibility, effective collaboration, and self-discipline.";"http://merced.wcusd.org/";;;;;;;"x";"x";"x";;"http://merced.wcusd.org/uimg/image/1224306429059/1224957753611/1229222655574.gif";;;;;;;;
1172535;"MILLENNIUM CHILD DEVELOPMENT CENTER";"1520 NORTH LINCOLN STREET";"DIXON";"CA";95620;"SOLANO";"(707) 693-6710";"http://www.millenniumchilddevelopmentcenter.com/";"MCDCDixon@gmail.com";"Millennium Child Development Center (two locations located in Vacaville & Dixon, California) offers high quality programs targeted to the specific developmental needs of infants, toddlers and preschoolers. Millennium also offers a School-Age program. The hours of operation are 6:30 am to 6:00 pm Monday through Friday. All programs use emergent curriculum methods to explore Language Studies, Art, Science, Music, Social Studies, and fine and gross motor tasks. Millennium Child Development Center also provides all students with a nutritious hot lunch, breakfast and snacks";"http://www.millenniumchilddevelopmentcenter.com/contactinfo.html";"https://www.facebook.com/Millennium-Child-Development-Center-152078221663044/";;"http://www.millenniumchilddevelopmentcenter.com/pdf/applicationform.pdf";;"x";"x";"x";"x";;;"http://www.millenniumchilddevelopmentcenter.com/images/MillenniumLogo2JPG2.gif";"6:30AM - 6PM";"6:30AM - 6PM";"6:30AM - 6PM";"6:30AM - 6PM";"6:30AM - 6PM";"Closed";"Closed";
1172536;"MISSION VALLEY YMCA-OLD TOWN ACADEMY";"2120 SAN DIEGO AVENUE";"SAN DIEGO";"CA";92110;"SAN DIEGO";"(619) 298-3576";"http://www.oldtownacademy.org/";"nhirsch@oldtownacademy.org";"At Old Town Academy, we are focused on Core Knowledge, Project-Based Learning, and Digital Literacy. Our emphasis is on the process of learning, and developing high-achieving independent learners, who will be prepared for success in high school, that will enable them to be college and career ready. We offer an extensive after school enrichment program, with offerings in ballet, violin, Spanish, piano, karate, soccer, tennis, yoga, volleyball, STEM, chess, robotics, and more. Our enrichment program is an extension of classroom learning, and leads to further development of well-rounded students who will become active thinkers and lifelong learners.";"http://www.oldtownacademy.org/";"https://www.facebook.com/pages/Old-Town-Academy-K-8-Charter/955598907802785";;"http://oldtownacademy.org/enrollment/";"http://oldtownacademy.org/ota-forms-2/";;;"x";"x";;;"http://oldtownacademy.org/wp-content/uploads/2018/03/OTA-logo-3-Initials-PURPLE-150x161.png";"8AM - 3PM";"8AM - 3PM";"8AM - 3PM";"8AM - 3PM";"8AM - 3PM";"Closed";"Closed";
1172537;"MONTESSORI BEFORE & AFTER SCH PROG - ALTAMONT (SA)";"452 WEST SAINT FRANCIS AVE";"MOUNTAIN HOUSE";"CA";95391;"San Joaquin";"(209) 836-7240";"http://aes.lammersvilleschooldistrict.net/";;"The mission of the Lammersville Unified School District is to prepare students to become responsible decision makers who, as lifelong learners, are college and career ready and are productive contributors of their local and global community.";"http://aes.lammersvilleschooldistrict.net/after_school_services";"https://www.facebook.com/lammersville";;;"http://aes.lammersvilleschooldistrict.net/information/handbook";;;;"x";;;;"7:30AM - 4:30PM";"7:30AM - 4:30PM";"7:30AM - 4:30PM";"7:30AM - 4:30PM";"7:30AM - 4:30PM";"Closed";"Closed";
1172538;"MONTESSORI BEFORE & AFTER SCH PROG - QUESTA";"685 NORTH MONTEBELLO STREET";"MOUNTAIN HOUSE";"CA";95391;"San Joaquin";"(209) 836-7230";"https://www.montessorischoolofmountainhouse.com/";"MH@montessorica.com";"The Montessori classroom provides a prepared environment in which children learn at their own pace within the context of a loving & nurturing environment. The children’s inherent love of learning is encouraged by providing the opportunity to be spontaneous, and engage in meaningful activities under the guidance of a credentialed Montessori teacher. Through the learning activities children develop concentration, motivation, persistence, discipline, and harmony. Within this framework of order they progress at their pace and rhythm according to their individual capabilities.";"https://www.montessorischoolofmountainhouse.com/";"https://www.facebook.com/Montessori-School-of-Mountain-House-854358087980406/";"https://www.montessorischoolofmountainhouse.com/employment-opportunities/";"https://www.montessorischoolofmountainhouse.com/tuition-fees/";"https://www.montessorischoolofmountainhouse.com/tuition-fees/";;;"x";"x";;;"https://www.montessorischoolofmountainhouse.com/wp-content/uploads/2017/09/montessori-school-of-mt-house_logo.png";"7AM - 6PM";"7AM - 6PM";"7AM - 6PM";"7AM - 6PM";"7AM - 6PM";"Closed";"Closed";
1172542;"PRIME TIME SPORTS CAMP @ CHEREMOYA ELEMENTARY";"6017 FRANKLIN AVE.";"LOS ANGELES";"CA";90028;"LOS ANGELES";"(323) 333-2767";"http://primetimesportscamp.com/";"staff@primetimesportscamp.com  ";"Second enrichment period that offers additional homework time, a second sport or game, and a second academic enrichment activity";"http://primetimesportscamp.com/cheremoyaes/";;;"http://primetimesportscamp.com/wp-content/uploads/2017/09/PTSC_Cheremoya_EnrollmentApp_1718d.pdf";;;;;"x";"x";"x";"http://primetimesportscamp.com/wp-content/uploads/2018/01/28_yearsPTSC.jpg";"2:30PM - 6PM";"2:30PM - 6PM";"2:30PM - 6PM";"2:30PM - 6PM";"2:30PM - 6PM";"Closed";"Closed";
1172544;"PUMES -QUARTZ HILL AFTER SCHOOL PROGRAM";"5025 COLUMBIA WAY";"QUARTZ HILL";"CA";93536;"Los Angeles";"(661) 802-4851";"https://pumchurch.com/pumes-school/preschool";"preschool@pumchurch.com";"Children are God's wonderfully creative creatures and this quality should be nurtured and protected with greatest sensitivity. The teachers do this by creating a rich, yet relaxed climate within which your child can explore, practice, dream, imagine, and discover ways to express themselves and enjoy being with others in a joyous, Christian atmosphere.";"https://pumchurch.com/pumes-school/preschool";"https://www.facebook.com/PalmdaleUnitedMethodistEducationalServices/";;;;;;"x";"x";;;"https://s3.amazonaws.com/media.cloversites.com/40/4017d2aa-f801-4362-9e4a-6681a45c7267/site-images/a6206111-1467-4a09-be0d-5ddcb86ca279.jpg";"6:30AM - 6:30PM";"6:30AM - 6:30PM";"6:30AM - 6:30PM";"6:30AM - 6:30PM";"6:30AM - 6:30PM";"Closed";"Closed";
1172545;"QUAIL VALLEY CHILD DEVELOPMENT CENTER";"23757 CANYON HEIGHTS DRIVE";"MENIFEE";"CA";92587;"RIVERSIDE";"(408) 556-7300";"http://www.menifeeusd.org/";;"At Quail Valley Elementary School (QVES) we are committed to providing a standards-driven curriculum in a safe and orderly environment that promotes excellence and values. We believe every child is an individual of great worth and we will equip them with skills and strategies to become life-long learners in an ever changing world. Our focus is on the four essential questions of learning.";"http://www.menifeeusd.org/qve";;;;;;;"x";"x";;;;"7:40AM - 2:04PM";"7:40AM - 2:04PM";"7:40AM - 12:25PM";"7:40AM - 2:04PM";"7:40AM - 2:04PM";"Closed";"Closed";
1172546;"RAINBOW RISING-BEACON PARK";"200 CULTIVATE";"IRVINE";"CA";92618;"ORANGE";"(949) 398-8352";"https://www.rainbowrising.org/";"Beaconpark@Rainbowrising.org";"Rainbow Rising Beacon Park recognizes the growing physical, intellectual, and social competence of the school-age child. Our focus is to achieve social and academic growth while expanding their knowledge of the world. Rainbow Rising teachers work collaboratively with the school site to develop a fun curriculum that reinforces our mission statement.";"https://www.rainbowrising.org/beaconpark";"https://www.facebook.com/rainbowrisingirvine/";"https://www.rainbowrising.org/careers";"https://www.rainbowrising.org/enroll";;;;"x";"x";;;"https://static.wixstatic.com/media/1a5d71_84a1f3061821486a95bc10940a6ab859~mv2.png/v1/fill/w_104,h_93,al_c,usm_0.66_1.00_0.01/1a5d71_84a1f3061821486a95bc10940a6ab859~mv2.png";"7AM - 6PM";"7AM - 6PM";"7AM - 6PM";"7AM - 6PM";"7AM - 6PM";"Closed";"Closed";
1172547;"REDWOOD AFTER SCHOOL CARE";"6900 LAKE EARL DRIVE";"CRESCENT CITY";"CA";95531;"DEL NORTE";"(707) 464-0360";"https://www.dnusd.org/";"mmartinez@delnorte.k12.ca.us";"Redwood Elementary School is a Kindergarten through 8th grade community school with a focus on student learning and success.";"https://sites.google.com/a/delnorte.k12.ca.us/redwood/";"https://www.facebook.com/RedwoodRaiders/";"https://sites.google.com/a/delnorte.k12.ca.us/redwood/home/forms-and-docs";"https://sites.google.com/a/delnorte.k12.ca.us/redwood/home/forms-and-docs";;;;"x";"x";;;"https://sites.google.com/a/delnorte.k12.ca.us/redwood/_/rsrc/1472241626232/config/customLogo.gif?revision=2";"8:25AM - 3:05PM";"8:25AM - 3:05PM";"8:25AM - 3:05PM";"8:25AM - 3:05PM";"8:25AM - 3:05PM";"Closed";"Closed";
1172548;"RICHARD HENRY DANA SCHOOL AGE";"1401 S 1ST AVE";"ARCADIA";"CA";91006;"LOS ANGELES";"(626) 684-2366";"https://da.ausd.net/";"Assistant Principal jhunter@ausd.net";"Dana Middle School is a 2013 California Distinguished School and a 1997-1998 Blue Ribbon School of Excellence.  The Dana Middle School community holds high expectations for all of its members. Our purpose is to create responsible citizens with a lifelong passion for learning and excellence. Through a variety of educational experiences, we strive to develop self reliance, integrity, and respect for others.";"https://da.ausd.net/";"https://www.facebook.com/ArcadiaUnified/";;"https://da.ausd.net/apps/pages/index.jsp?uREC_ID=956347&type=d&pREC_ID=1350939";"https://powerschool.ausd.net/public/";;;"x";"x";;;;"7:20AM - 8:05PM";"7:20AM - 8:05PM";"7:20AM - 8:05PM";"7:20AM - 8:05PM";"7:20AM - 8:05PM";"Closed";"Closed";
1172549;"RIGHT AT SCHOOL AT HIGHLAND OAKS ELEM. SCHOOL";"10 VIRGINIA RD.";"ARCADIA";"CA";91006;"LOS ANGELES";"(626) 684-2479";"https://ho.ausd.net/";"jperez@ausd.net";"Highland Oaks School provides a safe and caring environment in which all students learn critical thinking skills and develop positive social behaviors in the process of becoming lifelong learners. With challenging instruction, students from diverse backgrounds are supported by effective instructional strategies and state of the art technology as they collaboratively engage in meaningful work.";"https://ho.ausd.net/";"https://www.facebook.com/ArcadiaUnified/";;;;;;"x";"x";;;;;;;;;;;
1172551;"SHEPHERD OF THE VALLEY SCHOOL";"11650 PERRIS BLVD";"MORENO VALLEY";"CA";92557;"RIVERSIDE";"(951) 924-3422";"http://svllearningcenter.com/";"psdirector@svlcmoval.net";"We take the responsibility of care for your children very seriously and look forward to a mutually satisfying relationship with you and your child. Our school purpose is to provide an atmosphere that encourages spiritual, social, emotional, physical and intellectual growth.";"http://svllearningcenter.com/";"https://www.facebook.com/svlcmoval/";"http://www.svllearningcenter.com/2018/03/27/pre-k-teacher-job-opening/";"http://www.svllearningcenter.com/programs/";;;;"x";"x";"x";"x";;"6:30AM - 6PM";"6:30AM - 6PM";"6:30AM - 6PM";"6:30AM - 6PM";"6:30AM - 6PM";"Closed";"Closed";
1172552;"SRVSACCA - RANCHO ROMERO";"180 HEMME";"ALAMO";"CA";94507;"CONTRA COSTA";"(925) 743-9108";"https://rres-srvusd-ca.schoolloop.com/";;"Rancho Romero is a community of learners joined together in a nurturing and safe environment. All staff members are committed to providing students with the tools to become productive and responsible citizens of the Twenty-first Century. It is essential that our students acquire skills in gathering, organizing, and analyzing information as well as developing skills in critical thinking and problem solving. Students will have access to modern technology and use these tools in their everyday lives. They must be able to express themselves through written and oral communication as well as the arts. Students need to be actively engaged in both mental and physical activities to keep their minds and bodies healthy and fit. Parents and community members take an active role in supporting and encouraging all members of the school population.  The teachers, support staff, and parents work together to prepare students for the future with high expectations for all and a unified commitment to education.  ";"https://rres-srvusd-ca.schoolloop.com/";;;"https://rres-srvusd-ca.schoolloop.com/enrollment";;;;"x";"x";;;"https://rres-srvusd-ca.schoolloop.com/uimg/image/1303566125304/1500707742068.png";"8:15AM - 2:55PM";"8:15AM - 2:55PM";"8:15AM - 2:55PM";"8:15AM - 2:55PM";"8:15AM - 2:55PM";"Closed";"Closed";
1172553;"SRVSACCA - TWIN CREEKS";"2785 MARSH DR.";"SAN RAMON";"CA";94583;"CONTRA COSTA";"(925) 743-9108";"https://tces-srvusd-ca.schoolloop.com/";"mkravit@srvusd.net";"Twin Creeks Elementary School in San Ramon, California was established in 1973. As a neighborhood school, whose enrollment is just over 500 students, we are dedicated to preparing students for the future with the skills and knowledge necessary to be successful in the changing world. With our school wide vision and the California State Standards as the driving forces, the Twin Creeks community is committed to meeting the needs of ALL of our students. ";"https://tces-srvusd-ca.schoolloop.com/";;;"https://tces-srvusd-ca.schoolloop.com/registration";"https://tces-srvusd-ca.schoolloop.com/CAASPP";;;"x";"x";;;"https://tces-srvusd-ca.schoolloop.com/uimg/image/1229223637325/1313210423217/1325748867803.jpg";"8:05AM - 2:32PM";"8:05AM - 2:32PM";"8:05AM - 2:32PM";"8:05AM - 2:32PM";"8:05AM - 2:32PM";"Closed";"Closed";
1172554;"STAR MAIDU";"1950 JOHNSON RANCH ROAD";"ROSEVILLE";"CA";95661;"PLACER";"(916) 782-8454";"https://starsacramento.org/";"maidu@starsacramento.org";"STAR Education's mission is to offer extended educational, recreational, and enrichment programs to students; support and enhance school curriculum; improve student achievement; and expand the cultural base of young people through innovative, quality programs offered by highly qualified instructors.";"https://starsacramento.org/locations/";"https://www.facebook.com/stareureka?ref=bookmarks";"https://starsacramento.org/getinvolved/";"https://starsacramento.org/programs/";;;;"x";"x";"x";"x";"https://starsacramento.org/img/starlogo_opt.png";;;;;;;;
1172555;"STUART C.GILDRED-LOS OLIVOS ELEMENTARY ENRICHMENT";"2540 ALAMO PINTADO AVENUE";"LOS OLIVOS";"CA";93441;"Santa Barbara";"(805) 686-2037";"http://www.sbceoportal.org/losolivos/";;"We believe we are a welcoming, small town community of connected, creative, hardworking learners who encourage one another to be positive, to be exploratory, to be risk-takers, and to embrace our differences. We believe every experience is an opportunity for growth and a path to success!";"http://www.sbceoportal.org/losolivos/pages/los-olivos-elementary-school.php";;"http://www.sbceoportal.org/losolivos/pages/district-office/job-opportunities.php";"http://www.sbceoportal.org/losolivos/pages/los-olivos-elementary-school/student-parent-resources.php";"http://www.sbceoportal.org/losolivos/pages/los-olivos-elementary-school/student-parent-resources.php";;;"x";"x";"x";;"http://www.sbceoportal.org/losolivos/templates/losolivos/banner.jpg";;;;;;;;
1172556;"WEST LA EXTENDED DAY";"6550 W. 80TH STREET";"LOS ANGELES";"CA";90045;"LOS ANGELES";"(310) 642-8386";"http://www.wishcharter.org/";"WestLAExtendedDay@gmail.com";"The WISH mission is to maximize every scholar's learning potential within an atmosphere of caring and belonging.  The WISH instructional philosophy rests upon the concepts of hands on learning, meaningful instructional activities, systematic instruction, and a collaborative group of professionals working together to make the learning environment exciting for students. Evidence-based teaching strategies will be tailored to meet individual development.";"http://www.wishcharter.org/programs/before-after-school-care,-enrichment-nutrition/west-la-extended-day.aspx";"https://www.facebook.com/WISHCharter/";"http://www.wishcharter.org/media/28752/wish_charter_school_application.pdf";"http://www.wishcharter.org/how-to-enroll/enrollment-process.aspx";;;;"x";"x";"x";"x";"https://scontent.fskp3-1.fna.fbcdn.net/v/t1.0-1/p200x200/19702124_10154729390273017_7985879557888091713_n.jpg?_nc_cat=0&oh=01a1a121cb79d7e3725bf6adaf49e217&oe=5B8D7488";"8:45AM - 2PM";"8:45AM - 2PM";"8:45AM - 2PM";"8:45AM - 2PM";"8:45AM - 2PM";"Closed";"Closed";
1172559;"YMCA OF THE EAST BAY - ELLERHORST Y-KIDS";"3501 PINOLE VALLEY RD.";"PINOLE";"CA";94564;"CONTRA COSTA";"(510) 412-5647";"http://www.ymcaeastbay.org/";"wccinfo@ymcaeastbay.org ";"Y-Kids programs provide individual and group activities to promote self esteem and cooperation. The Y is committed to supporting health and wellness, and has pledged to implement Healthy Eating Physical Activity (HEPA) into all of our child development centers. Our curriculum is designed to enhance learning and promote development.";"http://www.ymcaeastbay.org/Locations/E-M-Downer-Family-YMCA/Our-Programs/Youth-Development/Childcare/Before-After-School.htm";"https://www.facebook.com/em.downer.5";;;"http://www.ymcaeastbay.org/Assets/YMCA+of+the+East+Bay+Digital+Assets/E.+M.+Downer+YMCA/Fact+Sheets+and+Forms/EM+Downer+Handbook.pdf";;;;"x";"x";;;"7AM - 6PM";"7AM - 6PM";"7AM - 6PM";"7AM - 6PM";"7AM - 6PM";"Closed";"Closed";
1172560;"YMCA OF THE EAST BAY Y-KIDS GRIMMER";"43030 NEWPORT DRIVE";"FREMONT";"CA";94538;"ALAMEDA";"(510) 651-2457";"http://www.ymcaeastbay.org/";;"At YMCA Child Care, weekly activities are carefully planned to provide a balance of learning and fun. Games, sports and outdoor activities help children develop coordination and teamwork. Art and craft projects allow your child to express his or her creativity. The program also includes: Daily Homework Help, Science, technology, engineering and math (STEM), Math/Literacy Enrichment, Arts Education, College and Career Exploration, Global Learning, Leadership Development, Nutrition Education, Physical Activity, Service Learning and Asset Development, Family Events.";"http://www.ymcaeastbay.org/Locations/Fremont-Newark-YMCA/Our-Programs/Youth-Development/Child-Care/Child_Care_Program__Grades_K-6.htm";;;;;;;;"x";"x";;;;;;;;;;
1172561;"YMCA OF THE EAST BAY Y-KIDS PATTERSON";"35521 CABRILLO DR.";"FREMONT";"CA";94536;"ALAMEDA";"(925) 351-8476";"http://www.ymcaeastbay.org/";;"At YMCA Child Care, weekly activities are carefully planned to provide a balance of learning and fun. Games, sports and outdoor activities help children develop coordination and teamwork. Art and craft projects allow your child to express his or her creativity. The program also includes: Daily Homework Help, Science, technology, engineering and math (STEM), Math/Literacy Enrichment, Arts Education, College and Career Exploration, Global Learning, Leadership Development, Nutrition Education, Physical Activity, Service Learning and Asset Development, Family Events.";"http://www.ymcaeastbay.org/Locations/Fremont-Newark-YMCA/Our-Programs/Youth-Development/Child-Care/Child_Care_Program__Grades_K-6.htm";;;;;;;;"x";"x";;;;;;;;;;
1172562;"YWCA-SV WEST VALLEY";"3001 ROSS AVENUE";"SAN JOSE";"CA";95124;"SANTA CLARA";"(408) 295-4011";"http://ywca-sv.org/";;"Providing families with affordable, quality child care is crucial to our vision. Serving families for more than 60 years, the YWCA operates child care centers for almost 200 children each year, ranging in age from 6 weeks to 12 years. Each of our licensed centers are staffed with enthusiastic individuals trained in cultural proficiency.";"http://ywca-sv.org/our-services/child-care-centers/";;;;;;;;"x";"x";;"http://ywca-sv.org/wp-content/uploads/2016/05/ywcalogo.png";"6:30AM - 6PM";"6:30AM - 6PM";"6:30AM - 6PM";"6:30AM - 6PM";"6:30AM - 6PM";"Closed";"Closed";
