"Id";"Name";"Address";"City";"State";"Zip";"County";"Phone";"Main url";"Email";"Details";"location website";"Facebook page";"Career employment";"Application/registration url";"Parent handbook url";"Infant (under 12 months)";"Toddler (1-2yrs)";"Preschools (2-3yrs)";"pre-kindergarden(4yr)";"before/afterschools";"camps";"logo url";"monday hour";"tuesday hour";"wednesday hour";"thursday hour";"friday hours";"saturday hour";"sunday hour";"notes"
1179338;"SOLOMON LUTHERAN";"305 W MAIN ST";"WOODVILLE";"OH";43469;"SANDUSKY";4198493600;"http://solomonelementary.com/";"nschiets@solomon.pvt.k12.oh.us";"Solomon Lutheran School provides a superior environment for spiritual growth through the integration of faith and learning for students in preschool and grades K – 6.

";"http://solomonelementary.com/";"https://www.facebook.com/pg/SolomonElemWdv/";"http://solomonelementary.com/tag/position-vacancy/";"http://solomonelementary.com/nursery-and-preschool-registration/";;;"x";"x";;;;"https://scontent-lga3-1.xx.fbcdn.net/v/t1.0-1/1947996_745326112203299_7883198206532449255_n.png?_nc_cat=104&oh=5a638fa0471ca3e713bf912b6ac4b987&oe=5C1CC47E";"8:00A.M. – 3:00 P.M";"8:00A.M. – 3:00 P.M";"8:00A.M. – 3:00 P.M";"8:00A.M. – 3:00 P.M";"8:00A.M. – 3:00 P.M";"Closed";"Closed";
1179339;"SONSHINE CHRISTIAN ACADEMY";"1965 GLADSTONE AVE";"COLUMBUS";"OH";43211;"FRANKLIN";6142916840;"http://www.scaoh.us";"info@scaoh.us";"Sonshine Christian Academy (SCA) is a coeducational day Academy for grades PreK – 8 and is operated as a nondenominational educational corporation. SCA was incorporated on March 31, 1980 as a non-profit corporation under the laws of the State of Ohio and is governed by a member-elected Board of Trustees. Sonshine Christian Academy is exempt from federal income taxes under the provisions of Section 501 (c)(3) of the Internal Revenue Code. SCA is fully chartered by the Ohio Department of Education and is a member of the Association of Christian Schools International.

Sonshine Christian Academy provides a Christ-centered education for children in the Columbus, Ohio area and surrounding communities without distinction to race, color, gender, national or ethnic origin or socioeconomic status. The curriculum, which is based on a Christian philosophy, is continuously current in subject matter and compliant with the laws of the State of Ohio and the regulations of the Ohio State Board of Education.";"http://www.scaoh.us";"https://www.facebook.com/scacolumbus";;"http://www.scaoh.us/admissions/admission-forms/";"http://www.scaoh.us/admissions/parent-handbook/";;;"x";"x";;;"http://www.scaoh.us/wp-content/uploads/2018/07/sca_header_logo_v2.jpg";"7:30am - 3:00pm ";"7:30am - 3:00pm ";"7:30am - 3:00pm ";"7:30am - 3:00pm ";"7:30am - 3:00pm ";"Closed";"Closed";
1179340;"SOUTH  ELEMENTARY SCHOOL";"92 E MAIN ST";"MADISON";"OH";44057;"LAKE";4404285121;"https://www.madison-lake.k12.oh.us/";"Shannon.Kriegmont@madisonschools.net";"Madison High School is a public high school located in Madison, Ohio, United States. The only high school in the Madison Local School District, it was established in 1895.";"https://www.madison-lake.k12.oh.us/3/Home";"https://www.facebook.com/pages/Madison-High-School-Madison-Ohio/105493879483261";;"https://www.madison-lake.k12.oh.us/District/Links-Forms";;;;"x";"x";;;"https://encrypted-tbn0.gstatic.com/images?q=tbn:ANd9GcQAIcOoNNzP19Fc6aUydpoEN_a9BWCLXEuz_a5w7KsOrwwJFqEdBQ";" 7:45 AM  -  2:00 PM";" 7:45 AM  -  2:00 PM";" 7:45 AM  -  2:00 PM";" 7:45 AM  -  2:00 PM";" 7:45 AM  -  2:00 PM";"Closed";"Closed";
1179342;"SOUTH AVONDALE ELEMENTARY SCHOOL";"636 PROSPECT PL";"CINCINNATI";"OH";45229;"HAMILTON";5133635500;"https://southavondale.cps-k12.org/";"Johange@cps-k12.org";"The new Creative Integration of Arts and Sciences program is open to students in kindergarten through grade 6. It provides an interdisciplinary curriculum aimed at building critical thinking skills through artistic expression. Students will create, perform, respond and connect to artistic and scientific concepts and materials. The arts-infused STEAM (Science, Technology, Engineering, Arts and Math) curriculum will empower each student to optimize their creative, collaborative, critical thinking and communication skills within a thriving community Read more about our Creative Integration of Arts and Sciences Focus.";"https://southavondale.cps-k12.org/";"https://www.facebook.com/pages/South-Avondale-Elementary-School/496574247152165?ref=br_rs";"https://www.cps-k12.org/about-cps/employment";"https://southavondale.cps-k12.org/enroll";;;;"x";"x";;;"https://southavondale.cps-k12.org/sites/southavondale.cps-k12.org/files/logo-cps2016.png";"8:00 a.m. - 2:30 p.m";"8:00 a.m. - 2:30 p.m";"8:00 a.m. - 2:30 p.m";"8:00 a.m. - 2:30 p.m";"8:00 a.m. - 2:30 p.m";"Closed";"Closed";
1179343;"SOUTH BLOOMFIELD SCHOOL";"194 DOWLER DR";"SOUTH BLOOMFIELD";"OH";43103;"PICKAWAY";7404747529;"http://www.tvsd.us/";"bbryant@tvsd.us";"At South Bloomfield Elementary we believe that each and every student can be a CHAMPION. CHAMPIONS are successful at school in academics and behavior through supported guidance and modeling of Academic effort, exemplary Behavior and good Choices. These are the ABCs of a CHAMPION. We believe that the foundation for a child’s values is built at home and practiced through reinforcement at school. Our quest to make students CHAMPIONS will be most successful with the support of each family!";"http://www.tvsd.us/southbloomfieldelementary_home.aspx";"https://www.facebook.com/pg/southbloomfield/";"http://www.tvsd.us/EmploymentOpportunities.aspx";"http://www.tvsd.us/Enrollment1.aspx";"http://www.tvsd.us/Downloads/handbook_elem_18-19_3.pdf";;;;"x";;;"http://www.tvsd.us/sysimages/LOGO.png";"9:00 AM - 3:30 PM";"9:00 AM - 3:30 PM";"9:00 AM - 3:30 PM";"9:00 AM - 3:30 PM";"9:00 AM - 3:30 PM";"Closed";"Closed";
1179344;"SOUTH CENTRAL ELEMENTARY SCHOOL";"3291 GREENWICH ANGLING RD";"GREENWICH";"OH";44837;"HURON";4197520011;"http://www.south-central.org/";" nrichards@south-central.org";"
South Central Local Schools are asking for quotes for snow removal for the 2018-2019 school years'. Please click here for a full list. All quotes must be received by the Treasurer of the South Central Local Schools no later than 3:00 p.m. on Wednesday, October 31, 2018. Please submit bids in a sealed envelope marked ""Snow Removal Bids"". 
Read More...
";"http://www.south-central.org/southcentralelementaryschool_home.aspx";"https://www.facebook.com/South-Central-Schools-414505255377842/";"http://www.south-central.org/Employment.aspx";"http://www.south-central.org/Forms.aspx";"www.south-central.org/Downloads/ElementaryHandbook%202017-2018.docx";;;;"x";;;"http://www.south-central.org/sysimages/logo.png";" 7:05 AM  -  2:30 PM";" 7:05 AM  -  2:30 PM";" 7:05 AM  -  2:30 PM";" 7:05 AM  -  2:30 PM";" 7:05 AM  -  2:30 PM";"Closed";"Closed";
1179345;"SOUTH ELEMENTARY";"38234 STATE ROUTE 93";"HAMDEN";"OH";45634;"VINTON";7403842731;"http://ww2.vinton.k12.oh.us/";"bklrose3@yahoo.com";;"http://ww2.vinton.k12.oh.us/he/";"https://www.facebook.com/Vinton-County-Local-Schools-170065540288/";;;;;;;"x";;;"https://scontent.fkhi11-1.fna.fbcdn.net/v/t1.0-1/c83.39.485.485/s200x200/933991_10151831556600289_999454776_n.jpg?_nc_cat=108&oh=10ee8e9d08ee69b98a73748bcb5aa9a8&oe=5C1842EA";"8:00 AM - 4:00 PM";"8:00 AM - 4:00 PM";"8:00 AM - 4:00 PM";"8:00 AM - 4:00 PM";"8:00 AM - 4:00 PM";"Closed";"Closed";
1179346;"SOUTH ELEMENTARY SCHOOL";"280 E SHAFER AVE";"DOVER";"OH";44622;"TUSCARAWAS";3303647111;"http://www.dover.k12.oh.us/";"durantm@dovertornadoes.com";"At South School, we take pride in providing a safe, positive and welcoming environment where all children have the opportunity to succeed.   We have a dedicated staff that puts the needs of students at the forefront of all they do.  

 Our students have the opportunity to participate in a variety of activities and programs including; Accelerated Reader, student council, band, “Takin it to the Schools”, Big Brothers/Big Sisters, orchestra, choir, Young Authors, and the County Math Tournament.  Students can also take advantage of our walking club and basketball club which are held before school.    During the 2017/2018 school year, we added a morning reading program for third grade students and we also expanded our after school intervention sessions to include enrichment opportunities.   These are just a few of the experiences that are available to our students at South.
 
It is a priority at South for students to learn the value of “giving back.” Our students participated in many service projects such as Relay for Life, Coats for kids, and Rainbow Connection’s coin challenge.   Our student council also sponsored several activities throughout the year including Spirit Days to raise money for a variety of charities.  

 Our “Recess Rally” was a HUGE success again this past year.  Our students, families and sponsors raised over $12,000 to make needed improvements.    We appreciate all of the families and community members that have continued to support this event.  Watch for the new additions and more improvements coming soon.  

 South School houses over 400 students in grades preschool through fifth grade. Our preschool program earned a 5 star rating, the highest possible, from The Ohio Department of Education for the second year in a row for providing a quality program for children ages 3-5. 

 In addition to the opportunities provided by our teachers and staff; our South School PTG provided many fun and educational activities such as assemblies, field trips, and Santa Shop just to name a few.   Thank you to our PTG for all they do.  ";"http://www.dovertornadoes.com/southelementary_home.aspx";"https://www.facebook.com/pages/South-Elementary-School/739523649468398";"http://www.dovertornadoes.com/EmploymentOpportunities.aspx";"http://dover.esvbeta.com/Forms.aspx";"http://www.dovertornadoes.com/Downloads/K-5%20handbook%202018-19_FINAL.pdf";;;;"x";;;"http://www.dovertornadoes.com/sysimages/LogoTop1.png";"  7:00 a.m  2:35 p.m";"  7:00 a.m  2:35 p.m";"  7:00 a.m  2:35 p.m";"  7:00 a.m  2:35 p.m";"  7:00 a.m  2:35 p.m";"Closed";"Closed";
1179347;"SOUTH ELEMENTARY SCHOOL";"3555 STATE ROUTE 792";"STOCKPORT";"OH";43787;"MORGAN";7405592377;"http://www.mlsd.k12.oh.us/";;"Morgan South Elementary was one of three brand new elementary buildings to open in Morgan County in the fall of 2002.  Since that time, we have made it our goal to show our appreciation to our county for helping to support our efforts for new buildings, by providing the best instruction possible for all students.  Our mission is to provide an education of the highest quality that drives all of our students to excel while meeting their individual needs, developing their character and potential as we prepare them for the future. 

 

Our school lies in the center of three local villages, and we are proud to have strong ties to these communities.  Because of these ties, we are able to offer a number of character building and incentive programs for our students.  We believe that building character, compassion, and leadership skills is of the utmost importance.  One way we try to encourage these skills is through our Change of Heart program.  Students taking part in this program learn how to lead by example, and have a strong impact on the atmosphere of our school.  Another way we encourage students to do well is through our Homework Heroes program.  This is an incentive program that rewards students who consistently complete and turn in their homework.   Without the support of our community and the local businesses, programs such as these would not be possible.

 

Our staff believes that in order for children to be successful, schools and families must work together.  For this reason, we encourage parent volunteers, and try to organize several family events each year, such as our Fall Festival, Family and Community Night, Math and Author Night, and Awards Ceremonies each nine weeks.  Our goal is for students to feel confident and at home in their school.  For this reason, we chose the vision statement:  Strong Optimism Unites This Home.

 

South Elementary has been recognized by the Ohio Department of Education as a High Progress School of Honor based on the 2013-2014 Ohio School Report Card on student reading and math performance.  South has also earned the title of 2014 SOAR Award for High Progress (grades 4-8).  South earned this award based on the 2014 annual school composite index.";"http://www.mlsd.k12.oh.us/elementary/south";"https://www.facebook.com/pg/MorganLocalSchoolDistrict/";"http://www.mlsd.k12.oh.us/district/job-opportunities";"http://www.mlsd.k12.oh.us/studentsparents/kindergarten-registration";"http://www.mlsd.k12.oh.us/component/docman/cat_view/466-handbook?Itemid=507";;;;"x";;;"http://www.mlsd.k12.oh.us/images/morganweblogo2.jpg";"9:00 a.m  3:30 p.m";"9:00 a.m  3:30 p.m";"9:00 a.m  3:30 p.m";"9:00 a.m  3:30 p.m";"9:00 a.m  3:30 p.m";"Closed";"Closed";
1179348;"SOUTH GALLIA H SCHOOL";"55 REBEL DR";"CROWN CITY";"OH";45623;"GALLIA";7402450593;"http://www.gcls.k12.oh.us/";"gl_bshamblin@seovec.org";"South Gallia High/Middle School has earned a reputation of academic excellence through the hard work of our students, teachers, parents and staff. South Gallia supports a wide array of exemplary academic, athletic, and social opportunities for all students. The goal of South Gallia High/Middle School is to empower every student to maximize his or her opportunities while meeting global challenges. South Gallia offers a safe learning environment that promotes intellectual growth, health, creativity, and respect for self and others. We are proud of the accomplishments of our school and are excited to share our South Gallia High/Middle School pride throughout the school year. I truly believe strong partnerships between parents/guardians/stakeholders and staff lead to academic success for all students. Therefore, I invite you to visit our school and to actively participate in your child’s education. This participation may come in a variety of forms including: joining the boosters for athletics or band, working as a volunteer at the school, checking your child’s homework and agenda on a daily basis, attending school-wide events, and communicating questions or concerns to myself and the teachers.";"http://www.gcls.k12.oh.us/2/Home";"https://www.facebook.com/pg/South-Gallia-MiddleHigh-School-331737903913549/";"http://www.gcls.k12.oh.us/Employment";"http://www.gcls.k12.oh.us/2/Content2/90";"http://www.gallialocal.org/District/Links-Forms";;;;"x";;;"https://scontent.fkhi11-1.fna.fbcdn.net/v/t1.0-1/p200x200/18952671_331785167242156_8490480832174707065_n.jpg?_nc_cat=109&oh=68495c801391abdd3dc03ba2eca46e63&oe=5C16742C";;;;;;;;
1179349;"SOUTH LEBANON ELEMENTARY SCHOOL";"50 RIDGEVIEW LN";"MAINEVILLE";"OH";45039;"WARREN";5133988050;"http://www.kingslocal.net/";"sburdine@kingslocal.net";"SLE Knights are Respectful, Responsible and Problem - Solvers. South Lebanon Elementary received the letter grade of A on the 2013-14 School Report Card from the Ohio Department of Education. This is the 10th year in a row that SLE has received the highest designation possible from ODE on the annual School Report Card.";"http://www.kingslocal.net/south-lebanon-elementary-school/home-1/-/";"https://web.facebook.com/pg/South-Lebanon-Elementary-School-179236082118128/";"http://www.kingslocal.net/district-departments/hr---employment-14/employment-opportunities--29/";"http://www.kingslocal.net/south-lebanon-elementary-school/enrollment-7/";"www.kingslocal.net/media/handbooks/SLE%20Parent%20Student%20Handbook%202018-2019.pdf";;;;"x";"x";;"https://scontent.flhe2-1.fna.fbcdn.net/v/t1.0-1/c60.0.200.200/p200x200/1069_621407141234351_1510557978_n.png?_nc_cat=104&_nc_eui2=AeH3YM00EkIdakxU2bG12PiI4dxSx9i05vuLPWL10NQfDLreHCSS8xy-2x71KceYhd9cQUpFZ3ckdMYDI4DZTzbzjR6mxk3wJyRy2jwPXZO3ova6nUsiwi8cdBwwtzwK5jk&oh=aa5e27e50c9b9ba46a78c7ef19aa392d&oe=5C47F38C";"8:40 a.m. to 3:20 p.m";"8:40 a.m. to 3:20 p.m";"8:40 a.m. to 3:20 p.m";"8:40 a.m. to 3:20 p.m";"8:40 a.m. to 3:20 p.m";"Closed";"Closed";
1179352;"SOUTH SCHOOL";"518 S 8TH ST";"CAMBRIDGE";"OH";43725;"GUERNSEY";7404393558;"https://sites.google.com/a/cambridgecityschools.org/south-elementary-school/";"natalie.buchanan@cambridgecityschools.org ";"South Elementary PTAG: Parents & Teachers making South Elementary a great place to learn!";"https://sites.google.com/a/cambridgecityschools.org/south-elementary-school/";"https://web.facebook.com/pg/SouthElementaryPTAG/";"http://cambridgecityschools.org/current-job-postings/";"https://drive.google.com/file/d/0B19l_239kR5Zb1pKTGJTXzRTc1c3SnFPRFp4M2ltRjJkc240/view";"http://cambridgecityschools.org/student-portal/";;;;"x";;;"https://sites.google.com/a/cambridgecityschools.org/south-elementary-school/_/rsrc/1446751383750/config/customLogo.gif?revision=3";"9:00 - 3:20";"9:00 - 3:20";"9:00 - 3:20";"9:00 - 3:20";"9:00 - 3:20";"Closed";"Closed";
1179350;"SOUTH RANGE SCHOOL";"11300 COLUMBIANA CANFIELD RD";"CANFIELD";"OH";44406;"MAHONING";3309657828;"https://www.southrange.k12.oh.us/";"darmbrecht@southrange.org";" South Range Elementary School offers educational services to students in kindergarten through grade three. The school also conducts a range of extracurricular activities. Its academic curriculum includes reading, math, science, social studies and language arts. South Range Elementary School also administers school counseling program that features family and social support groups and classroom counseling programs and discussions. The school maintains a staff of teachers, tutors, nurses, psychologists and music instructors. It additionally provides counseling, food and transportation services. South Range Elementary School also has a parent-teacher association that encourages parental involvement in children s education. The school is located in North Lima, Ohio. It is a part of the South Range Local School District, operates several elementary, middle and high schools. ";"https://www.southrange.k12.oh.us/3/Home";"https://web.facebook.com/SouthRangeLocalSchools/";"https://www.southrange.k12.oh.us/Employment";"https://www.southrange.k12.oh.us/District/Links-Forms";"https://www.southrange.k12.oh.us/docs/district/sre%20student%20handbook%202018-2019.pdf?id=3995";;;;"x";;;"https://www.southrange.k12.oh.us/customers/OH/SouthRangeLclSD/sysimages/custom/Logo.png";"7:50 am to 2:45 pm ";"7:50 am to 2:45 pm ";"7:50 am to 2:45 pm ";"7:50 am to 2:45 pm ";"7:50 am to 2:45 pm ";"Closed";"Closed";
1179351;"SOUTH MIFFLIN STEM ACADEMY (K-6)";"2365 MIDDLEHURST DR";"COLUMBUS";"OH";43219;"FRANKLIN";6143656135;"https://www.ccsoh.us/";"talktous@columbus.k12.oh.us";"Each student is highly educated, prepared for leadership and service, and empowered for success as a citizen of a global community. Learn. Dream. Succeed.";"https://www.ccsoh.us/SouthMifflinSTEMAcademy";"https://web.facebook.com/pages/South-Mifflin-Stem-Academy-K-6/393739267452920?_rdc=1&_rdr";"https://www.ccsoh.us/jobs";"https://www.ccsoh.us/enroll";;;;;"x";;;"https://www.ccsoh.us/cms/lib/OH01913306/Centricity/Template/GlobalAssets/images///logos/South%20Mifflin%20STEM%20Academy-01.png";;;;;;;;
1179353;"SOUTHEAST PRIMARY SCHOOL";"8301 TALLMADGE RD";"RAVENNA";"OH";44266;"PORTAGE";3309657828;"http://www.sepirates.org/";"cnettleton@sepirates.org";"The Southeast Local School District is located in the southeastern portion of Portage County and has a strong reputation in academics, athletics, and extracurricular programs.  The district was formed in 1950 with the consolidation of five townships (Charlestown, Deerfield, Edinburg, Palmyra, and Paris), and it encompasses 125 square miles.  This makes our district one of the largest geographically in the state.  This makes us unique but it also makes the school the hub of the area where people can gather to enjoy many of the great events at the school.  Outdoor enthusiasts will love this area as people come from many miles to enjoy camping, fishing, swimming, hunting, hiking and boating available at West Branch State Park and Berlin Reservoir which are both located within the boundaries of our district.  We are also fortunate to have several institutions of higher learning nearby, including the University of Akron, Kent State University, Youngstown State University, and the Northeast Ohio Medical University.  Our district is a great place to raise a family with small town values and high standards in education. Nickname:  Pirates      School Colors: Maroon and Gold";"http://www.sepirates.org/southeastprimaryschool_home.aspx";;"http://www.sepirates.org/employment.aspx";"http://www.sepirates.org/registration.aspx";"http://www.sepirates.org/parents.aspx";;;;"x";;;"http://www.sepirates.org/sysimages/logoPrime.jpg";"8:35 - 3:20";"8:35 - 3:20";"8:35 - 3:20";"8:35 - 3:20";"8:35 - 3:20";"Closed";"Closed";
1179354;"SOUTH-WESTERN PRESCHOOL CENTER";"4324 HAUGHN RD";"GROVE CITY";"OH";43123;"FRANKLIN";6148018448;"http://swpc.swcsd.us/";"swpreschool.pta@gmail.com";"The South-Western City School District Preschool Program has center-based preschool classrooms, head start inclusion classrooms, and provides itinerant services. Our center-based preschool programs are designed to provide early intervention for children between the ages of 3-5 years who are identified as special needs and/or preschoolers who are typically developing (peer models). Classes meet Monday through Thursday, following the South-Western City School District calendar. Assessments, home visits, training, and a variety of other activities are scheduled on various days. ";"http://swpc.swcsd.us/";"https://web.facebook.com/pg/South-Western-Preschool-PTA-260233464006733/about/?ref=page_internal";"https://sites.google.com/a/swcsd.us/human-resources/";"http://swpc.swcsd.us/special-education-forms";;;;"x";;;;"https://scontent.flhe2-1.fna.fbcdn.net/v/t1.0-1/c40.22.276.276/p320x320/300535_260233680673378_4443799_n.jpg?_nc_cat=110&_nc_eui2=AeEMt_HqZMmGWLnTQr5LPUsH8qa7ZQ95HXVPxwoH34pOXX5SsLSDcZwfEayWYOgJgUdVNf8d0xSdTRBeyFAc1hnulKcTqkCQDrkkn-XOS70QvA3EUmGMvVoNeYvAkqfMckQ&oh=c259efec4e8d857f25dbcd75df7a15a3&oe=5C5E2840";;;;;;;;
1179355;"SOUTHEASTERN SCHOOL";"2003 LANCASTER RD";"CHILLICOTHE";"OH";45601;"ROSS";7407023120;"http://www.sepanthers.k12.oh.us/";"nicole.wills@sepanthers.org";"Southeastern Elementary consists of approximately 480 students. The staff consists of 20 regular classroom teachers, 3 intervention teachers, a physical education teacher, an art teacher, a music teacher, a TAG teacher, 7 paraprofessionals, 1 guidance counselor, a school nurse, and 1 secretary.

Southeastern Elementary also hosts two Preschool Units that are staffed by the Ross County Service Center. Each preschool classroom consists of approximately 16 students, 1 classroom teacher, and instructional aide.

We are proud to serve our wonderful students and the community of our district. Our motto at the elementary is “Expect Success”. We always strive to be the best elementary in the state of Ohio!";"http://www.sepanthers.org/southeasternelementaryschool_home.aspx";;;"http://www.sepanthers.k12.oh.us/FormsLinks.aspx";"www.sepanthers.org/Downloads/ElementaryHandbook%2020182.pdf";;;;;;;"http://www.sepanthers.k12.oh.us/sysimages/logo.png";"8:15 A.M - 2:00 P.M";"8:15 A.M - 2:00 P.M";"8:15 A.M - 2:00 P.M";"8:15 A.M - 2:00 P.M";"8:15 A.M - 2:00 P.M";"Closed";"Closed";
1179356;"SOUTHERN ELEMENTARY SCHOOL";"906 ELM ST";"RACINE";"OH";45771;"MEIGS";7409492661;"http://www.southernlocalmeigs.org/";"tricia.mcnickle@southernlocal.net";"Welcome to Southern Elementary School and the 2018-2019 school year!  Our goal is to help each student become the best that he/she can be in our success-oriented learning environment.    The greatest gift we can give a child is confidence in his/her individual worth and ability.  A confident child, excellent teachers, well-designed curriculum and supportive parents are a winning combination that provides results.  At Southern Elementary, we are proud to have the dedication of the teachers and support staff, the efforts of our students and the interest and encouragement of our parents and community.     As always, if you would like to talk to me about anything, please call 949-4222, ext. 2500, or email tricia.mcnickle@southernlocal.net.";"http://www.southernlocalmeigs.org/2/Home";"https://web.facebook.com/Southern-Tornadoes-Athletics-193959993984661/";"http://www.southernlocalmeigs.org/Employment";"http://www.southernlocalmeigs.org/District/Links-Forms";"www.southernlocalmeigs.org/userfiles/125/my%20files/preschool%20handbook%202017-18(2).pdf?id=2450";;;;"x";;;;"7:40 am to 2:45 pm ";"7:40 am to 2:45 pm ";"7:40 am to 2:45 pm ";"7:40 am to 2:45 pm ";"7:40 am to 2:45 pm ";"Closed";"Closed";
