"Id";"Name";"Address";"City";"State";"Zip";"County";"Phone";"Main url";"Email";"Details";"location website";"Facebook page";"Career employment";"Application/registration url";"Parent handbook url";"Infant (under 12 months)";"Toddler (1-2yrs)";"Preschools (2-3yrs)";"pre-kindergarden(4yr)";"before/afterschools";"camps";"logo url";"monday hour";"tuesday hour";"wednesday hour";"thursday hour";"friday hours";"saturday hour";"sunday hour";"notes"
1179396;"ST BONIFACE";"215 W OAK ST";"OAK HARBOR";"OH";43449;"OTTAWA";4198981340;"https://www.sb-oh.org/";"mgreggila@sb-oh.org";"Our school is a wonderful place where the parents are emphasized as the first teachers of their children. Our goal is to help you raise your children to be children of God.

St. Boniface is a multi-age learning environment. This structure provides a very efficient, individualized education, which builds a healthy sense of self so that the subject's content is what they are learning. It is also very safe and affordable. We are a non-profit organization in which no one will be turned away for financial reasons. One must show an earnest attempt to work with the support of the school.
Mission Statement

Compelled by devotion to Jesus Christ and His Church, Saint Boniface Catholic School gives students the character and confidence to boldly live the Gospel. This spiritual, physical, academic, and moral foundation will inspire them to lead lives that promote and proclaim Christ’s teachings.
";"https://sites.google.com/sb-oh.org/st-boniface-catholic-school";"https://web.facebook.com/ourstb/?_rdc=1&_rdr";;"https://sites.google.com/sb-oh.org/st-boniface-catholic-school/admissions/enrollment";"https://sites.google.com/sb-oh.org/st-boniface-catholic-school/students/student-handbook";;;"x";"x";"x";;"https://scontent.flhe2-1.fna.fbcdn.net/v/t1.0-1/p200x200/17884062_1892837820742253_4338518688036747169_n.jpg?_nc_cat=111&_nc_eui2=AeFRz5tgnzEUxWpp8ybxU3jJraq_i2fMbasLbB6HT0TYUzubTblbxJNERPp6O2K-5JYLmM6y4urHYZs0u6HS9JXWbYMHGAeu9ZhbI8RUW3JCNri4Kmw7jPSsiQuXEmzsm54&_nc_ht=scontent.flhe2-1.fna&oh=55e6a170a397e41c9ffcfaff08580dea&oe=5C541501";"8:30am – 2:35 pm";"8:30am – 2:35 pm";"8:30am – 2:35 pm";"8:30am – 2:35 pm";"8:30am – 2:35 pm";"Closed";"Closed";
1179397;"ST BERNARD SCHOOL";"4615 TOWER AVE";"SAINT BERNARD";"OH";45217;"Hamilton";5136744200;"http://hs.sbepschools.org/";"rreynolds@sbepschools.org";"The St. Bernard-Elmwood Place Board of Education wants to take this opportunity to reaffirm its strong belief in the concept of local control over public education, operating with statutory limitations. 

The Board of Education has the dual legal responsibilities of implementing statutory requirements for public education and fulfilling citizens’ desires for educating the community’s youth.

While the board has an obligation to assess citizens’ desires, it is understood that when citizens elect delegates to represent them in the conduct of public education, they endow their representatives with the authority to exercise their best judgment in making decisions that affect the school system.

The board believes its primary purpose is to ensure the optimal learning experience for the children enrolled in its schools. We believe that we should constantly aim toward having the best school system possible within available resources. We have long realized that achieving district success is virtually impossible without citizens’ participation. For that reason, we are convinced that the high level of success in the district is a reflection of the support we have received from the community.

Pride and involvement have a way of perpetuating achievement. Let’s keep it going.";"http://hs.sbepschools.org/";"https://web.facebook.com/St-Bernard-Elementary-111108952895277/?_rdc=1&_rdr";"http://www.sbepschools.org/cms/One.aspx?portalId=2981761&pageId=3831523";"http://www.sbepschools.org/about_us/enrollment";"http://sbepschools.ss16.sharpschool.com/parents/school_forms_and_information";;;"x";;;;"https://scontent.flhe2-1.fna.fbcdn.net/v/t1.0-1/p320x320/20708194_111111082895064_3070101413673060309_n.jpg?_nc_cat=110&_nc_eui2=AeERyog2WCc2EWIVLa47uBOhzpL12lUmejeyCg18wye6fGsOq1FMog_3XDAeOy0SFdMT7sQJnep_d72w_Q3edl23xvCphznM9HfTnP7kGU3ouBKDQcZcMZlwbKj3PppFe5Q&_nc_ht=scontent.flhe2-1.fna&oh=39e6c16570d84688ee52655a81626611&oe=5C5F94D1";"7:50 a.m – 2:58 pm";"7:50 a.m – 2:58 pm";"7:50 a.m – 2:58 pm";"7:50 a.m – 2:58 pm";"7:50 a.m – 2:58 pm";"Closed";"Closed";
1179398;"ST BRENDAN";"4242 BRENDAN LN";"NORTH OLMSTED";"OH";44070;"CUYAHOGA";4407778433;"http://www.stbrendannortholmsted.org";"SBS@stbrendannortholmsted.org";"St. Brendan School has so many great things to offer. I welcome you to learn more about what makes our school such an invaluable and lively place to encounter Christ together in faith, service, and education.

St. Brendan Catholic Parish School was founded in 1964 and has been a strong presence in the community ever since. We offer 3- & 4-year-old preschool, full-day kindergarten and first through eighth grades on our nine-acre campus.

Best practices and integrated technology are used to connect learning with real-life application. Interactive lessons, project-based learning, STEM and authentic assessments enable students to be active participants in their education.

Grades 1-4 each have their own iPad mini to use throughout the day and grades 5-8 are 1:1 each with their own chromebook. With guided instruction students experience the academic opportunities that accompany a technologically advanced school. Kindergarten utilize the iPad cart, which they use both in the Technology Suite as well as in the classroom. Preschool through 8th grade classrooms have Interactive Projectors. Our technology makes learning come alive!

We follow the State of Ohio standard curriculum infused with our Catholic Identity. In addition, St. Brendan School has advanced programs: Spanish (Pre-8), algebra I, advanced math and science, as well as additional wellness and enrichment programs for all grade levels.

The addition of a Curriculum Coordinator to our faculty has proved to be beneficial. Her role includes: researching classroom instruction that works, investigating new technology that will enhance learning opportunities and teaching study and test-taking skills.

Our dedicated faculty are licensed professionals that strive to cultivate the student's spiritual growth and academic achievement. Faculty and staff model our mission statement so that all may come to know Christ through us. We invite you to come visit St. Brendan School and experience for yourself, our warm, nurturing environment.";"http://school.stbrendannortholmsted.org/";"https://web.facebook.com/pages/St-Brendan/617598925104246?_rdc=1&_rdr";;"http://www.stbrendannortholmsted.org/Admissions.aspx";"http://www.stbrendannortholmsted.org/Handbook.aspx";;;"x";;"x";;"http://www.stbrendannortholmsted.org/GalleryImages/2017630185028138_image.jpeg";"8:30am – 2:30 pm";"8:30am – 2:30 pm";"8:30am – 2:30 pm";"8:30am – 2:30 pm";"8:30am – 2:30 pm";"Closed";"Closed";
1179399;"ST BRIGID";"312 FAIRGROUND RD";"XENIA";"OH";45385;"GREENE";9373723222;"https://stbrigidxenia.org/";"tadkins@stbrigidxenia.org";"St. Brigid Catholic School is a preschool through 8th grade school located in Xenia, Ohio. For more info about us visit www.stbrigidxenia.org.";"https://stbrigidxenia.org/school/";"https://web.facebook.com/pg/St-Brigid-School-Xenia-339251562825168/about/?ref=page_internal";;"https://stbrigidxenia.org/school/wp-content/uploads/sites/2/2017/11/k-8-registration-form-2017-18.pdf";"https://stbrigidxenia.org/school/parentstudent-handbook/";;;"x";"x";;;"https://scontent.flhe2-1.fna.fbcdn.net/v/t1.0-1/p320x320/12509472_955728354510816_1508020088603200074_n.jpg?_nc_cat=101&_nc_eui2=AeFPtTcOecVsWHBvkOVLV7CRCbmOnr2rCLmcrMkXc_ri90JTqIbJHh3yQxFsuTVn3lORnItci2BeODng2vHjyyIL0EV-6udZP7yssQFK8Y965Nlk4P7ClBbQ_3x-c-ykocA&_nc_ht=scontent.flhe2-1.fna&oh=57a049d70222711d90172ee2db73b8e0&oe=5C57C399";" 8:30 – 3:00 p.m";" 8:30 – 3:00 p.m";" 8:30 – 3:00 p.m";" 8:30 – 3:00 p.m";" 8:30 – 3:00 p.m";"Closed";"Closed";
1179400;"ST BRIGID OF KILDARE";"7175 AVERY RD";"DUBLIN";"OH";43017;"FRANKLIN";6147185825;"http://www.stbrigidofkildare.com/";"mrs.wachalec@stbrigid-school.org.";"Saint Brigid of Kildare School provides a traditional and rigorous Catholic education for students in preschool through grade eight. As a co-educational, award-winning school in the Diocese of Columbus, we strive for an authentic integration of the Catholic faith and Catholic values within challenging academic experiences.";"http://www.stbrigidofkildare.com/";"https://web.facebook.com/pg/St-Brigid-Of-Kildare-Elementary-School-290980644426053/about/?ref=page_internal";"http://www.stbrigidofkildare.com/employment/";"http://www.stbrigidofkildare.com/apply/";"http://www.stbrigidofkildare.com/wp-content/uploads/2018/08/Parent-Student-Handbook-18.19.pdf";;;"x";"x";;;"http://www.stbrigidofkildare.com/wp-content/uploads/2016/01/4color3-.png";"7:30 am – 4:00 pm";"7:30 am – 4:00 pm";"7:30 am – 4:00 pm";"7:30 am – 4:00 pm";"7:30 am – 4:00 pm";"Closed";"Closed";
1179401;"ST CATHARINE PRESCHOOL";"504 S GOULD RD";"COLUMBUS";"OH";43209;"FRANKLIN";6142351396;"http://stcatharineschool.com/";"cdeberson@cdeducation.org";"St. Catharine Preschool is a Catholic early learning program, connected to St. Catharine School. We are proud to share that we have been awarded 5-stars in the state of Ohio’s Step Up to Quality rating system. Step Up to Quality is a rating system that awards one to five stars to learning and development programs that go above and beyond minimum licensing standards.  Star ratings are awarded to programs that are committed to continuous improvement, the continuing education of teachers, the use of learning and development standards to support children’s learning, and value the relationship  with families and community.";"http://stcatharineschool.com/st-catharine-preschool/";"https://web.facebook.com/stcatharineschool/?_rdc=1&_rdr";;"http://stcatharineschool.com/st-catharine-preschool/registration-forms/";"stcatharineschool.com/wp-content/uploads/2018/09/St.-Catharine-Parent-Handbook-2018-2019.pdf";;;"x";"x";;;"http://stcatharineschool.com/wp-content/uploads/2017/10/SC-Logo-White-Text-01D.png";"8:15 AM  – 3:15 pm";"8:15 AM  – 3:15 pm";"8:15 AM  – 3:15 pm";"8:15 AM  – 3:15 pm";"8:15 AM  – 3:15 pm";"Closed";"Closed";
1179402;"ST CECILIA";"4115 TAYLOR AVE";"CINCINNATI";"OH";45209;"HAMILTON";5135336060;"https://stceciliacincinnati.org/";"mgoedde@stceciliacincinnati.org";"In partnership with parents and rooted in the teachings of the Catholic Church, St. Cecilia School is dedicated to fostering the spiritual, intellectual, social, and physical development of all students, empowering them to realize their full potential.";"https://school.stceciliacincinnati.org/";"https://web.facebook.com/stceciliacincinnati?_rdc=1&_rdr";;"https://school.stceciliacincinnati.org/new-student-registration";"https://school.stceciliacincinnati.org/documents/2018/8/Parent-Student%20Handbook%202018-2019.pdf";;;;"x";"x";;;"7:40am  – 3:00pm";"7:40am  – 3:00pm";"7:40am  – 3:00pm";"7:40am  – 3:00pm";"7:40am  – 3:00pm";"Closed";"Closed";
1179403;"ST CECILIA";"440 NORTON RD";"COLUMBUS";"OH";43228;"FRANKLIN";6148783555;"http://www.stceciliacolumbus.org/";"lsmith@cdeducation.org";"Our school accommodates children of all races, gender and families of any faith as long as these families honestly seek and support the educational program and expression of the Catholic faith. We accept children with special needs if our facility and staff can accommodate their needs. We are able to do this through our SPICE (Special People in Catholic Education) program. The special funding helps the school to be able to offer special education services and gifted and talented services to the children of our school. We also offer tutoring services during the school day for those students who may, at any given time, be struggling in a particular area.

We offer the finest in technology with a computer lab, computers and interactive TVs in every classroom, and a rolling cart of laptops and iPads. We have a technology coordinator who instructs the students in computer basics and works with the classroom teachers on special projects.

St. Cecilia School was the first Catholic School in the Columbus Diocese to receive OCSAA accreditation. We also received the Doyle Memorial Fund Award in the 2004-2005 school year. This award was given in recognition of our work with children with special needs. We also received the Buckeye Healthy Schools Gold Award in 2005-2006 for our work in keeping our children healthy in our lunch program and physical education program.";"http://www.stceciliacolumbus.org/";"https://web.facebook.com/pg/saintceciliachurch/";;"http://www.stceciliacolumbus.org/get-involved/organizations/preschool/registration/";;;;"x";;;;"http://www.stceciliacolumbus.org/wp-content/uploads/2017/09/Logo_round.png";"9:00 a.m. to 3:15 p.m";"9:00 a.m. to 3:15 p.m";"9:00 a.m. to 3:15 p.m";"9:00 a.m. to 3:15 p.m";"9:00 a.m. to 3:15 p.m";"Closed";"Closed";
1179404;"ST CHARLES";"2175 W ELM ST";"LIMA";"OH";45805;"ALLEN";4192222536;"http://www.limacatholic.org/";"mbkrum@sccslima.org";"St. Charles Catholic School, in partnership with our parish, will provide a faith-filled environment which challenges students to become upstanding citizens, stewards and scholars through instruction and example.";"http://www.limacatholic.org/sccs/";"https://web.facebook.com/pages/St-Charles-Catholic-School/782299098474712?_rdc=1&_rdr";;"https://www.sccslima.org/admissions--26";"https://core-docs.s3.amazonaws.com/documents/asset/uploaded_file/217694/2018-2019_Handbook.doc__1_.pdf";;;"x";"x";;;"http://www.limacatholic.org/sccs/_elements/overlay-banner.png";"7:45am  – 3:00pm";"7:45am  – 3:00pm";"7:45am  – 3:00pm";"7:45am  – 3:00pm";"7:45am  – 3:00pm";"Closed";"Closed";
1179405;"ST CHRISTINE";"3125 S SCHENLEY AVE";"YOUNGSTOWN";"OH";44511;"MAHONING";3307924544;"https://www.stchristineschoolyoungstown.org/";"stchristineelem@youngstowndiocese.org";" Soon after the founding of the parish in 1953, plans were underway for the building of  St. Christine Elementary School. Ground breaking for a combination temporary church and ten classroom school took place on Sunday afternoon, March 28, 1954. After hard work and the anxieties accompanying any building project, the buildings plus a rectory and convent were blessed and dedicated on Sunday, November 13, 1955. The school had opened in September 1955. 

Significant to the development of the parish school was the presence of the Daughters of Charity of St. Vincent dePaul, from Emmitsburgh, Maryland. They had been invited to the Diocese of Youngstown by Bishop Walsh to staff two parishes, one of them being Saint Christine. In 1955, four Daughters came to Youngstown and opened the school. They lived temporarily at St. Brendan Convent until the newly constructed convent was finished. 

The school enrollment grew rapidly from 350 pupils the first year in 1955, to 650 pupils the following year. Accordingly the original 10 classrooms had to be expanded to 24 classrooms in 1957, and to 32 classrooms in 1960, when enrollment was nearly 1500 pupils.  Total cost of the school when it was completed was $845,000.

The Daughters of Charity provided a strong presence in the school and in the parish through those years. The highest number present at any one time was 17 when the school enrollment peaked at 1554 pupils in 1965. At that time there were 32 classrooms with half taught by a sister, and the other half taught by lay persons. As enrollment began to decline and as there were fewer sisters, competent and dedicated lay women especially took over the administration and teaching responsibilities in the school. In 1985 a pre-school was added. In 1988 the Daughters of Charity could no longer staff the parish school and left. Since then the Principal has been a lay woman and the total school staffed by competent lay persons. 

Over the years the school has reflected many changes and improvements in education and curriculum, with the addition of a pre-school, kindergarten, music, physical education, computers and art. Over the years, the school has often been recognized for its excellence and high academic achievement. Today it numbers close to 375 students, Kindergarten through eighth grade";"https://www.stchristineschoolyoungstown.org/";"https://web.facebook.com/pg/St-Christine-School-419304811499805/";;"https://www.stchristineschoolyoungstown.org/72";"https://www.stchristineschoolyoungstown.org/media/1/St_%20Christine%20Student%20Parent%20Handbook%20%20%202017-18(1).pdf";;;"x";"x";"x";;"https://static.radiuswebtools.com/templates/stchristineschoolyoungstown-org_clear/images/logo.png";"7:50 - 2:20";"7:50 - 2:20";"7:50 - 2:20";"7:50 - 2:20";"7:50 - 2:20";"Closed";"Closed";
1179406;"ST CHARLES BORROMEO";"7107 WILBER AVE";"PARMA";"OH";44129;"CUYAHOGA";4408865546;"https://saintcharlesschool.org/";"jayson.ptu.president@gmail.com";" Saint Charles Borromeo Catholic School is a faith community committed to sharing the responsibility of life-long faith formation and preparing students for the future with relevant and authentic experiences in a nurturing, Christian environment. ";"https://saintcharlesschool.org/";"https://web.facebook.com/pg/StCharlesPTU/";;"https://saintcharlesschool.org/documents/2018/1/New%20Student%20App.%202018%20-%202019.pdf";"https://saintcharlesschool.org/documents/2018/8/Family%20handbook%202018-2019%20with%20addendum.pdf";;;;"x";;;"https://saintcharlesschool.org/pictures/2017/12/schoollogo.png";"7:45 AM - 2:40 PM";"7:45 AM - 2:40 PM";"7:45 AM - 2:40 PM";"7:45 AM - 2:40 PM";"7:45 AM - 2:40 PM";"Closed";"Closed";
1179407;"ST CLAIRSVILLE ELEMENTARY SCHOOL";"120 NORRIS ST";"SAINT CLAIRSVILLE";"OH";43950;"BELMONT";7406950783;"http://www.stcs.k12.oh.us/";"amy.baugh@stcschools.com";"St. Clairsville High School is a public high school in St. Clairsville, Ohio, United States. It currently houses over 500 students in grades 9 through 12. It is the only high school in the St. Clairsville-Richland City School District. Their nickname is the Red Devils, and they compete in the Ohio High School Athletic Association as a member of the Buckeye 8 Athletic League as well as the Ohio Valley Athletic Conference.";"http://www.stcs.k12.oh.us/st.clairsvilleelementaryschool_home.aspx";"https://web.facebook.com/pages/St-Clairsville-High-School/106022422761667?_rdc=1&_rdr";"http://www.stcs.k12.oh.us/Contacts.aspx";"http://www.stcs.k12.oh.us/Registration.aspx";"http://www.stcs.k12.oh.us/ElementaryHandbook1.aspx";;;"x";;;;"http://www.stcs.k12.oh.us/sysimages/hdrLogo.png";" 8:45– 3:30 p.m";" 8:45– 3:30 p.m";" 8:45– 3:30 p.m";" 8:45– 3:30 p.m";" 8:45– 3:30 p.m";"Closed";"Closed";
1179408;"ST CLEMENT";"4534 VINE ST";"CINCINNATI";"OH";45217;"HAMILTON";5136412137;"http://www.stcschool.org/";"jmathews@stcschool.org";"St. Clement School is committed to the quality 
    education of children in partnership with their parents. We 
    strive to educate the whole person by promoting the spiritual, moral, physical, and intellectual development of each student 
    in a value-centered environment.


    We offer:

        Enrollment of 289 students (plus 30 in PreK) in 2018-19 school year 
        Small school family environment (average class size of 18)
        Rigorous academic programs including Algebra I, Accelerated Language Arts/Reading and foreign language instruction (Spanish in Grades K-8)
        Leveled Curriculum available in all grades to meet the learning styles and needs of all students
        GOOGLE Education Classroom utilized on all levels with a 1:1 Chromebook program in Grades 1-8 for all students
        Art and Music programs including Choir and Concert Band
        ""Jefferson Award"" winning Service Learning School
        Financial Aid available - We are also an approved EdChoice and Jon Peterson Scholarship Provider
        Call to schedule a tour or ""shadow"" day for your student
";"http://www.stcschool.org/";"https://web.facebook.com/pg/stcschool.org/";;"https://drive.google.com/file/d/111TvrYpgLhUqt5LC2YiKby0qru4GyYQ1/view";"https://drive.google.com/file/d/0B0kUnnj5yjctdi1fU3hlRG1yQ0k/view";;;"x";"x";;;;"7:30 A.M.  2:30 P.M.";"7:30 A.M.  2:30 P.M.";"7:30 A.M.  2:30 P.M.";"7:30 A.M.  2:30 P.M.";"7:30 A.M.  2:30 P.M.";"Closed";"Closed";
1179409;"ST COLUMBKILLE";"6740 BROADVIEW RD";"PARMA";"OH";44134;"CUYAHOGA";2165244816;"https://www.stcolumbkilleschool.org/";"dandexler@stcolumbkilleschool.org";"We believe our school exists to teach the mandate of Jesus: ""Love one another as I have loved you.""
 

To accomplish the vision we continually strive to build a community of faith in which the Christian message, the experience of community, worship and social concerns are integrated in the total experience of the students, their parents, and members of the staff.
 

We believe that Catholic faith formation and Catholic religious education are the purpose and focal point of our school. Faith values permeate all subject areas in the curriculum. We call our students to service not only to the Catholic community, but to other segments of society as well. Our school policies, programs, and day-to-day interaction proclaim the Gospel of Jesus. Thus we teach the foundations of Catholic belief and foster the development of prayer life, a sense of community, and concern for social justice.
 

We believe that we share the vision of Jesus within an atmosphere designed to celebrate and practice the love of God and neighbor. We motivate students to grow academically, culturally, and socially. Jesus remains with the community He formed, and we are privileged to witness and share that Presence.";"https://www.stcolumbkilleschool.org/";"https://web.facebook.com/pg/stcolumbkilleschoolfamily/";;"https://www.stcolumbkilleschool.org/registrationforms";"https://stcolumbkilleschool.org/documents/2017/8/FAMILY%20HANDBOOK%202017-18.pdf";;;;"x";"x";;"https://www.stcolumbkilleschool.org/pictures/2015/6/St.%20Columbille%20Logo%20smaller.jpg";"7:55 - 2:45";"7:55 - 2:45";"7:55 - 2:45";"7:55 - 2:45";"7:55 - 2:45";"Closed";"Closed";
1179410;"ST DOMINIC";"371 PEDRETTI AVE";"CINCINNATI";"OH";45238;"HAMILTON";5132511276;"https://www.stdominic-k-8.org/";"saintdominic@stdominicdelhi.org";"Welcome to St. Dominic School!  We are located in Delhi Township, 6 miles west of downtown Cincinnati.  The school, operated by St. Dominic Parish, is an Archdiocesan Roman Catholic elementary serving students in Pre-K through eighth grade.

St. Dominic School, “A Place to Grow”, proudly exists to serve the individual needs, both spiritual and educational, of the children of the parish and local community.

Our school strives to guide each student into becoming a faith-filled child of God through a strong religion program, numerous liturgical functions, active student ministries in the church and school, an emphasis on Catholic services and celebrations, an immersion in a character education program, and an active student-led Christian Service program.  Closely related to the spiritual development of each student is a strong academic program which utilizes differentiation as the groundwork to assist each child in recognizing his or her own potential. 

We are blessed with warm and caring staff members who are constantly searching for ways to grow professionally and spiritually.  Every year staff members apply for and received instructional grants to enhance their curriculum.  One of our teachers has attained National Board Certified Teacher while several others have received the NCEA Teacher of the Year Award for Region Six (Michigan and Ohio).  All faculty members serve on one of three school committees which work to continually improve every facet of the school. 

Knowing that the most important teachers for our students are their own parents, St. Dominic School strives to ensure parent support and involvement in many areas.  Each day parents volunteer in the building, work on PTO projects, or serve on the Education Commission.  The St. Dominic PTO has received the prestigious NCEA Home/School Award.

St. Dominic School has had the pleasure of witnessing the growth of many generations of students who are now doctors, engineers, attorneys, accountants, politicians, CEOs, and service persons.  Many of the graduates are faith-filled parents, grandparents, and great grandparents within the St. Dominic Parish community.  Since St. Dominic Parish opened its doors over seventy-five years ago, it is easy to see why St. Dominic School has become a place for children to grow.";"https://www.stdominic-k-8.org/";"https://web.facebook.com/stdominicdelhi/?_rdc=1&_rdr";;"https://www.stdominic-k-8.org/Portals/3/Files/Home/Preschool/Preschool%20Student%20Registration%20Form.pdf";"https://www.stdominic-k-8.org/LinkClick.aspx?fileticket=g8pNjtzBSCs%3d&tabid=307&portalid=3";;;"x";"x";"x";;"https://www.stdominic-k-8.org/Portals/3/StDominicSchoolLogo185.png";"8:00 a.m.-3:00 p.m";"8:00 a.m.-3:00 p.m";"8:00 a.m.-3:00 p.m";"8:00 a.m.-3:00 p.m";"8:00 a.m.-3:00 p.m";"Closed";"Closed";
